Datetime,Tweet ID,Username,Text,Links,URL
2021-01-01 16:02:58+00:00,1345037810760355842,n_ymiller,"@SecPompeo Ah yes. A cyber hack of the departments of Homeland Security, Commerce, Treasury, NIH &amp; State-undetected for 9 months. A raging pandemic with a botched vaccine rollout. Domestic terrorists blowing up city blocks on Christmas Day. So safe 🙄 https://t.co/cAcJSn3L06",,https://twitter.com/n_ymiller/status/1345037810760355842
2020-12-18 15:56:01+00:00,1339962630581047298,CaryHayes16,"@RoyBlunt @SenAlexander @NIH @US_FDA Please call a hearing into Russia's 8 month hack into our cyber infrastructure, &amp; why Trump has ignored this problem &amp; is so subservient to Putin?",,https://twitter.com/CaryHayes16/status/1339962630581047298
2020-12-18 02:54:22+00:00,1339765923146846209,FrancisWasHere,"USA / CYBERSECURITY / #SolarWinds NETWORK SOFTWARE HACK / CYBER-INTRUSION BREACH  OF MULTIPLE FEDERAL GOVERNMENT DEPARTMENTS: Washington Post: ""DHS, State and NIH join list of federal agencies — now five — hacked in major Russian cyberespionage campaign."" https://t.co/mFoXwGIYrt",https://www.washingtonpost.com/national-security/dhs-is-third-federal-agency-hacked-in-major-russian-cyberespionage-campaign/2020/12/14/41f8fc98-3e3c-11eb-8bc0-ae155bee4aff_story.html,https://twitter.com/FrancisWasHere/status/1339765923146846209
2020-12-17 04:48:12+00:00,1339432181597429762,okourgiantakis,"Russia’s massive hack demands a reckoning for US cyber defenses
Several fed agencies are already confirmed victims of the digital spying campaign carried out by Putin’s govt, which denies the incursion.
Includes: Depart's of Defense, State, HS, Treasury and Commerce, as well NIH.",,https://twitter.com/okourgiantakis/status/1339432181597429762
2020-12-16 14:53:51+00:00,1339222212113543172,sarahkendzior,"""Who did Russia hack this time? Treasury, Commerce, parts of the Pentagon, State Dept, NIH and thousands of businesses. Thanks to a breach with SolarWinds software, Russia has been cyber-spying on US agencies for almost nine months."" -- @gaslitnation https://t.co/4rL4exCKTl",https://www.patreon.com/posts/bill-barr-and-45091429,https://twitter.com/sarahkendzior/status/1339222212113543172
