Datetime,Tweet ID,Username,Text,Links,URL
2021-01-11 18:48:56+00:00,1348703455414771719,JosephR71231588,@Majestic_XRP @Schwarzenegger Wrong. Lost every case in court. Stop believing the lies. DOJ said no corruption. Cyber security said no corruption. Georgia Republicans said no corruption. Move on and stop whining.,,https://twitter.com/JosephR71231588/status/1348703455414771719
2021-01-11 17:14:59+00:00,1348679815029657600,RuelGolden,"@senrobportman AG, DOJ, FBI, CYBER ELECTION SECURITY, 50 States and going 1-63 in COURT CASES 

Not good enough. I got NEWS FOR YOU 

CON DON WOULD HAVE CALLED IT RIGGED IF GOD PERSONALLY HAND COUNTED THE VOTES.  That is who he is....if he does not like it FAKE NEWS, HOAX, RIGGED.",,https://twitter.com/RuelGolden/status/1348679815029657600
2021-01-11 14:07:00+00:00,1348632505763688449,JFrischling,"@DidPony They're asking you to prove that a fraud did NOT take place? They want more validation than what we've received from the FBI, DOJ, DHS, Cyber and 60 court cases?

I can offer them a ""pinky promise"" if you think that would help. I don't have anything more to give than that. https://t.co/LpNzFdfEpB",,https://twitter.com/JFrischling/status/1348632505763688449
2021-01-11 00:58:09+00:00,1348433983638544384,1nfiniteeBeyond,"@wrinkleonashirt @AOC No one was uncertain.  DOJ, Trump's Cyber Security team, FBI, GOP State officials, Supreme Court, Homeland Security and 63 fucking court cases all said that the fraud brought up by a man who's ego was to fragile to admit he lost was total bullshit.  And you ate it!",,https://twitter.com/1nfiniteeBeyond/status/1348433983638544384
2021-01-11 00:03:40+00:00,1348420275239591936,rustyztwo,"@ericmetaxas Steal an election?  You mean the president who asks multiple officials to break the law on his behalf? Who lies about fraud with no evidence and with his head of DOJ, election cyber security, FBI, and governors of all the swing states saying no fraud?",,https://twitter.com/rustyztwo/status/1348420275239591936
2021-01-10 23:09:42+00:00,1348406694104104962,JMac0987,"@KateWhitby56 @EncisFinest @NBCNews About 60 failed court cases, pronouncements from states election officials, the fact they certified their elections, the DOJ and cyber security pretty much made it pretty clear.",,https://twitter.com/JMac0987/status/1348406694104104962
2021-01-10 22:02:27+00:00,1348389770712338432,KimTruthMatters,"@Rainman2149 @60Minutes No! Trump did not win.  Could he have won? Sure, But he didn’t.  It’s simple math.  60 court cases, 50 states, republican &amp; democrat state officials, Trumps own director of cyber security &amp; Trumps own DOJ. THERE WAS NO MASS VOTER FRAUD.  The people voted overwhelmingly for Biden",,https://twitter.com/KimTruthMatters/status/1348389770712338432
2021-01-10 19:55:47+00:00,1348357894270554119,RightMindedUSA,"@parler_app @tedcruz @Jim_Jordan @michaeljknowles @SteveDeaceShow @glennbeck @StuDoesAmerica 🧵 Here is what I Isn’t that the purpose of the Cyber Division of the FBI to investigate these things?  Instead we have Google, Apple &amp; Amazon thinking they are the DoJ &amp; the Courts.",,https://twitter.com/RightMindedUSA/status/1348357894270554119
2021-01-10 19:47:56+00:00,1348355916287107073,Marshatoo,"@Doug_Moore @BethMooreLPM @MaQuettia The election was not stolen.  Supreme Court, Barr DOJ, cyber security, lower courts, election personnel.  The one calling it stolen is a con man who repeatedly said that before voting started, during voting, after voting.",,https://twitter.com/Marshatoo/status/1348355916287107073
2021-01-10 19:10:04+00:00,1348346387671429122,CharonBrad,"@kksheld @Smaldswell3 What happened on the 6th wasn't a protest it was Insurrection, a coup to steal an election which has been investigated &amp; litigated in court &amp; Trump lost 63 including 2 in front of SCOTUS! The election was deemed by the DOJ &amp; Cyber Security the most secure election in history!",,https://twitter.com/CharonBrad/status/1348346387671429122
2021-01-10 18:23:20+00:00,1348334625819652099,rcdoc,"@RobWittman MUST RESIGN. Even after the failed assault on the capitol, after the failed insurrection, Wittman still voted to back those who sought to subvert and overturn a fair election. The DOJ, the Trump cyber security dept., and state officials assured a fair election.",,https://twitter.com/rcdoc/status/1348334625819652099
2021-01-10 16:50:59+00:00,1348311386196217859,Benmzondo,"@realphilipdias @RepDeSaulnier I’ll take Trump judges, GOP election officials, GOP governors, head of Cyber, AG and DOJ as having validated Biden’s win. Lin Wood and other nuts won’t delegitimize Biden’s win over 7million more votes and cherry on the cake is him dragging GA senate losses as well.",,https://twitter.com/Benmzondo/status/1348311386196217859
2021-01-10 16:26:12+00:00,1348305150432210945,Benmzondo,"@realphilipdias @RepDeSaulnier No he won’t many many Trump judges, GOP election officials, GOP governors, head of Cyber, AG and DOJ say nothing untoward happened. All those voices against who? Lin Wood and the kraken come on man.",,https://twitter.com/Benmzondo/status/1348305150432210945
2021-01-10 11:03:27+00:00,1348223925734559744,brubu1220,"@imthatguy1776 @JonathanTurley I think the videos of the attack speak volumes. It certainly wasn’t peaceful. The faster Trump leaves office the better. He lost the election. The courts, DOJ, Cyber Security agency and state election officials all say the election was fair.",,https://twitter.com/brubu1220/status/1348223925734559744
2021-01-10 09:34:33+00:00,1348201555179180038,themavennews,"CYBER ATTACK ON U.S. DOJ DEPT. &amp; FED. COURT SYSTEM
We are told a Russian hack did it.
(world affairs) 
https://t.co/oDXbGAmesA",https://www.foxnews.com/politics/justice-department-federal-court-system-hit-russian-hack,https://twitter.com/themavennews/status/1348201555179180038
2021-01-10 07:50:51+00:00,1348175457594658816,Sanjoy08530018,I request to all please Ignore This NBFC BANK @AadharHousing avoiding. please Voice &amp; protest against this bank @barandbench @DoJ_India @cyber @Cyberdost @jagograhakjago @livemint @UNHumanRights @India_NHRC @CIJ_ICJ @sme1965 @AITCofficial @BJP4India @INTUCBengal @INCIndia @CPIM,,https://twitter.com/Sanjoy08530018/status/1348175457594658816
2021-01-10 05:43:31+00:00,1348143411614904320,TheRicoStandard,"The crowd was cover for Russian agents to get into the People’s House. The fact is, they were accompanied by WS. Why the fuck you think so many people were there? The DOJ was fucking hacked as this all took place a week after the head of cyber security for the nation is fired. https://t.co/SHAeN6X9bt",https://twitter.com/PamKeithFL/status/1347583216828477442,https://twitter.com/TheRicoStandard/status/1348143411614904320
2021-01-10 04:45:07+00:00,1348128716484964352,RealScience2020,"@Adam_Up_Bxtch @Brandy46495545 @PrisonPlanet States verified signatures, DOJ investigated reports of fraud, &amp; Dept of Homeland verified the cyber security: No mass fraud was found &amp; it was secure. Individuals were arrested for casting illegal ballots, but even that was not organized, widespread or in # to change results.",,https://twitter.com/RealScience2020/status/1348128716484964352
2021-01-10 01:36:13+00:00,1348081175588442114,Dragon40B,"@Tod95404969 @Alee45093329 @audrabrooks @scrowder I don't know what the fuck you are talking about here? His claims have been debunked over and over again by people both Democrats AND Republicans who run the election process, also judges, the DOJ and head of Cyber Security.",,https://twitter.com/Dragon40B/status/1348081175588442114
2021-01-10 00:12:06+00:00,1348060008014110721,cubasemoi,"President-Elect @JoeBiden needs to make a priority clearing out #DonaldTrump appointees in DOD, HHS, DOJ, Cyber-Defense, Treasury and Intel Agencies as a matter of national security. https://t.co/OZQNjKA07W",https://twitter.com/navybook/status/1347908922292768771,https://twitter.com/cubasemoi/status/1348060008014110721
2021-01-09 23:08:06+00:00,1348043903061123073,CharonBrad,"@Roj8881 @JuddPDeere45 @PressSec They already did, repeatedly! Guess what, no fraud found! 63 cases lost,  his lawyers admitting they weren't alleging fraud &amp; had no proof of fraud. DOJ &amp; Cyber Security both said most safe &amp; secure election in US history. You're only proof, Trump's repeated lies.",,https://twitter.com/CharonBrad/status/1348043903061123073
2021-01-09 23:03:53+00:00,1348042842497712130,DaveAShanks,"@Jim_Jordan Wrong side of history...traitor. No election rigging, no court finding voter fraud 0 for 60, all 50 state elections certified, DOJ no fraud, cyber-security “safest election ever”. WTF else do you need Jim?!

You enabled Trump’s election lie to the US and are thereby complicit!",,https://twitter.com/DaveAShanks/status/1348042842497712130
2021-01-09 20:04:58+00:00,1347997813926461440,imnotyourhoe,@ThomasFuller9 @HamillHimself Trump’s own administration found no evidence of any stolen election... his DoJ and DHS said everything was fair and square. His cyber security chief said he found nothing. Conservative judges he appointed threw his “witnesses” and “evidence” out of courts. what more do you want?,,https://twitter.com/imnotyourhoe/status/1347997813926461440
2021-01-09 19:54:11+00:00,1347995103802044416,cindy_cds2761,"@BenjaminEW @tedcruz @HoustonChron Then what you should have said is, "" there is no evidence of wide spread fraud in our elections"" The DOJ has said it. Head of Cyber Security has said it. And judges have said it.",,https://twitter.com/cindy_cds2761/status/1347995103802044416
2021-01-09 19:04:39+00:00,1347982637311299585,hippythug,"@HPeiffer @MacFarlaneNews If they loved I’m their country they would respect 62 cases thrown, Supreme Court ruling, DOJ, Hess of cyber security, Raffensperger all GOP telling everyone there was NO illegal activity in the election. Only illegal things have been from trump supportrs",,https://twitter.com/hippythug/status/1347982637311299585
2021-01-09 18:43:28+00:00,1347977305549905921,LoveSeymore,"The observation that Insurgent Terrorists were afforded privilege based on skin color, while valid, is a distraction from the complicity of police &amp; DOJ involvement, the fact they came prepared to take hostages &amp; hang VP Pence, the cyber security risks &amp; the Repub parties role. https://t.co/oF14ibLWOk",,https://twitter.com/LoveSeymore/status/1347977305549905921
2021-01-09 17:42:05+00:00,1347961858284810240,PearlsorPebbles,"@JaelJudges421 @J63733746 @AP So everyone is crooked (except Donald Trump) including his cyber security advisor, Dept of Homeland Security, DOJ, Attorney General and several of the judges he appointed.  I’ll be honest, that’s a bit far fetched isn’t it?",,https://twitter.com/PearlsorPebbles/status/1347961858284810240
2021-01-09 16:48:23+00:00,1347948343276822528,JunicusPublius,"- 62 court cases
- Numerous recounts
- Numerous signature audits
- Numerous appeals to state legislatures
- US Cyber Security ""safest election yet""
- B Barr DoJ ""no significant fraud found""
- Loss by 7M votes, 74 EC votes

THERE ARE NO LEGITIMATE ELECTION  ISSUES!!!! BIDEN WON!!!",,https://twitter.com/JunicusPublius/status/1347948343276822528
2021-01-09 15:56:31+00:00,1347935292632821772,CDidjeridu,"@mubazieric @JoeBiden Also two SCOTUS 9-0, one DOJ nation-wide investigation that resulted zero fraud findings, not to mention Homeland Security, Cyber Security, FBI, CIA etc

...and a very dead Hugo Chavez 😅",,https://twitter.com/CDidjeridu/status/1347935292632821772
2021-01-09 11:09:07+00:00,1347862966155190276,LynneWCarey,"Repeating &amp; joining in the Big Lie of election fraud when it was dis-proven by Cyber Security, DOJ and judges all the way to the SCOTUS divided the nation. False claims of a way to overturn the election &amp; call to arms cause 1/6. 
They made difference of opinion into insurrection. https://t.co/pfjXEybzS3",https://twitter.com/kylegriffin1/status/1347762522787512322,https://twitter.com/LynneWCarey/status/1347862966155190276
2021-01-09 07:48:33+00:00,1347812488755224576,GarethJo,"@TruthDG19 Yeah, me &amp; most sane individuals that aren’t sheep that believe conspiracy theories. Not to mention the DOJ, every court the “cases” have been presented to, the cyber security task force, oh &amp; the Supreme Court. As well as any well respected media outlet around the world.",,https://twitter.com/GarethJo/status/1347812488755224576
2021-01-09 04:20:51+00:00,1347760219321901059,genteelhart,"@TournelHenry @poedoepie @williamlegate @fdroidorg They can, but the further we can drive them underground, the harder it is for them to reach casual haters. And I hope cyber security and investigation is a high priority in the Biden DOJ.",,https://twitter.com/genteelhart/status/1347760219321901059
2021-01-09 01:37:53+00:00,1347719208944209920,Deadbolt019,"@rob_sheridan Trump can't be shown to handle the responsibility of social media sites yet still has full access to the DoJ, our nuclear arsenal and our cyber warfare systems.",,https://twitter.com/Deadbolt019/status/1347719208944209920
2021-01-09 00:04:10+00:00,1347695624305700866,JunicusPublius,"@marcorubio 
- 62 court cases
- Numerous recounts &amp; signature audits
- Numerous appeals to state legislatures
- US Cyber Security Chief said safe election
- B Barr DOJ said investigations showed no mass fraud
- 81M Biden votes to 74M Trump
- 306 Biden EC votes.
.... https://t.co/7K14yfuoxF",https://twitter.com/marcorubio/status/1347189693310513153,https://twitter.com/JunicusPublius/status/1347695624305700866
2021-01-08 23:27:57+00:00,1347686511513374721,gerarddockery,"@GregWitt5 @RepAndyBarr Yet nobody, no election officials, no cyber experts, no FBI personnel, no DoJ personnel, no judges can see it . only Trumpists. Have yet got some kind of special glasses with x-ray qualities to see what nobody else sees.",,https://twitter.com/gerarddockery/status/1347686511513374721
2021-01-08 20:46:36+00:00,1347645906166841344,epesquivi,"@craigkaold @MeghanMoran16 @ValerieinOC @AP Locally no evidence of voter/system fraud, court cases filed same, Trumps lawyers in court &amp; briefs same, affidavits mentioned many were false. Trumps cyber security, FBI, DOJ no widespread voter/system fraud. Senators couldn’t get hands on evidence. But you say there evidence!",,https://twitter.com/epesquivi/status/1347645906166841344
2021-01-08 20:39:47+00:00,1347644190767927300,Tina23870745,@AnitaLinekin @poopedpoop1 @eugenegu @realDonaldTrump Is there something wrong with you ? Voter fraud has been investigated !!!  OVER and Over Again!!! The DOJ the head of cyber security the Supreme Court the state court ALL said NO evidence of fraud!!!!  Do you understand that ?,,https://twitter.com/Tina23870745/status/1347644190767927300
2021-01-08 19:22:12+00:00,1347624664550551559,strayfawn,"@LabyrinthWeaver Everyone in this video should be under arrest NOW. Why the Pentagon shake up. Why the weak cyber security. Why undermine DOJ. 
#ArrestTrumpNow #arrestTrumpCrimeFamily #TrumpMobCriminals",,https://twitter.com/strayfawn/status/1347624664550551559
2021-01-08 19:07:59+00:00,1347621085412532225,bacardiintheusa,"@amawrcoach @TheBabylonBee y’all have been given recounts, re-recounts, audits, 60+ opportunities in court (in which fraud wasn’t even alleged!). republican election officials, republican judges, republican cyber security officials, the fbi, the doj, and bill barr all say it was fair. 2/3",,https://twitter.com/bacardiintheusa/status/1347621085412532225
2021-01-08 16:30:12+00:00,1347581378737692672,Schiefer4,@clw748 @_HowieDoo @mcgough_alan @BrandonBeckham_ @realDonaldTrump We're not being spoon fed by the media. We're listening to the governor of GA that Trump endorsed. We're listening to Bill Barr and the DOJ. We're listening to the head of the cyber security team trump created. And we're listening to dozens of judges in over 60 court cases. https://t.co/ohCvFJmSbt,,https://twitter.com/Schiefer4/status/1347581378737692672
2021-01-08 16:20:16+00:00,1347578879389683714,1nfiniteeBeyond,"@NewHomesJared @simonschuster @HawleyMO 62 court cases, many with Trump judges. 2 cases in Supreme Court with 3 Trump justices. The FBI and DOJ with Trump loyalist AG Barr. Homeland's Cyber Security Team and lifelong GOP officials and Trump supporters like Raffensberger, Kemp and Ducey saying ""NO Fraud"" wasn't enough?",,https://twitter.com/1nfiniteeBeyond/status/1347578879389683714
2021-01-08 15:06:08+00:00,1347560223213563904,TheGent30879191,"We are a Rudderless Ship No Captain at the Helm.  Trump abandoned the helm &amp; fled leaving the Republic to fend against domestic insurgents attacking the Capitol, An out of Control Covid Pandemic, Russian cyber attacks, QANON, Conspiracy theories, Damaged  DOJ , a divided Nation ! https://t.co/mV30dD3b0i",https://twitter.com/gtconway3d/status/1347390614682411008,https://twitter.com/TheGent30879191/status/1347560223213563904
2021-01-08 13:57:56+00:00,1347543060251553792,1nfiniteeBeyond,"@TheWakingSheep @mtgreenee @JessieJaneDuff @realDonaldTrump Trump's DOJ, FBI, cyber security team and judges he appointed in 63 cases including 3 justices in the Supreme Court's 2 cases and lifelong honorable GOP officials running elections all say Trump is lying to you.",,https://twitter.com/1nfiniteeBeyond/status/1347543060251553792
2021-01-08 13:10:38+00:00,1347531155931885569,pblowe2,@CyndiKorak @BillOReilly @NoSpinNews You’re convinced-now convince-(1) State election officials-(2) the Secretaries of State-(3) Governors-(4) State Supreme Courts-(5) DOJ/cyber security-(6) the SCOTUS-Then I’ll be convinced too,,https://twitter.com/pblowe2/status/1347531155931885569
2021-01-08 12:41:03+00:00,1347523713739202563,Shaybee322,"@tedcruz @AOC Election integrity? On an election that this administration’s cyber head said was the “safest in history” that this DOJ said there was no massive fraud? You know that Joe Biden won fairly, but you continued to bolster the lies that fired these people up #BloodOnYourHands",,https://twitter.com/Shaybee322/status/1347523713739202563
2021-01-08 11:44:16+00:00,1347509424038940673,280s_Not_Enough,"It was expected by anyone with intelligence, internet &amp; cable news access. Problem is, Trump kneecapped DoD, DOJ, FBI, cyber security, &amp; thought he had it planned out. We were lucky it didn’t succeed. All their social media feeds are prepping for Jan. 19/20. https://t.co/i900yjkUOT",https://twitter.com/Numbers28/status/1347453128594120704,https://twitter.com/280s_Not_Enough/status/1347509424038940673
2021-01-08 05:25:23+00:00,1347414073072181248,RuelGolden,"President Trump called you LYIN TED Cruz!  I disagreed until I watched you help Fan the Flames 🔥 of a coup. You know better! What is wrong with you? You don't believe OUR AG, DOJ, FBI, CYBER ELECTION SECURITY, 50 States, 1-60 in court.  Can you be A LIAR and DUMB ASS?",,https://twitter.com/RuelGolden/status/1347414073072181248
2021-01-08 04:07:07+00:00,1347394375639302144,nednooby,@Thankful4Usa @mofw_usa @jennfranconews @OANN @USPS It's not talking points. It's what your side hates. Indisputable FACTS. Trump's cyber security team/DOJ studied the election and concluded no fraud. How do you explain that away? Were they in on it? It falls apart right there. He lost.,,https://twitter.com/nednooby/status/1347394375639302144
2021-01-08 03:29:07+00:00,1347384814052118532,Chris62619507,"@PrettyEmpress66 @RoseanneWoods12 @starbalt @realjunsonchan @realDonaldTrump If you believe that all the judges who ruled on his cases, the SCOTUS (3 appointed by trump), the head of cyber security, the FBI, the DOJ, Bill Barr, most the members of his own party, are ALL lying to you and Trump is the only one telling the truth, than you are brainwashed.",,https://twitter.com/Chris62619507/status/1347384814052118532
2021-01-08 01:10:44+00:00,1347349988565606403,UnorthodoxPop,"The Office of Cyber Security must immediately work with the DOJ to monitor and appropriately censor #Parler .

Much of the speech is NOT protected and can be construed as conspiratorial and/or insurrectionist.

#WordsMatter 

#DemocracyMatters",,https://twitter.com/UnorthodoxPop/status/1347349988565606403
2021-01-07 23:07:04+00:00,1347318866247114754,76_Winston,"@0Space0Monkey0 @dwesw3 @CNN Be honest with yourself-how many courts? Elected (Republican) officials, cyber security experts, the DOJ, Chris Krebs. Yet Don the con persists in this narrative (predictably) for his own gain. Raising easily debunked lies over and over and over again.",,https://twitter.com/76_Winston/status/1347318866247114754
2021-01-07 22:57:18+00:00,1347316406979883008,shakalee1,"@Mrcool327 @chuckwoolery Please list your sources as proof that there was a stolen election. The FBI, DOJ, appellate courts and Chief Cyber Security expert all said it was the safest election we’ve had. Note that rules were understandably modified due to COVID.",,https://twitter.com/shakalee1/status/1347316406979883008
2021-01-07 22:41:33+00:00,1347312444100796422,sis_boom_baaah,"Biden stacks DOJ against GOP
Merrick Garland &amp; Deputy Specialists in
Civil Rights
Public Corruption
Corporate Fraud
Cyber Security
Chief Staff FBI
Counter Terrorism
Police Abuses...
#GOPCorruptionOverCountry 
https://t.co/wPJvzSpegb via @YouTube",https://youtu.be/B47LsYhJjxE,https://twitter.com/sis_boom_baaah/status/1347312444100796422
2021-01-07 21:40:40+00:00,1347297125110046721,ExecutiveGov,Marc Raimondi: SolarWinds Cyber Incident Involves Access to DOJ’s Email Environment https://t.co/npzuRsegmE,https://www.executivegov.com/2021/01/marc-raimondi-solarwinds-cyber-incident-involves-access-to-dojs-email-environment/,https://twitter.com/ExecutiveGov/status/1347297125110046721
2021-01-07 21:17:24+00:00,1347291268632760320,Dog47Sam,"@intheMatrixxx @martingeddes @POTUS @realDonaldTrump He doesn't have an Insurgency, he has a Cyber Pearl Harbor. The Joint Chiefs have responsibility to respond in defense to such an attack, while the DOJ deals with the 5th Columnists who opened the gates and waved them in.",,https://twitter.com/Dog47Sam/status/1347291268632760320
2021-01-07 19:29:12+00:00,1347264039680839680,TheePurity,"I am confident DOJ is up to all challenges (racial injustice, cyber, etc)

We will reaffirm the integrity of DOJ. Thank you PE and MVP for the honor to return home to the Department of Justice",,https://twitter.com/TheePurity/status/1347264039680839680
2021-01-07 18:35:00+00:00,1347250399674294273,emmibevensee,"In his video @RQueeninc also claims, “it’s not like I was talking to the FBI,” which he absolutely was. In addition to the DoJ and a Polish cyber crimes division (that works in child abuse content) (please dl the video) https://t.co/RNcyfDSCkG",https://tora3.com/video/c0268e561782668031fa018b68f662c9,https://twitter.com/emmibevensee/status/1347250399674294273
2021-01-07 18:14:43+00:00,1347245296208785409,Pixiedust196510,"@ProWorkingMom @dcholland_89 @VillainChrisK @TonyJackson5 @realDonaldTrump Every vote was validated. By audits and hand recount.  I know you can't stand the fact that your candidate lost but facts are facts backed up by 60+ judges, DOJ, FBI, Homeland security and their cyber division. So sorry but Biden is 46th president",,https://twitter.com/Pixiedust196510/status/1347245296208785409
2021-01-07 17:49:45+00:00,1347239009597190148,sherritxoxo,"@Roshan_Rinaldi @Dr_AmyD He’s just trying to cover his ass. He helped plan &amp; advised him on how to do it, with whom to do it &amp; when, hence the firings at the DOJ, Cyber &amp; Homeland security. Then he planned his day of departure. He did it that way so he could avoid disbarment. He’s no hero",,https://twitter.com/sherritxoxo/status/1347239009597190148
2021-01-07 17:22:50+00:00,1347232238396604417,Keithmwil,"@Suzy4242 @TheRealArtBlack @benshapiro Ahh the head of cyber security, dhs and DOJ have said no fraud. Look at Kentucky there are a bunch irregularities but nobody accused Kentucky of helping trump. McConnell had an 18% approval rating before election and won with 57% and out preformed any of his other races in dem",,https://twitter.com/Keithmwil/status/1347232238396604417
2021-01-07 17:20:36+00:00,1347231677475663874,AJBlackston,Cyber Beacon Provides Venue for Sharing Innovative Approaches to Top Strategic Challenges https://t.co/OSIuDsSiFV #USGovernment #News #FEMA #DoED #DOL #BLS #OCC #State #DOI #DOC #DOJ #USDA #FBI #Treasury #DHS #VA #HHS Please Retweet,https://media.defense.gov/2021/Jan/06/2002560857/825/780/0/200630-F-UE756-1025C.JPG,https://twitter.com/AJBlackston/status/1347231677475663874
2021-01-07 16:49:08+00:00,1347223758931709953,geoffjohnson64,"@DanScavino @kayleighmcenany How can you continue to say the facts bear out the Trump won?  His own DOJ,  Cyber Command, FBI etc all say no major fraud. And his legal reps never showed proof in a court of law, and even Trump appointed judges threw out his lawsuits. WTF?",,https://twitter.com/geoffjohnson64/status/1347223758931709953
2021-01-07 15:42:45+00:00,1347207051257262081,JackTor62774757,"@TraderWeekend @bryanbehar They think that because the leader of the country is saying that. 50+ court cases , the doj, the fbi, cyber security, and the AG says otherwise.",,https://twitter.com/JackTor62774757/status/1347207051257262081
2021-01-07 15:13:27+00:00,1347199677645475841,BradRadly,"@Worriedameric10 @Mike_Pence So much fraud, and so much evidence.  Obviously it's been misplaced cause the Trump legal team, the DOJ and the cyber crimes can't find it. The only talk of evidence comes from OANN, the National Enquirer and the Weekly World News. Such credible sources",,https://twitter.com/BradRadly/status/1347199677645475841
