Datetime,Tweet ID,Username,Text,Links,URL
2021-01-03 05:49:53+00:00,1345608299186569216,jxf74,"@mtgreenee @JoeBiden @realDonaldTrump Sweetheart, every state has certified their results, every governor and Secretary of State has signed. The DOJ has said there’s no evidence of fraud. Trump’s own cyber security head called it safest election ever (then he got fired). Dems live in reality. Trump lost. Get over it",,https://twitter.com/jxf74/status/1345608299186569216
2021-01-03 05:12:11+00:00,1345598812904169472,coughdrop2270,"@bkempjr07 @SethAbramson @realDonaldTrump You're willing to kill people who voted for Biden, and demand our votes be respected? He lost all court cases-even w/HIS own judges. His DoJ said no fraud. His cyber security said no fraud. Lt. Gov of TX offers $1 million reward for evidence of fraud. Nobody got it.",,https://twitter.com/coughdrop2270/status/1345598812904169472
2021-01-03 04:04:20+00:00,1345581737951322112,coughdrop2270,"@Greeney17595412 @FamousBL3 @CrynJohannsen It won't change the fact trump lost. Cries fraud, promises evidence, delivers none
60 judges, many his appointees-No fraud
Head of cyber security -No fraud (fired for it)
HIS DoJ- No fraud
Lt. Gov. of TX offers $1m reward for evidence of fraud - still, No fraud
Sore loser? Found!",,https://twitter.com/coughdrop2270/status/1345581737951322112
2021-01-03 03:47:25+00:00,1345577478643994631,BluesPetal,"@mtgreenee @JoeBiden @realDonaldTrump Because psychotic delusional and magical thinking is not the same as credible allegations. Besides - Dems pushed bills for election integrity and Republican Senators voted it down. Why is that? DOJ, the courts, cyber security all concluded no fraud. Please just stop. https://t.co/CUDAvpTEv2",,https://twitter.com/BluesPetal/status/1345577478643994631
2021-01-03 03:24:52+00:00,1345571803389972480,EkOngKaarM,"@TinoFV @lisamurkowski When the AG, the DOJ, the Head of Cyber Security focusing on the election, multiple state governors and courts all clearly state that there was no fraud, that this election was one of the most free, fair and secure elections in US history, there is nothing to investigate.",,https://twitter.com/EkOngKaarM/status/1345571803389972480
2021-01-03 02:22:00+00:00,1345555983007932417,KtownLiberal,"@inhofeforsenate @realDonaldTrump What about the 60 failed GOP lawsuits, the recounts, the audits, the Government’s top cyber security official, election officials (even GOP ones!), and the DOJ statement have you not understood? #TrumpLost #BidenWon",,https://twitter.com/KtownLiberal/status/1345555983007932417
2021-01-03 02:01:31+00:00,1345550830590681099,MandySue104,"@Mark57322351 @psyane @DarleneLewis100 @realDonaldTrump They are against Trump, because he’s a crook, and a grifter who’s full of lies. You can go look up all of the court cases in the .gov website. Just listen to DOJ, FBI, US Courts, USAG, US CYBER SECURITY, and HEADS OF STATES. Many voted for Trump, so why would they lie about it?",,https://twitter.com/MandySue104/status/1345550830590681099
2021-01-03 01:49:40+00:00,1345547846670573568,klgray12,"@realDonaldTrump Apparently you all have forgotten about thr Russia hack that got your lame duck ass in thr white house to begin with? The DOJ, FBI, office of Cyber Security and rhr Attorney General have all declared this thr safest election to date, with absolutely no interference.",,https://twitter.com/klgray12/status/1345547846670573568
2021-01-03 01:27:45+00:00,1345542331072708608,3000Cyber,"@newstem61 @PhillDKline That the sheriffs, FBI, DoJ, courts &amp; media aren't anywhere is a pretty clear indication that there is no fraud.

But don't take my word for it, take the word of Trump's own DHS, AG, and head of cyber-security.",,https://twitter.com/3000Cyber/status/1345542331072708608
2021-01-03 00:13:10+00:00,1345523562740916225,johnprout1,@MariaBartiromo @Jim_Jordan @SenTedCruz @SundayFutures @FoxNews @RepMoBrooks @mtgreenee @RepVernonJones @sendavidperdue @Perduesenate There’s nothing 104 republican representatives or senators are opposing that the courts haven’t already rejected 51 times and been rejected by Trumps DOJ FBI AG Barr cyber security administration,,https://twitter.com/johnprout1/status/1345523562740916225
2021-01-03 00:09:51+00:00,1345522726073552897,CalHN,"@LLinWood 3 recounts, AUDIT, signature verification ALL CONFIRMED NO FRAUD!! Lin WOOD is the one promoting Sedition! NO FRAUD per Govenors, SOS, DOJ, FBI, U.S. Dept Cyber and 97 JUDGES!! NO FRAUD! Anyone repeating WITHOUT EVIDENCE of fraud is trying to form a dictatorship just like HITLER!",,https://twitter.com/CalHN/status/1345522726073552897
2021-01-02 23:31:35+00:00,1345513097545588736,12Fan22,@chriswoodson @lisacwright63 @mcmackelbunion @Antifascist4all @TheRightMelissa @HawleyMO My guy you are so close you were Sooooooo close......that’s it THERE IS NO EVIDENCE......🤦🏽‍♂️ you just said the Supreme Court saw no evidence just like the DOJ just like cyber security just like those election officials. Not everyone is corrupted my guy,,https://twitter.com/12Fan22/status/1345513097545588736
2021-01-02 23:29:22+00:00,1345512538541334530,PersonalAlchem,"Maybe YOU could show some courage &amp; uphold our election process, @MarshaBlackburn &amp; @BillHagertyTN  We, the people, voted for Biden. The courts, the cyber-security Dept. of DOH, the DOJ &amp; Sec. of States &amp; elections officials have all said it was legit. Uphold democracy, Senators! https://t.co/oKOITDMsPU",https://twitter.com/BeschlossDC/status/1345507101028872193,https://twitter.com/PersonalAlchem/status/1345512538541334530
2021-01-02 23:29:03+00:00,1345512460678275073,BillFitzsimmon9,"@hartman4112 @JasonSp67587224 @marklevinshow So after 60 court cases that were either lost or tossed out without evidence, in state , federal and the US Supreme Court, it’s over MAGA.. the DOJ, our cyber security task force and our election committees have declared this the most secure election ever..love your tears",,https://twitter.com/BillFitzsimmon9/status/1345512460678275073
2021-01-02 22:42:33+00:00,1345500757206970370,MandySue104,"@Mark57322351 @psyane @DarleneLewis100 @realDonaldTrump So, it’s easier for you to believe that DOJ, FBI, USAG, US Cyber Security, 60 Fed Courts &amp; SCOTUS (many Trump appointed judges), and State officials are corrupt than to believe 1 proven liar and grifter is scamming you? WTH, Dude? 🤣😂🤣",,https://twitter.com/MandySue104/status/1345500757206970370
2021-01-02 22:29:25+00:00,1345497454159028225,MandySue104,"@realLouBecker @Jessferg2253 @GodBlessTheUS20 @GhostOdins @realDonaldTrump @HawleyMO They already have. 🙄🙄🙄 They aren’t going to let Trump’s attorneys seize the machines, but they’ve already investigated everything. DOJ, FBI, USAG, FED COURTS, SUPREME COURT, US CYBER SECURITY, and state officials have found no widespread fraud. Why trust Trump over them? SMDH!",,https://twitter.com/MandySue104/status/1345497454159028225
2021-01-02 22:28:24+00:00,1345497196418875392,RuelGolden,"@Barndabas @GovMikeHuckabee You can't support Constitution and be for Trump. Calling election rigged when AG, DOJ, FBI, Cyber Election Security, 50 States, Electoral College, and going 1-59 in courts and now trying to overthrow our system of government. Added 2 trillion to National Debt in his first 2 years",,https://twitter.com/RuelGolden/status/1345497196418875392
2021-01-02 21:50:42+00:00,1345487710975361025,CareyConley1,"@Tal1J @rrware @realDonaldTrump Bullsh*t. There's nothing ""fair and balanced"" about believing that multiple REPUBLICAN state governors, SoS, elections officials, the (R) DOJ, (R) Homeland security, (R) cyber experts, joined the Dems in some interstate election fraud scheme that left not one shred of evidence.",,https://twitter.com/CareyConley1/status/1345487710975361025
2021-01-02 21:00:10+00:00,1345474991010279429,Churchofdontbea,"@TheRealMarcoMue @Amanda60761171 @HEMPRESS @itsJeffTiedrich @realDonaldTrump By media you mean every court, fbi, DOJ, DHS, cyber security dept, election official and recount?",,https://twitter.com/Churchofdontbea/status/1345474991010279429
2021-01-02 20:33:11+00:00,1345468199958142977,VickiEngel11,"@freedom0utlaw76 @KevinShindoll @LindseyGrahamSC @HawleyMO 81 million more know that Biden won in the most secure election in history! No evidence of voter fraud or a “Rigged” election! Ask Trump’s own cyber security director, Christopher Krebs &amp; DOJ Bill Barr! 7M more votes for Biden! https://t.co/XR48mPdSQp",,https://twitter.com/VickiEngel11/status/1345468199958142977
2021-01-02 20:16:59+00:00,1345464124210343940,spfcyberlaw,"5/ FISA applications by DOJ, especially when we wanted to attempt novel approaches to surveillance of complex cyber actors. Add to that the significant compliance requirements that fall upon FBI agents who do successfully obtain FISA authorization, and there exist significant...",,https://twitter.com/spfcyberlaw/status/1345464124210343940
2021-01-02 19:51:59+00:00,1345457831911305217,Joconfil,"@abosc33 @McCormackJohn Trump’s own lawyers said no fraud, plus his own DoJ, and his own cyber director. Why investigate something that didn’t happen? Are you insane?",,https://twitter.com/Joconfil/status/1345457831911305217
2021-01-02 19:50:07+00:00,1345457363730526209,JoanneBartone,"@Annisa59977139 @comilady @HandsomeJack71 @HawleyMO the courts, with tRUMP-appointed judges, the refv&lt;ckkklicon DOJ, Secretaries of State and Cyber Security all say #NoFraud. but you keep drinking the koolaid and sending money though! https://t.co/1fj1xfR4AF",,https://twitter.com/JoanneBartone/status/1345457363730526209
2021-01-02 18:56:59+00:00,1345443990284480513,MaureenLS,"@tedcruz Do you remember when you called Trump a pathological liar? You claim the AG lied, FBI lied, DOJ lied, Cyber Election Security lied, 50 states lied, the courts lied. Meanwhile, you believe Trump and his bootlickers are the only ones telling the truth https://t.co/ymJcoxLlJf",https://twitter.com/AMarie39755365/status/1296406875416801280,https://twitter.com/MaureenLS/status/1345443990284480513
2021-01-02 18:47:51+00:00,1345441691533152256,Oneworl97763898,"@RealMattCouch If there was true fraud then why have Trumps people lost 60 court cases, Even when before Trump nominated judges? His DOJ, his cyber security, gop governor’s and SoS say there was no fraud, but because Trump(a known liar) says there was fraud logical people believe him over facts",,https://twitter.com/Oneworl97763898/status/1345441691533152256
2021-01-02 18:25:40+00:00,1345436110235856896,MaureenLS,"@blazingkarin @ericswalwell Nothing! They are saying the AG lied, FBI lied, DOJ lied, Cyber Election Security lied, 50 states lied, and the court cases 1-60 which received no evidence are corrupt. Meanwhile, they believe Trump and his bootlickers are the only ones telling the truth😡",,https://twitter.com/MaureenLS/status/1345436110235856896
2021-01-02 18:14:00+00:00,1345433174063636481,12Fan22,"@lisacwright63 @mcmackelbunion @Antifascist4all @chriswoodson @TheRightMelissa @HawleyMO And btw their are way more ways to verify a vote than just a signature.......excuse me can I get a response from you on this one question. How do you not believe the Supreme Court, the DOJ, homeland security, cyber security, election officials, governors, supreme courts of state",,https://twitter.com/12Fan22/status/1345433174063636481
2021-01-02 18:04:31+00:00,1345430787936690176,3000Cyber,"@wecelebsknow @GrahamCC @vigilantisempe @stephenfhayes For example? Seriously, what examples do you have that the DHS, Bill Barr, Trump's own head of cyber-security, the FBI, the DOJ and Republican election officials in multiple states, have missed?",,https://twitter.com/3000Cyber/status/1345430787936690176
2021-01-02 17:59:37+00:00,1345429557030039559,12Fan22,"@lisacwright63 @TheRightMelissa @HawleyMO Lisa are you okay????? Does that make sense to you??? If the democrats cheated why is the DOJ, The Supreme Court, Election officials, Homeland Security, Cyber Security, ALL SAYING THERE WAS NO FRAUD??? Please explain that",,https://twitter.com/12Fan22/status/1345429557030039559
2021-01-02 16:50:28+00:00,1345412151213744131,MaleneDreams,"@CawthornforNC You cannot be serious. You're ignoring the DOJ, Bill Barr, Mike Pompeo, Circuit Courts, Federal Courts, The Supreme Court, Republican Governors, Republican Secretaries of State, the Head Cyber Security and anyone else who says this was a free and fair election.",,https://twitter.com/MaleneDreams/status/1345412151213744131
2021-01-02 16:17:41+00:00,1345403901227401217,sgarlato,"DOJ National Security Boss Is Moving On — But Cyber, China Threats Aren't https://t.co/1NBh5a9uZ2",https://www.npr.org/2020/12/31/951229709/doj-national-security-boss-is-moving-on-but-cyber-china-threats-arent?utm_campaign=storyshare&utm_source=twitter.com&utm_medium=social,https://twitter.com/sgarlato/status/1345403901227401217
2021-01-02 15:01:59+00:00,1345384850740621314,imnotyourhoe,"@heather14507499 @Robb_Wexler @BernardKerik @michellemalkin @GovKemp Zero evidence to any of that, and Trump’s own administration, from his DOJ to his cyber security chief, have said it was completely clean but none of that matters because your cult leader lost and your brain just can’t comprehend something so simple...",,https://twitter.com/imnotyourhoe/status/1345384850740621314
2021-01-02 13:54:29+00:00,1345367866116227073,dmgomes4,"@gregkellyusa @LLinWood It’s humorous to me that after illegal spying, election fraud, fake impeachment, cyber warfare, Russia collusion, ballot harvesting, Omar, Cuomo, Pelosi, Schumer, Schiff, Nadler corruption, censorship, foreign interference, &amp; corrupt SCOTUS, DOJ, FBI and CIA, that Lin is crazy.",,https://twitter.com/dmgomes4/status/1345367866116227073
2021-01-02 07:39:40+00:00,1345273540363366400,Pixiedust196510,"@NWestNomad @Chasz18389602 @LLinWood Let's see if this makes sense, DOJ, FBI, Homeland security and its cyber division,  state AG's, and election official have all said no fraud.  Georgia counted recounted 3 times, WI did an audit and PA did an audit and it was the same so I would say its safe to say Biden won",,https://twitter.com/Pixiedust196510/status/1345273540363366400
2021-01-02 07:17:41+00:00,1345268005966663680,GriffinEcho2404,"@Maritimer71 @danjs1975 @nomoretrump45 @JennaEllisEsq Actually none of the judges have said there was no evidence of fraud, the DOJ hasn't looked at evidence or investigated nor did they state there isn't any and the Cyber chief didn't actually say it someone beneath him did and they also resigned.",,https://twitter.com/GriffinEcho2404/status/1345268005966663680
2021-01-02 05:54:29+00:00,1345247071230709761,PVynckier,"DOJ National Security Boss Is Moving On — But Cyber, China Threats Aren't | WAMU https://t.co/zZ05jFeQQW",https://wamu.org/story/20/12/31/doj-national-security-boss-is-moving-on-but-cyber-china-threats-arent/,https://twitter.com/PVynckier/status/1345247071230709761
2021-01-02 02:29:34+00:00,1345195501138964480,Maritimer71,"@danjs1975 @nomoretrump45 @JennaEllisEsq Let's see now...all states have certified the results.  The chief of cyber security,  DOJ, around 80 judges including SCOTUS have all said there is no evidence of fraud.
Biden got over 7 million more votes..if you dispute these facts you're dillusional",,https://twitter.com/Maritimer71/status/1345195501138964480
2021-01-02 02:20:54+00:00,1345193318418968577,DeanaKindt,BREAKING: Cyber-security team releases photo from the forensic audit of a Dominion Voting Machine. FBI &amp; DOJ must begin investigations immediately❗️@realDonaldTrump #BidenWillNeverBePresident #BidenCheatedAndGotCaught #BidenCheated2020 @senatemajldr @SenWilliamLigon @SenTedCruz https://t.co/O4BuvuJLz9,,https://twitter.com/DeanaKindt/status/1345193318418968577
2021-01-02 01:34:01+00:00,1345181522643410944,RuelGolden,"@HawleyMO @SenSanders @realDonaldTrump Is Hawley saying AG lied, FBI LIED, DOJ Lied, Cyber Election Security Lied, 50 states lied, and the courts cases 1-59 which received no evidence are corrupt? 
  Most intellectually challenged man on the planet with that logic! 
He is another Trump! Narcissistic Fraud",,https://twitter.com/RuelGolden/status/1345181522643410944
2021-01-02 01:16:59+00:00,1345177235670630405,VickiEngel11,"@JackCal07063875 @bblock29 @MarshaBlackburn Where’s is the evidence? Cyber security director Christopher Krebs, DOJ Bill Barr, our top security intel agencies reported this election as the most secure in history, with no evidence of voter fraud or a “Rigged” election! Facts Matter! You have none! 🥴🤥🙄🤡👈 https://t.co/SA8Ql1xNCv",,https://twitter.com/VickiEngel11/status/1345177235670630405
2021-01-02 00:32:07+00:00,1345165943052398593,rotor_bolt,@ElbridgeColby @HawleyMO The only reason they feel disenfranchised is because the President you worked for perpetrated a disinformation campaign to sow doubt about the legitimacy of the election. His own DOJ and Cyber Defense officials confirmed there was no fraud. Grow up.,,https://twitter.com/rotor_bolt/status/1345165943052398593
2021-01-02 00:30:01+00:00,1345165413764763650,CareyConley1,"@ChrisShafi888 @HerschelWalker ...plus the DOJ, the FBI, Homeland Security, and cyber security experts, NOST of whom are Republicans, and ALL of whom say they've found ZERO evidence of fraud, be in on a multi-state election fraud scheme without being caught with ZERO evidence?",,https://twitter.com/CareyConley1/status/1345165413764763650
2021-01-01 23:20:33+00:00,1345147933537271808,StacieKantar,"@Paul70880893 @marklevinshow @RepKinzinger A brainless twit is someone who continues to believe there was a conspiracy between doj, Ds, Rs, judges, poll workers, dominion, cyber security, fbi, scotus,etc. and fraud even tho there is NO evidence. None. Nada. Zero. Zip. Zilch. Nothing. 🙂",,https://twitter.com/StacieKantar/status/1345147933537271808
2021-01-01 22:50:57+00:00,1345140483484491778,_MTMTE,"DOJ National Security Boss Is Moving On — But Cyber, China Threats Aren't https://t.co/0t2j11tafE",https://www.npr.org/2020/12/31/951229709/doj-national-security-boss-is-moving-on-but-cyber-china-threats-arent?utm_campaign=storyshare&utm_source=twitter.com&utm_medium=social,https://twitter.com/_MTMTE/status/1345140483484491778
2021-01-01 22:44:14+00:00,1345138795121881088,bjkwright,@michael_borne @RebelleTx @HousePatriots @Ianaszman22 @LLinWood @SecPompeo @VP @GenFlynn @realDonaldTrump LOL. 59 court cases (including SCOTUS). Election officials (including Republicans) saying no fraud. US DOJ saying no fraud. Homeland security cyber security says no fraud. State election officials (including Republicans say no fraud. Vs tweets and press conferences.,,https://twitter.com/bjkwright/status/1345138795121881088
2021-01-01 22:27:49+00:00,1345134662478393347,jaygood764,"@kerrycashion @politicoalex @HawleyMO The DOJ, countless judges, Trumps own Cyber security ppl and the Supreme Court all weighed in on this. Its all bullshit. The only reason so many ppl are so concerned with election fraud is because Trump primed them to for months before and the GOP has lied to them nonstop since.",,https://twitter.com/jaygood764/status/1345134662478393347
2021-01-01 22:15:18+00:00,1345131514258927617,makeDEAFgreat,"@mcintosh160 @CodeMonkeyZ Gov IT Sys Admin / Solarwinds Certified reported 911 cyber issues to Officals June 2019 and terminated Aug 2019 in retailation to reporting to FBI,DOJ, AG

Videos
https://t.co/JfirfL4pgL
https://t.co/DFA84alcuR

Tech Details https://t.co/MCdDKlCCtT https://t.co/ZFmO1zuH3z",https://youtu.be/3mPw64iymGg https://youtu.be/D5zylC_AlqU https://bit.ly/2Uag854,https://twitter.com/makeDEAFgreat/status/1345131514258927617
2021-01-01 22:14:31+00:00,1345131314006138881,makeDEAFgreat,"@CISAgov @NSAGov Gov IT Sys Admin / Solarwinds Certified reported 911 cyber issues to Officals June 2019 and terminated Aug 2019 in retailation to reporting to FBI,DOJ, AG

Videos
https://t.co/JfirfL4pgL
https://t.co/DFA84alcuR

Tech Details https://t.co/MCdDKlCCtT https://t.co/l7XxFZXv8K",https://youtu.be/3mPw64iymGg https://youtu.be/D5zylC_AlqU https://bit.ly/2Uag854,https://twitter.com/makeDEAFgreat/status/1345131314006138881
2021-01-01 22:13:55+00:00,1345131164244324352,makeDEAFgreat,"@CarrollQuigley1 Gov IT Sys Admin / Solarwinds Certified reported 911 cyber issues to Officals June 2019 and terminated Aug 2019 in retailation to reporting to FBI,DOJ, AG

Videos
https://t.co/JfirfL4pgL
https://t.co/DFA84alcuR

Tech Details https://t.co/MCdDKlCCtT https://t.co/73ZcNE4h9x",https://youtu.be/3mPw64iymGg https://youtu.be/D5zylC_AlqU https://bit.ly/2Uag854,https://twitter.com/makeDEAFgreat/status/1345131164244324352
2021-01-01 22:13:15+00:00,1345130994832187392,makeDEAFgreat,"@USCERT_gov Gov IT Sys Admin / Solarwinds Certified reported 911 cyber issues to Officals June 2019 and terminated Aug 2019 in retailation to reporting to FBI,DOJ, AG

Videos
https://t.co/JfirfL4pgL
https://t.co/DFA84alcuR

Tech Details https://t.co/MCdDKlCCtT https://t.co/qNCFB9lXTk",https://youtu.be/3mPw64iymGg https://youtu.be/D5zylC_AlqU https://bit.ly/2Uag854,https://twitter.com/makeDEAFgreat/status/1345130994832187392
2021-01-01 22:12:43+00:00,1345130862669680642,makeDEAFgreat,"Gov IT Sys Admin / Solarwinds Certified reported 911 cyber issues to Officals June 2019 and terminated Aug 2019 in retailation to reporting to FBI,DOJ, AG

Videos
https://t.co/JfirfL4pgL
https://t.co/DFA84alcuR

Tech Details https://t.co/MCdDKlCCtT https://t.co/eLQYk9qJtf https://t.co/3Nf4cFUArw",https://youtu.be/3mPw64iymGg https://youtu.be/D5zylC_AlqU https://bit.ly/2Uag854 https://twitter.com/USCERT_gov/status/1342921508872617984,https://twitter.com/makeDEAFgreat/status/1345130862669680642
2021-01-01 22:11:46+00:00,1345130621706842115,makeDEAFgreat,"@RockoModern_ @tom2badcat Gov IT Sys Admin / Solarwinds Certified reported 911 cyber issues to Officals June 2019 and terminated Aug 2019 in retailation to reporting to FBI,DOJ, AG

Videos
https://t.co/JfirfL4pgL
https://t.co/DFA84alcuR

Tech Details https://t.co/MCdDKlCCtT https://t.co/l1GkTmKR9a",https://youtu.be/3mPw64iymGg https://youtu.be/D5zylC_AlqU https://bit.ly/2Uag854,https://twitter.com/makeDEAFgreat/status/1345130621706842115
2021-01-01 22:10:48+00:00,1345130378865094657,makeDEAFgreat,"@CertifriedIT @solarwinds @FireEye Gov IT Sys Admin / Solarwinds Certified reported 911 cyber issues to Officals June 2019 and terminated Aug 2019 in retailation to reporting to FBI,DOJ, AG

Videos
https://t.co/JfirfL4pgL
https://t.co/DFA84alcuR

Tech Details https://t.co/MCdDKlCCtT https://t.co/zVHcDQkNwB",https://youtu.be/3mPw64iymGg https://youtu.be/D5zylC_AlqU https://bit.ly/2Uag854,https://twitter.com/makeDEAFgreat/status/1345130378865094657
2021-01-01 22:10:06+00:00,1345130201861279744,makeDEAFgreat,"@AJBlackston Gov IT Sys Admin / Solarwinds Certified reported 911 cyber issues to Officals June 2019 and terminated Aug 2019 in retailation to reporting to FBI,DOJ, AG

Videos
https://t.co/JfirfL4pgL
https://t.co/DFA84alcuR

Tech Details https://t.co/MCdDKlCCtT https://t.co/cg2XKxMFte",https://youtu.be/3mPw64iymGg https://youtu.be/D5zylC_AlqU https://bit.ly/2Uag854,https://twitter.com/makeDEAFgreat/status/1345130201861279744
2021-01-01 22:09:34+00:00,1345130071418433536,makeDEAFgreat,"@Limon_Kay Gov IT Sys Admin / Solarwinds Certified reported 911 cyber issues to Officals June 2019 and terminated Aug 2019 in retailation to reporting to FBI,DOJ, AG

Videos
https://t.co/JfirfL4pgL
https://t.co/DFA84alcuR

Tech Details https://t.co/MCdDKlCCtT https://t.co/CGDTctVegm",https://youtu.be/3mPw64iymGg https://youtu.be/D5zylC_AlqU https://bit.ly/2Uag854,https://twitter.com/makeDEAFgreat/status/1345130071418433536
2021-01-01 22:08:56+00:00,1345129910411681794,makeDEAFgreat,"@VincentJardin Gov IT Sys Admin / Solarwinds Certified reported 911 cyber issues to Officals June 2019 and terminated Aug 2019 in retailation to reporting to FBI,DOJ, AG

Videos
https://t.co/JfirfL4pgL
https://t.co/DFA84alcuR

Tech Details https://t.co/MCdDKlCCtT https://t.co/aT6wno4TrO",https://youtu.be/3mPw64iymGg https://youtu.be/D5zylC_AlqU https://bit.ly/2Uag854,https://twitter.com/makeDEAFgreat/status/1345129910411681794
2021-01-01 17:52:53+00:00,1345065471968591872,RuelGolden,"@sandy_kaw These 140 Republicans who spit in the face of our AG, FBI, DOJ, Cyber Election Security, 50 states, court of law 1-59. 

Should be fired for incompetency! These are the same people who believe in no evidence conspiracies. 

It is a simple logic question. Embarrassing",,https://twitter.com/RuelGolden/status/1345065471968591872
2021-01-01 17:52:43+00:00,1345065432013627392,RuelGolden,"@GOPLeader These 140 Republicans who spit in the face of our AG, FBI, DOJ, Cyber Election Security, 50 states, court of law 1-59. 

Should be fired for incompetency! These are the same people who believe in no evidence conspiracies. 

It is a simple logic question. Embarrassing",,https://twitter.com/RuelGolden/status/1345065432013627392
2021-01-01 17:52:04+00:00,1345065268595200001,RuelGolden,"@SenRonJohnson These 140 Republicans who spit in the face of our AG, FBI, DOJ, Cyber Election Security, 50 states, court of law 1-59. 

Should be fired for incompetency! These are the same people who believe in no evidence conspiracies. 

It is a simple logic question. Embarrassing",,https://twitter.com/RuelGolden/status/1345065268595200001
2021-01-01 17:51:51+00:00,1345065213524000768,RuelGolden,"@thomaskaine5 These 140 Republicans who spit in the face of our AG, FBI, DOJ, Cyber Election Security, 50 states, court of law 1-59. 

Should be fired for incompetency! These are the same people who believe in no evidence conspiracies. 

It is a simple logic question. Embarrassing",,https://twitter.com/RuelGolden/status/1345065213524000768
