Datetime,Tweet ID,Username,Text,Links,URL
2021-03-17 15:56:09+00:00,1372215183955820546,drmassee,"Microsoft Could Reap Over $150M in New US Cyber Spending, Frustrating Some Lawmakers https://t.co/KBXYyfPw9I #Newsmax via @Newsmax",https://www.newsmax.com/Finance/streettalk/microsoft-150-million-cyber-spending/2021/03/15/id/1013786/,https://twitter.com/drmassee/status/1372215183955820546
2021-03-17 15:47:22+00:00,1372212977294831619,AllianzCat,"The @BBCBreaking has reported that cyber attackers have targeted Microsoft Exchange Server, the popular email system used by corporations across the world. Given the increased threat of cyber crime find out why, your clients may need #cybercover in place. https://t.co/MrBSVgA2y2 https://t.co/zpqX7a95qd",http://ow.ly/bLSn102BHJp,https://twitter.com/AllianzCat/status/1372212977294831619
2021-03-17 15:46:38+00:00,1372212789226344457,CyberSecDN,#Microsoft Finally Fixes That Nasty Hard Drive Corruption Exploit https://t.co/odZExObY67 via @Sec_Cyber,https://www.makeuseof.com/microsoft-fixes-hard-drive-corruption-exploit/,https://twitter.com/CyberSecDN/status/1372212789226344457
2021-03-17 15:46:36+00:00,1372212781001416707,two_minwarning,"Not Vulnerable? 3 Reasons to Worry About the Microsoft Exchange Hacks

A little more than a week into the Microsoft Exchange Server cyber-attack leveraging four zero-day exploits, organizations and governments continue to work on mitigation strategies – … https://t.co/AIclWEkhpR",https://ift.tt/3vzIFlz,https://twitter.com/two_minwarning/status/1372212781001416707
2021-03-17 15:42:33+00:00,1372211762896891909,gzunigah,How to protect your Microsoft Office 365 environment from cyber threats https://t.co/4nftmocv5b https://t.co/8cmYd8tJTp,https://tek.io/3vAt19G,https://twitter.com/gzunigah/status/1372211762896891909
2021-03-17 15:37:08+00:00,1372210402147319818,anith,How to protect your Microsoft Office 365 environment from cyber threats https://t.co/brDMrBitNA,https://anith.com/how-to-protect-your-microsoft-office-365-environment-from-cyber-threats/,https://twitter.com/anith/status/1372210402147319818
2021-03-17 15:20:26+00:00,1372206196044791813,snlyngaas,"Despite blows from  Cyber Command &amp;  Microsoft, there have been continued spearphishing campaigns employing TrickBot against orgs in  North America, CISA and FBI say in new advisory: https://t.co/c2QhlfN7Kn",https://us-cert.cisa.gov/ncas/alerts/aa21-076a,https://twitter.com/snlyngaas/status/1372206196044791813
2021-03-17 15:09:45+00:00,1372203509693755395,Eyecay_ky,Institutions with paper-intensive tasks and onsite servers are especially prone to data loss and cyber attacks. Follow us to stay updated on how to protect your organization with #Microsoft. https://t.co/fpvUC4kOmX,https://stuf.in/b5e28q,https://twitter.com/Eyecay_ky/status/1372203509693755395
2021-03-17 15:04:58+00:00,1372202303927762956,XMCyber_,"Want peace of mind about recurring attacks such as ProxyLogon? Learn why XM Cyber is imperative for continuous scanning for vulnerabilities and protection of your critical assets.

#Microsoft #Exchange #MicrosoftExchangeServer #ProxyLogon #HAFNIUM

https://t.co/jcoT87j7QK",https://hubs.li/H0JcNl80,https://twitter.com/XMCyber_/status/1372202303927762956
2021-03-17 15:04:46+00:00,1372202253524860929,IT_securitynews,How to protect your Microsoft Office 365 environment from cyber threats https://t.co/AKZ0fsJHUf,https://www.itsecuritynews.info/how-to-protect-your-microsoft-office-365-environment-from-cyber-threats/,https://twitter.com/IT_securitynews/status/1372202253524860929
2021-03-17 15:04:25+00:00,1372202165280849926,ProServeIT,"Did you know your end-users' inbox is the #1 point of entry for a cyber breach? Find out how you can secure your employee's inboxes and make your organization less of a target: https://t.co/3aXCxhzUQl
#Cybersecurity #Microsoft #inbox #phishing https://t.co/qhUwTLr7K8",https://hubs.li/H0J9c6x0,https://twitter.com/ProServeIT/status/1372202165280849926
2021-03-17 14:53:52+00:00,1372199511217553418,wwworksinc,How to protect your Microsoft Office 365 environment from cyber threats https://t.co/Pfup1rPq5i via @techrepublic,https://tek.io/3bVjLoL,https://twitter.com/wwworksinc/status/1372199511217553418
2021-03-17 14:51:32+00:00,1372198924836990976,shah_sheikh,"How to protect your Microsoft Office 365 environment from cyber threats: A quick shift toward Microsoft Office 365 and Azure AD in the cloud has expanded the attack surface for many organizations, says Vectra AI. https://t.co/yVa8SD1N26 https://t.co/d9PiqrAOup",https://www.techrepublic.com/article/how-to-protect-your-microsoft-office-365-environment-from-cyber-threats/?utm_source=dlvr.it&utm_medium=twitter#ftag=RSS56d97e7,https://twitter.com/shah_sheikh/status/1372198924836990976
2021-03-17 14:33:58+00:00,1372194502237118471,cyber_qc,"Call your supply chain now. Ask them if and when they last patched their Microsoft Exchange Servers - This impacts on-prem servers. Patched too late? Likely infected, even after patch. Requires expert removal. What data does your supply chain partner have on you? #DearCry https://t.co/HjqsrL8Y0n",https://twitter.com/CBCScienceEnv/status/1372172403133022210,https://twitter.com/cyber_qc/status/1372194502237118471
2021-03-17 14:33:22+00:00,1372194352840204293,Politisite,"/5/- The cost of cyber incident response weighs particularly heavily on small businesses. Hence, we requested that Microsoft help small businesses with a simple solution to this incident.",,https://twitter.com/Politisite/status/1372194352840204293
2021-03-17 14:30:57+00:00,1372193744875819013,Politisite,"Statements by Press Secretary Jen Psaki &amp; Deputy National Security Advisor for Cyber Anne Neuberger on Microsoft Exchange Vulnerabilities UCG
Last week the National Security Council (NSC) established a Unified Coordination Group (UCG), a task force composed of representatives",,https://twitter.com/Politisite/status/1372193744875819013
2021-03-17 14:02:52+00:00,1372186675888201733,cg_techuk,"See our CTO's latest Cyber Defence Report which includes his reflection on the Microsoft Exchange attack, a recent VMware vulnerability and news of the Egregor cyber-gang being arrested.
https://t.co/ZUAPUsW6dR
#cyberattack #microsoftexchange #vmware https://t.co/p81Ax0SKKn",https://www.ogl.co.uk/cyber-defence-report-march-2021,https://twitter.com/cg_techuk/status/1372186675888201733
2021-03-17 14:00:30+00:00,1372186081563664385,SaniTuk,"The National Cyber Security Centre estimates the Microsoft Email exchange breach affected 7,000 servers in the UK. Microsoft's Cloud services were unaffected. 

If you need advice on a switch to the Cloud, or help making your systems more secure, we're the experts to talk to. https://t.co/YHj6V1COuL",,https://twitter.com/SaniTuk/status/1372186081563664385
2021-03-17 13:54:07+00:00,1372184476936192000,photowhitehouse,Statements by Press Secretary Jen Psaki &amp; Deputy National Security Advisor for Cyber Anne Neuberger on Microsoft Exchange Vulnerabilities UCG ⁦@PressSec⁩ ⁦@WhiteHouse⁩ https://t.co/o1NF48sP4U,,https://twitter.com/photowhitehouse/status/1372184476936192000
2021-03-17 13:53:19+00:00,1372184274162565120,MaceNewsMacro,"Wht Hse issues a statement repeating urgent advice for every operator of a Microsoft Exchange Server, particularly smaller businesses, to ""download and run"" free patch. Unpatched systems are a key concern for the NSC's new Unified Coordination Group on cyber risks. #cybersecurity",,https://twitter.com/MaceNewsMacro/status/1372184274162565120
2021-03-17 13:49:05+00:00,1372183207945248770,cipherstorm,"Not Vulnerable? 3 Reasons to Worry About the Microsoft Exchange Hacks: A little more than a week into the Microsoft Exchange Server cyber-attack leveraging four zero-day exploits, organizations and governments continue to work on mitigation strategies –… https://t.co/y1hGLBlzsG https://t.co/zOHCBnNJVR",https://securityboulevard.com/2021/03/not-vulnerable-3-reasons-to-worry-about-the-microsoft-exchange-hacks/?utm_source=dlvr.it&utm_medium=twitter,https://twitter.com/cipherstorm/status/1372183207945248770
2021-03-17 13:35:10+00:00,1372179705894469632,NicoleSganga,"NEW: The White House and National Security Council release a new statement on the @Microsoft Exchange Server breach. 

""The cost of cyber incident response weighs particularly heavily on small businesses,"" @PressSec writes. 

Members from the FBI, CISA, ODNI and NSA met Monday👇 https://t.co/rnUngTCjkV",,https://twitter.com/NicoleSganga/status/1372179705894469632
2021-03-17 13:30:59+00:00,1372178655405805573,virtruprivacy,"Earlier this month, a cyber attack exploiting vulnerabilities in Microsoft Exchange Server came to light. Here's what we know about the attack, and what the more than 30,000 impacted organizations can do next to safeguard their data. https://t.co/UUjxM6tmJf",https://virtru.co/3tuZsV3,https://twitter.com/virtruprivacy/status/1372178655405805573
2021-03-17 13:29:47+00:00,1372178350127611908,govcso,"Microsoft breach ramps up pressure on Biden to tackle cyber vulnerabilities

#cyber #cyberthreat https://t.co/NXwQihyon7",https://lnkd.in/eZHqwXt,https://twitter.com/govcso/status/1372178350127611908
2021-03-17 13:11:03+00:00,1372173635746553862,ScinaryActual,Microsoft breach ramps up pressure on Biden to tackle cyber vulnerabilities https://t.co/5ZjbLDjtIN https://t.co/lXBWb2xw63,http://dlvr.it/RvpjDf,https://twitter.com/ScinaryActual/status/1372173635746553862
2021-03-17 13:02:06+00:00,1372171383166369792,CyberHub_Pty,Microsoft cyber-attack turns into global crisis https://t.co/Tx7x7QSp6R via @YouTube,https://youtu.be/bwZ5y4nt-No,https://twitter.com/CyberHub_Pty/status/1372171383166369792
2021-03-17 12:42:17+00:00,1372166396738670592,JoeUchill,"There are obviously a ton of not cyber issues that will come up: FEMA deployment, Texan grid resilience, border issues. 

But infosec issues likely in the mix: third party risk a la Microsoft and Solarwinds, election security, particularly in light of the ODNI report.",,https://twitter.com/JoeUchill/status/1372166396738670592
2021-03-17 12:16:33+00:00,1372159923803488259,RobinMCouch,Microsoft breach ramps up pressure on Biden to tackle cyber vulnerabilities https://t.co/RWewaP5ZRM,https://thehill.com/policy/cybersecurity/543535-microsoft-breach-ramps-up-pressure-on-biden-to-tackle-cyber,https://twitter.com/RobinMCouch/status/1372159923803488259
2021-03-17 12:11:45+00:00,1372158711989469190,mediaFRIENDSS,Combatting cyber and financial crime is critical to protecting revenue and reputation. This infographic details how @Microsoft uses #AI and analytics to fight against fraud. https://t.co/4A5Zmq7aG3,https://stuf.in/b5dwlh,https://twitter.com/mediaFRIENDSS/status/1372158711989469190
2021-03-17 12:11:20+00:00,1372158610118213635,SuffolkOne,"Make sure to sign up to our Cyber-Safety Event taking place on Thursday 25th March, 6:30-7:30pm on Microsoft Teams, to learn more about how to stay safe online 💻

👉 https://t.co/ngW92pL3gi https://t.co/JeGb8ww1MJ",https://www.suffolkone.ac.uk/information/dates-note/events/cyber-safety-event/?fbclid=IwAR0PxbQG72jc1PlHceLl72oi7v_iIutNreNGpb8pA-BEtk1LPfad8MTAWhI https://twitter.com/LRC_OneSFC/status/1372140671763636225,https://twitter.com/SuffolkOne/status/1372158610118213635
2021-03-17 12:07:22+00:00,1372157609852166144,AllianzUKFraud,"The @BBCBreaking has reported that cyber attackers have targeted Microsoft Exchange Server, the popular email system used by corporations across the world. Given the increased threat of cyber crime find out why, your clients may need #cybercover in place. https://t.co/Wlm5hfKtB9 https://t.co/SlqFh94xyp",http://ow.ly/BD15102BG57,https://twitter.com/AllianzUKFraud/status/1372157609852166144
2021-03-17 12:06:33+00:00,1372157404519960576,Exetlos_GDA,"Exclusive: Having capable adversaries ""not an excuse"" for failing to protect customers, says ...: Lior Div, CEO and Co-founder, Cybereason, gives his two cents on the recent, massive cyber-attack that targeted Microsoft. By Adelle Geronimo; 17 ... https://t.co/UpOQGnWzyZ EXETLOS",http://dlvr.it/RvpSk8,https://twitter.com/Exetlos_GDA/status/1372157404519960576
2021-03-17 12:04:50+00:00,1372156974742319111,ninjas_web,Institutions with paper-intensive tasks and onsite servers are especially prone to data loss and cyber attacks. Follow us to stay updated on how to protect your organization with #Microsoft. https://t.co/bATKY9Dblr,https://stuf.in/b5dw08,https://twitter.com/ninjas_web/status/1372156974742319111
2021-03-17 11:57:51+00:00,1372155214086643717,3beesbuzz,Microsoft breach ramps up pressure on Biden to tackle cyber vulnerabilities https://t.co/b6XiixrvEt,https://thehill.com/policy/cybersecurity/543535-microsoft-breach-ramps-up-pressure-on-biden-to-tackle-cyber#.YFHuum-9hnw.twitter,https://twitter.com/3beesbuzz/status/1372155214086643717
2021-03-17 11:50:11+00:00,1372153288318128128,QSecGH,"How does Cyber AI protect @Microsoft environments against sophisticated attacks? 

Join Mariana Pereira, Director of Email Security Products, and Brianna Leddy, Director of Analysis, tomorrow for a live webinar at 3pm GMT. Register now: … https://t.co/ESyOsDlscM",,https://twitter.com/QSecGH/status/1372153288318128128
2021-03-17 11:48:05+00:00,1372152759781224449,GetCalCISO,Microsoft breach ramps up pressure on Biden to tackle cyber vulnerabilities | TheHill - The Hill https://t.co/bxyHMsvQ0j https://t.co/rJ4wuQRZpl,https://bit.ly/30XGkCF,https://twitter.com/GetCalCISO/status/1372152759781224449
2021-03-17 11:45:04+00:00,1372151999920214016,MarkDoh52685091,"The @BBCBreaking has reported that cyber attackers have targeted Microsoft Exchange Server, the popular email system used by corporations across the world. Given the increased threat of cyber crime find out why, your clients may need #cybercover in place. https://t.co/DBgb9BpNrt https://t.co/f5iEtPB5bN",http://ow.ly/8r2f102BE7P,https://twitter.com/MarkDoh52685091/status/1372151999920214016
2021-03-17 11:43:36+00:00,1372151630154641410,elzey_t,Microsoft breach ramps up pressure on Biden to tackle cyber vulnerabilities | TheHill https://t.co/mpRKjnwi5e,https://thehill.com/policy/cybersecurity/543535-microsoft-breach-ramps-up-pressure-on-biden-to-tackle-cyber,https://twitter.com/elzey_t/status/1372151630154641410
2021-03-17 11:28:20+00:00,1372147789363347457,peggyodomyahoo1,Microsoft breach ramps up pressure on Biden to tackle cyber vulnerabilities https://t.co/YeYnvYJsD5,https://www.msn.com/en-us/news/politics/microsoft-breach-ramps-up-pressure-on-biden-to-tackle-cyber-vulnerabilities/ar-BB1eG7tl?ocid=winp-st&li=BBnb7Kz,https://twitter.com/peggyodomyahoo1/status/1372147789363347457
2021-03-17 11:25:43+00:00,1372147128139534338,nya_siskii,"@Dotavyo @winam_ooh @amerix @kra @KRACorporate @KRACare Have a pc and Internet or cyber-cafe. Make sure the Pc has Microsoft office &amp; you are an accountant, knowing how to file. 
So calculate 
Expenses depend on where you are, eg In Isiolo or meru inlands, do you have a pc &amp; ur accountant or do you need to travel to the closest town.",,https://twitter.com/nya_siskii/status/1372147128139534338
2021-03-17 11:18:09+00:00,1372145224340938758,ExternalReality,"More than 3,000 UK email servers remain at risk from the global Microsoft Exchange email flaw, officials believe. The National Cyber Securit #industrynews https://t.co/8LPD61EGfH https://t.co/xLNjQzQZbx",https://www.e92social.com/l/E1yfoXMH,https://twitter.com/ExternalReality/status/1372145224340938758
2021-03-17 11:14:11+00:00,1372144226927005697,Darktrace,"How does Cyber AI protect @Microsoft environments against sophisticated attacks? 

Join Mariana Pereira, Director of Email Security Products, and Brianna Leddy, Director of Analysis, tomorrow for a live webinar at 3pm GMT. Register now: https://t.co/9NG7NgzvCQ #Cloud #AI #SaaS https://t.co/hT3qTnKFKu",https://bit.ly/2Q5PU4k,https://twitter.com/Darktrace/status/1372144226927005697
2021-03-17 11:02:58+00:00,1372141402138812419,eChannelNews,Sherweb Launches First in a Series of Cyber Security Services for Microsoft 365 https://t.co/4KR02TYR6e via @eChannelNews https://t.co/LP3o9eyUJt,https://e-channelnews.com/sherweb-launches-first-in-a-series-of-cyber-security-services-for-microsoft-365/,https://twitter.com/eChannelNews/status/1372141402138812419
2021-03-17 11:00:07+00:00,1372140688591175683,PentestPeople,"Microsoft Exchange exploits a ransomware path. 
Today the National Cyber Security Centre has released a warning to those using Microsoft exchange due to a china hack.  
Please keep alert and aware. 
#cybersecurity #ransomware #cyberattack #cyberhack #cybercriminal #chinahack https://t.co/9rVe9bew5S",https://twitter.com/_CSNI_/status/1370411131429339139,https://twitter.com/PentestPeople/status/1372140688591175683
2021-03-17 10:49:52+00:00,1372138105197752323,ArrowSecurity,"Vectra AI: Cloud Security Insights Gained from Remote Working

Join #Microsoft, Red Goat Cyber Security and @Vectra_AI for this panel discussing insights on cloud security gained from remote working. https://t.co/WPNmgdzaLj #cyberattacks #cloud https://t.co/EoJ0gJKAVm",http://arw.li/6016HqsrQ,https://twitter.com/ArrowSecurity/status/1372138105197752323
2021-03-17 10:38:24+00:00,1372135223425654784,ghoul_uk,Microsoft Could Get $150 Million in US Cyber Spending Despite Recent Hacks https://t.co/j9hKXo2ZEM #technologynews,http://news.buffins.net/?read=https%3A%2F%2Fgadgets.ndtv.com%2Finternet%2Fnews%2Fmicrosoft%2Dus%2Dcovid%2D19%2Dcybersecurity%2Dspending%2Dusd%2D150%2Dmillion%2Doutlook%2Dexchange%2Dservers%2Demail%2Dhack%2Dsolarwinds%2Dchina%2Drussia%2D2391257,https://twitter.com/ghoul_uk/status/1372135223425654784
2021-03-17 10:37:06+00:00,1372134894722236417,thehill,Microsoft breach ramps up pressure on Biden to tackle cyber vulnerabilities https://t.co/8itVCb2g9H https://t.co/fNw9Py2v3s,http://hill.cm/T2xwDOO,https://twitter.com/thehill/status/1372134894722236417
2021-03-17 10:34:37+00:00,1372134269926191104,stnewsamerica,"It was recently reported that the threat of email #hacking due to the vulnerabilities found in #Microsoft’s Exchange Server is still very much present and many #servers worldwide remain #vulnerable. #cyber #security 

Read our full story below!

https://t.co/q8j35wE0RK",https://softwaretesting.news/many-exchange-servers-still-vulnerable-after-email-hacking/,https://twitter.com/stnewsamerica/status/1372134269926191104
2021-03-17 10:21:00+00:00,1372130843683135491,Arrow_Cloud_UK,"Vectra AI: Cloud Security Insights Gained from Remote Working

Join #Microsoft, Red Goat Cyber Security and @Vectra_AI for this panel discussing insights on cloud security gained from remote working. https://t.co/7XJRnDrQ73 #cyberattacks #cloud https://t.co/MvT31LnleT",http://arw.li/6011HqsrV,https://twitter.com/Arrow_Cloud_UK/status/1372130843683135491
2021-03-17 10:08:03+00:00,1372127581814861829,KhumbeOriginal,"Microsoft news: GCHQ urges business to install ‘vital’ patch after 'China hack attack' The National Cyber Security Centre (NCSC... ht...
https://t.co/HA4ORLSjqL",https://khumbe.co.za/microsoft-news-gchq-urges-business-to-install-vital-patch-after-china-hack-attack/?feed_id=15070&_unique_id=6051d5019caab,https://twitter.com/KhumbeOriginal/status/1372127581814861829
2021-03-17 09:50:52+00:00,1372123259924316164,ArrowECS_UK,"Vectra AI: Cloud Security Insights Gained from Remote Working

Join #Microsoft, Red Goat Cyber Security and @Vectra_AI for this panel discussing insights on cloud security gained from remote working. https://t.co/71AeTLNIQ1 #cyberattacks #cloud https://t.co/hxoW1oxUml",http://arw.li/6019HqsRU,https://twitter.com/ArrowECS_UK/status/1372123259924316164
2021-03-17 09:45:06+00:00,1372121808036638726,al3xcostin,"Microsoft suffers cyber attack White House investigated: more than 20,000 companies have been affected by a' hack ' to the mail server software - More than 20,000 US companies have been compromised",,https://twitter.com/al3xcostin/status/1372121808036638726
2021-03-17 09:36:11+00:00,1372119562687283202,PolCyberAlarm,"Read the latest advice from the National Cyber Security Centre about the #microsoft Exchange vulnerabilities. Key advice to ensure your business is protected.
https://t.co/lSb3pUDFY4",https://twitter.com/NCSC/status/1371846735270662166,https://twitter.com/PolCyberAlarm/status/1372119562687283202
2021-03-17 08:56:27+00:00,1372109564586364930,SarahMallaby,"The @BBCBreaking has reported that cyber attackers have targeted Microsoft Exchange Server, the popular email system used by corporations across the world. Given the increased threat of cyber crime find out why, your clients may need #cybercover in place. https://t.co/RGnr2KY0w8 https://t.co/1GCseyLjy3",http://ow.ly/tL2N102BE5E,https://twitter.com/SarahMallaby/status/1372109564586364930
2021-03-17 08:15:00+00:00,1372099132777582595,kuriharan,Learn out. #Microsoft could reap more than $150M in U.S. cyber funding despite security shortcomings https://t.co/CBlWtUbxag via @VentureBeat #tech #digital #data #security https://t.co/5WuEQCKGgU,https://venturebeat.com/2021/03/16/microsoft-could-reap-more-than-150-million-in-u-s-cyber-funding-despite-security-shortcomings/,https://twitter.com/kuriharan/status/1372099132777582595
2021-03-17 08:01:44+00:00,1372095793503555587,pifitech,Institutions with paper-intensive tasks and onsite servers are especially prone to data loss and cyber attacks. Follow us to stay updated on how to protect your organization with #Microsoft. https://t.co/w9LJvgoO6g,https://stuf.in/b5dsu6,https://twitter.com/pifitech/status/1372095793503555587
2021-03-17 07:51:09+00:00,1372093130154065923,RumiChowd,"#RT @rvp: #RaviVisvesvarayaSharadaPrasad RT    cybersec_feeds  https://t.co/4iX4DW7ZZG  RT @BelovedTech: This is not good. It happens to the best companies, always stay prepared. 
#Cybersec
#Cybersecurity
#Cyber
#infosec
#informationsecurity
#cybercrime
Microsoft 365 outage kno…",https://twitter.com/cybersec_feeds/status/1372089842230820872,https://twitter.com/RumiChowd/status/1372093130154065923
2021-03-17 07:39:23+00:00,1372090170091184131,CyberSecUpdate,Hackers rushed in as Microsoft raced to avert mass cyber-attack https://t.co/YQajFEaGIk via @amermilnews #malware #ethicalhacking #linux,https://bit.ly/2NjXirO,https://twitter.com/CyberSecUpdate/status/1372090170091184131
2021-03-17 07:18:20+00:00,1372084874715271170,chrisneel,Microsoft could reap more than $150M in U.S. cyber funding despite security shortcomings https://t.co/zOW1q05ruf,https://bit.ly/3eKkg6R,https://twitter.com/chrisneel/status/1372084874715271170
2021-03-17 07:07:05+00:00,1372082043698438150,axonit,Are you safe from cyber-attacks when working remotely? @Microsoft security has you covered. Check out this article for some best practices to stay secure! https://t.co/QYIKQkAQLN,https://stuf.in/b5dskr,https://twitter.com/axonit/status/1372082043698438150
2021-03-17 07:01:33+00:00,1372080649188835334,MrsYisWhy,SCMagazine: Most in the cyber community endorse transparency and info sharing. But how do companies manage the risk? @Microsoft Exchange attacks offer an interesting case study in what may be a worst case scenario  https://t.co/IYXbxDjJux,https://www.scmagazine.com/home/security-news/vulnerabilities/the-microsoft-exchange-hack-the-risks-and-rewards-of-sharing-bug-intel/,https://twitter.com/MrsYisWhy/status/1372080649188835334
2021-03-17 06:39:14+00:00,1372075032604737537,bugbounty18,Hackers rushed in as Microsoft raced to avert mass cyber-attack https://t.co/2od4kLO6ZI via @amermilnews #cybersecurityawareness #security #hack,https://bit.ly/2NjXirO,https://twitter.com/bugbounty18/status/1372075032604737537
2021-03-17 06:08:34+00:00,1372067317232902146,nerccu,"The European Banking Authority's email servers have been compromised in a #global Microsoft Exchange cyber-attack.

https://t.co/fW8mL60xJ1

#cyberprotect #cybersecurity #cybercrime #cyber #security #infosec #technews #microsoft #exchange #email #server #vulnerabilities #cve https://t.co/2p1G3pQdp1",https://www.ncsc.gov.uk/news/advice-following-microsoft-vulnerabilities-exploitation,https://twitter.com/nerccu/status/1372067317232902146
2021-03-17 06:05:07+00:00,1372066449326362624,The_Cyber_News,"Microsoft Released a one-click Exchange Mitigation Tool to Mitigate Recently Disclosed ProxyLogon Vulnerabilities 

Read More: https://t.co/XeRnRKzJPo

#Microsoft #exchange #vulnerability https://t.co/TVYmiNC8i8",https://gbhackers.com/one-click-exchange-mitigation-tool/,https://twitter.com/The_Cyber_News/status/1372066449326362624
2021-03-17 06:02:30+00:00,1372065789818273794,ITP_English,"""These nation-state bad actors...do it because they can and because they are ruthless profiteers"": @cybereason's Lior Div on the recent, massive cyber-attack that targeted Microsoft
https://t.co/bKuKjt3X9l

#MicrosoftBreach #Cyberattack #Cybersecurity",https://zcu.io/oQao,https://twitter.com/ITP_English/status/1372065789818273794
2021-03-17 06:00:23+00:00,1372065258345406465,AnnaChr50617500,"Microsoft Could Reap Over $150M in New US Cyber Spending, Frustrating Some Lawmakers https://t.co/WJdW9P0rpw #Newsmax via @Newsmax",https://www.newsmax.com/Finance/streettalk/microsoft-150-million-cyber-spending/2021/03/15/id/1013786/,https://twitter.com/AnnaChr50617500/status/1372065258345406465
2021-03-17 05:57:06+00:00,1372064431472017410,UtopianKnightUK,"Britain&amp;#039;s National Cyber Security Centre (NCSC) echoed calls in the US and EU for immediate installation of Microsoft&amp;#039;s Exchange Server patch and ...  #cybernews #thecybernewsfeed

https://t.co/VobmLU0oZV",https://thecybernewsfeed.com/cyber-alerts/dealing-with-holiday-bear-hafnium-and-those-who-followed-hafnium-fcc-sanctions-chinese/,https://twitter.com/UtopianKnightUK/status/1372064431472017410
