Datetime,Tweet ID,Username,Text,Links,URL
2020-12-16 18:17:43+00:00,1339273517641117696,twacker1,@SecPompeo @RepLeeZeldin Why is our loser president ignoring an all out cyber-attack by Russia against our pentagon and Treasury??,,https://twitter.com/twacker1/status/1339273517641117696
2020-12-16 17:12:00+00:00,1339256980104503297,NXTsoft,Did you hear about this? A cyber attack breached US Treasury and Commerce Departments. Read more here: https://t.co/byr9wkPjEd #CyberAttack #CyberBreach #CyberSecurity,https://hubs.li/H0CJXQq0,https://twitter.com/NXTsoft/status/1339256980104503297
2020-12-16 16:50:20+00:00,1339251523939917827,SandraKM123,"@thehill Chris Krebs was head of CISA-the organization that 'protects' the government from Cyber Security hacks. Agencies, including the US Treasury, were just hacked. Trump fired Krebs a couple weeks ago. Krebs claimed US elections were the most secure in history. Let that sink in.",,https://twitter.com/SandraKM123/status/1339251523939917827
2020-12-16 16:46:53+00:00,1339250658768285696,Dixieann18,@JonLemire @sarahkendzior Umm...didn’t Trump &amp; Mnuchin tout a so-called joint US/Russia task force on cyber security that would be working with and within the Treasury? Story was posted earlier this year &amp; yet the press haven’t put it together that maybe this is the results both Trump/Mnuchin/Putin want.,,https://twitter.com/Dixieann18/status/1339250658768285696
2020-12-16 16:45:04+00:00,1339250198850252800,LawEnforceToday,"What we know so far: Hackers broke into the networks of the US Treasury and Commerce departments - and it appears to be part of a month's long global cyber espionage campaign.

https://t.co/LHO2I8Mckv",https://www.lawenforcementtoday.com/u-s-treasury-and-commerce-departments-email-traffic-reportedly-hacked/,https://twitter.com/LawEnforceToday/status/1339250198850252800
2020-12-16 16:44:37+00:00,1339250088959483913,SandraKM123,"@thehill Chris Krebs was head of CISA-the organization that 'protects' the government from Cyber Security hacks. Agencies, including the US Treasury, were just hacked. Trump fired Krebs a couple weeks ago. Krebs claimed US elections were the most secure in history. Why believe him?",,https://twitter.com/SandraKM123/status/1339250088959483913
2020-12-16 16:37:53+00:00,1339248392724246528,SandraKM123,"@JonathanTurley Chris Krebs was head of CISA-the organization that 'protects' the government from Cyber Security hacks. Agencies, including the US Treasury, were just hacked. One of biggest in history!! Krebs claimed US elections were the most secure in history. Why would ANYONE believe Krebs",,https://twitter.com/SandraKM123/status/1339248392724246528
2020-12-16 16:37:02+00:00,1339248180039442435,ArabNewsDC,"A cyberattack that penetrated systems at #DHS , #Commerce and #Treasury raises questions over visibility into systems. The unknowns around the attack, include scope and duration, as cyber policy veterans begin sorting through the damage. https://t.co/XCnhJtTkgk",https://insidecybersecurity.com/daily-news/attack-breached-federal-departments-front-lines-cyber-efforts-reviving-major-policy,https://twitter.com/ArabNewsDC/status/1339248180039442435
2020-12-16 16:36:50+00:00,1339248126843031553,MediaMavenBarb,"A cyberattack that penetrated systems at #DHS , #Commerce and #Treasury raises questions over visibility into systems. The unknowns around the attack, include scope and duration, as cyber policy veterans begin sorting through the damage. https://t.co/gcCVZMzHGM",https://insidecybersecurity.com/daily-news/attack-breached-federal-departments-front-lines-cyber-efforts-reviving-major-policy,https://twitter.com/MediaMavenBarb/status/1339248126843031553
2020-12-16 16:36:42+00:00,1339248094437928964,SandraKM123,"@JonathanTurley Chris Krebs was head of CISA-the organization that 'protects' the government from Cyber Security hacks. Agencies, including the US Treasury, were just hacked.  One of biggest in history!! Krebs claimed US elections were the most secure in history. Why would ANYONE believe Krebs",,https://twitter.com/SandraKM123/status/1339248094437928964
2020-12-16 16:31:26+00:00,1339246768278691841,SandraKM123,"@RandPaul @FoxNews Thank you for standing up! Chris Krebs was head of CISA-the organization that 'protects' the government from Cyber Security hacks. Agencies, including the US Treasury, were just hacked. Krebs claimed US elections were the most secure in history. Let that sink in.",,https://twitter.com/SandraKM123/status/1339246768278691841
2020-12-16 16:30:19+00:00,1339246488371802115,SandraKM123,"@RandPaul Chris Krebs was head of CISA-the organization that 'protects' the government from Cyber Security hacks. Agencies, including the US Treasury, were just hacked. Trump fired Krebs a couple weeks ago. Krebs claimed US elections were the most secure in history. Let that sink in.",,https://twitter.com/SandraKM123/status/1339246488371802115
2020-12-16 16:18:40+00:00,1339243554598756369,SandraKM123,"@ReutersIndia Chris Krebs was head of CISA-the organization that 'protects' the government from Cyber Security hacks. Agencies, including the US Treasury, were just hacked. Trump fired Krebs a couple weeks ago. Krebs claimed US elections were the most secure in history. Let that sink in.",,https://twitter.com/SandraKM123/status/1339243554598756369
2020-12-16 16:17:05+00:00,1339243159205851137,SandraKM123,"@AmericanMohawk @DianaLovesTrump @realDonaldTrump Chris Krebs was head of CISA-the organization that 'protects' the government from Cyber Security hacks. Agencies, including the US Treasury, were just hacked. Trump fired Krebs a couple weeks ago. Krebs claimed US elections were the most secure in history. Let that sink in.",,https://twitter.com/SandraKM123/status/1339243159205851137
2020-12-16 16:16:51+00:00,1339243100619894784,SandraKM123,"@SaraCarterDC @OcrazioCornPop @SenRonJohnson @JoeBiden Chris Krebs was head of CISA-the organization that 'protects' the government from Cyber Security hacks. Agencies, including the US Treasury, were just hacked. Trump fired Krebs a couple weeks ago. Krebs claimed US elections were the most secure in history. Let that sink in.",,https://twitter.com/SandraKM123/status/1339243100619894784
2020-12-16 15:52:33+00:00,1339236982312980480,intrepidds,"Russian Hackers Suspected in Cyber Breach of Treasury, Homeland Security and More US Gov't Agencies https://t.co/5E2YScDoEh https://t.co/NMoHVTdROZ",http://dlvr.it/RnmSkZ,https://twitter.com/intrepidds/status/1339236982312980480
2020-12-16 15:45:38+00:00,1339235241798537216,Michael_Liam4,"@reesetheone1 If Russia had sent soldiers to break into the treasury, DOD, and DHS and rob us, we’d be calling it an attack or act of war. How is this any different? Cyber warfare is still warfare.",,https://twitter.com/Michael_Liam4/status/1339235241798537216
2020-12-16 15:24:50+00:00,1339230010163548160,MaryLou100,"anything that came from his Department of Justice, etc. etc. etc.)  He could talk about the Russians hacking into the Department of Treasury, conveniently since Trump fired the person who kept us safe from Russia's cyber interference.  He could talk about that one thing forever.",,https://twitter.com/MaryLou100/status/1339230010163548160
2020-12-16 15:05:14+00:00,1339225077322223619,FordDawe,"@MikeHester88 @toadmeister Courts don’t get this. Dir Nat Intel John Ratcliffe submits report by Friday expected to offer forensic evidence of cyber/warfare by China and Iran (NSA is quite good at detecting this). EO is then executed by DoD, Homeland Security, and Treasury. Buy popcorn.",,https://twitter.com/FordDawe/status/1339225077322223619
2020-12-16 14:53:51+00:00,1339222212113543172,sarahkendzior,"""Who did Russia hack this time? Treasury, Commerce, parts of the Pentagon, State Dept, NIH and thousands of businesses. Thanks to a breach with SolarWinds software, Russia has been cyber-spying on US agencies for almost nine months."" -- @gaslitnation https://t.co/4rL4exCKTl",https://www.patreon.com/posts/bill-barr-and-45091429,https://twitter.com/sarahkendzior/status/1339222212113543172
2020-12-16 12:31:57+00:00,1339186502320988161,lillygram,"@LindseyGrahamSC Wakey wakey ,Russia Hacked our Treasury annnd Commerce dept this year! Because your BFF,Russian Asset trump,didn’t think cyber security was a big deal!Your tooo distracted kissing his ring and chasing his balls to look up!! McCain just rolled over Again!!",,https://twitter.com/lillygram/status/1339186502320988161
2020-12-16 10:12:46+00:00,1339151474488700930,megaonline,"US Treasury &amp; Commerce departments have become the latest targets for #hackers, according to Reuters. Here's why the future event of a serious #cyber pandemic may not be a question of ‘if’, but rather of ‘when’ and ‘how serious’:",,https://twitter.com/megaonline/status/1339151474488700930
2020-12-16 10:12:25+00:00,1339151385720475651,JeepGuy18JL,"@SenRonJohnson You're calling a witness in charge of  national cyber security while a foreign government hacked SolarWinds &amp; FireEye software and got into Treasury, Commerce &amp; other agencies.  Where is Dominion/Smartmatic? WTF does Ken Starr know about this election? Your hearing is a joke.",,https://twitter.com/JeepGuy18JL/status/1339151385720475651
2020-12-16 10:09:25+00:00,1339150631303585793,Aurangzebwarsi,"America under cyber-attack | US treasury and commerce departments targeted https://t.co/XamMvw7sQh via @YouTube 
@cnnbrk @BBCNews @BBCNews",https://youtu.be/pDnEkxXoF6U,https://twitter.com/Aurangzebwarsi/status/1339150631303585793
2020-12-16 08:20:00+00:00,1339123098289926144,or_fade,"@DPWIMM @realDonaldTrump 92% of Republicans including Trump should be focused on the fact that Russia launched a Cyber attack on all Government agencies including the US Treasury &amp; Department of Homeland Security &amp; once again, 
Trump does nothing

Trump is still Putin's Puppet to the bitter &amp; losing end https://t.co/UTrsfqdnDw",,https://twitter.com/or_fade/status/1339123098289926144
2020-12-16 07:19:36+00:00,1339107898153037826,CarolFeral,"@realDonaldTrump @OANN Putin’s cyberattack on America’s govt computers may have had something to do with it. Pres trump, you just did an agreement with Putin for Cyber Security and now we’re learning for months Russia has been in the Treasury, Commerce and many other systems.",,https://twitter.com/CarolFeral/status/1339107898153037826
2020-12-16 07:03:45+00:00,1339103907570536449,ehn_christina,"✅ Russian hackers broke into the systems of the United States Department of the Treasury and Department of Commerce.
Read more ⤵️
https://t.co/mSNGrtang7
Via @ehackernews
#hackernews #cyber #cybersecurity #cyberattack #hacker #russia #us https://t.co/QW36VOpsv2",https://www.ehackingnews.com/2020/12/russian-hackers-broke-into-systems-of.html,https://twitter.com/ehn_christina/status/1339103907570536449
2020-12-16 06:43:26+00:00,1339098795578159105,twosimpleideas_,"@realDonaldTrump @OANN No mention of a foreign government  hacking the Treasury after YOU removed the entire leadership at the Cyber and Infrastructure Agency weeks ago?! America is supposed to trust that you’re protecting our interests...
Whose interests are you protecting is the better question?!",,https://twitter.com/twosimpleideas_/status/1339098795578159105
2020-12-16 06:29:29+00:00,1339095285520236545,lac4justice,"“SCUMBAG” TRUMP AND REPUBLICANS HAVE BEEN FALSELY saying that the Election was “rigged” and “corrupt”—THE RUSSIANS HAVE HACKED U.S. Government agencies, INCLUDING THE U.S. TREASURY AND “SHITHOLE” TRUMP AND REPUBLICAN HYPOCRITES HAVE SAID NOTHING ABOUT RUSSIAN CYBER ATTACKS!!!!!!!",,https://twitter.com/lac4justice/status/1339095285520236545
2020-12-16 06:13:21+00:00,1339091223563268096,Vammek,"#SoreLoserTrump
Meanwhile trump says nothing as Russia Cyber attacks US
 including the Pentagon, the Department of Homeland Security and the Department of the Treasury, according to government agencies and media reports.

Justice for America https://t.co/in2mVN0iKN",https://twitter.com/ReallyAmerican1/status/1338949076260278276,https://twitter.com/Vammek/status/1339091223563268096
2020-12-16 05:31:51+00:00,1339080779712790530,victori_roe13,"@Dxron2 @XRP_CryptoFit It was a huge Hack into Cyber Security FireEye, it included over 300K global businesses and corporate entities like Google, Face book, all 5 branches of the US Military, the Pentagon, NASA, NOAH, US Treasury, Federal Reserve, ect. https://t.co/6kf8vnWYJS",https://youtu.be/oe3y-OdNSsw,https://twitter.com/victori_roe13/status/1339080779712790530
2020-12-16 05:05:33+00:00,1339074160383803398,FerrerMafehn,✎ US treasury and commerce departments targeted in cyber-attack #BreakingNews #bbcnews ➵➵➵ https://t.co/cnbG2dZ4QI https://t.co/e9U5s0zBxs,http://dlvr.it/RnkYsN,https://twitter.com/FerrerMafehn/status/1339074160383803398
2020-12-16 04:46:46+00:00,1339069434149785600,Vammek,"tap photo
Latest Alleged Hack Of The U.S. Govt
including the Pentagon, Dept of Homeland Security &amp; Dept of the Treasury, according to govt agencies &amp; media reports
REMEMBER When Mitch BLOCKED ALL CYBER ELECTIONS PROTECTIONS!
Putin Had other ideas https://t.co/Ud8YP5JSet",,https://twitter.com/Vammek/status/1339069434149785600
2020-12-16 04:43:52+00:00,1339068706366705665,Deegan102,Massive cyber attack into our Treasury System by Russia....A parting gift to Russia from the Trump administration.,,https://twitter.com/Deegan102/status/1339068706366705665
2020-12-16 03:56:11+00:00,1339056704118394880,escarda_alan,Check out Mollie Hemingway’s comment that Democrats spent too much time on Russia investigations while they should have been concentrating on China. Immediately after this segment Fox News ran a story on how Russia hacked our Treasury department.   greatest cyber assault Ever,,https://twitter.com/escarda_alan/status/1339056704118394880
2020-12-16 03:52:41+00:00,1339055825709461505,FujiiPonta,"Multiple office networks are reported to have been compromised including the US treasury and commerce departments.
Researchers, who have named the hack Sunburst, say it could take years to fully comprehend one of the biggest ever cyber-attacks.
https://t.co/KKm4DmDash",https://www.bbc.com/news/technology-55321643,https://twitter.com/FujiiPonta/status/1339055825709461505
2020-12-16 03:07:17+00:00,1339044400245190659,TheWokeconomist,"What Didn’t Make Headlines - US Orders Emergency Action After Huge Cyber Security Breach on Federal Networks - Commerce, Treasury, &amp; Department of Homeland Security Breached #cyberattacks #economy #finance #investing #business #macroeconomy https://t.co/m0iuqMpmnV",https://wokeconomist.com/f/hack-at-treasury-and-commerce-spurs-emergency-order-from-cis,https://twitter.com/TheWokeconomist/status/1339044400245190659
2020-12-16 03:03:43+00:00,1339043500189478915,Robin_Quon,So the Russian Cyber Attack on the government targeted the Treasury. Guess what holds all our tax returns? They were operating for 8 months secretly downloading. Think about it.,,https://twitter.com/Robin_Quon/status/1339043500189478915
2020-12-16 03:01:58+00:00,1339043059225546754,aepotter,"@txchristabelle Cyber attack on Pentagon and US Treasury, pandemic delegate but investigating Hunter Biden's income taxes call the FBI immediately send Rudy.",,https://twitter.com/aepotter/status/1339043059225546754
2020-12-16 02:50:11+00:00,1339040094628483073,DusanSkoric1,"Just wandering, could it be that Trump organized, together with Putin, big Cyber attack on American Institutions, especially Treasury, to cover up money laundering and other crimes. https://t.co/fjCaZDuPlX",https://twitter.com/gtconway3d/status/1338971111627894785,https://twitter.com/DusanSkoric1/status/1339040094628483073
2020-12-16 02:32:13+00:00,1339035575643299842,CarolFeral,"@SenRonJohnson Why are you not investigating Russian Cyber attack???  The greatest cyber attack of Treasury, Commerce, and others. This is your area!!!",,https://twitter.com/CarolFeral/status/1339035575643299842
2020-12-16 02:21:17+00:00,1339032820451315712,dhstn,"Massive cyber attack on US institutions the list of affected U.S. government entities includes the Commerce Dept, DHS, the Pentagon, Treasury Dept,  USPS &amp; National Institutes of Health.

Worst attack ever in US history, &amp; Trump the LOSER is silent.

https://t.co/TmPkDV1KxD",https://www.rawstory.com/2020/12/russian-cyber-began-months-ago-and-its-a-worst-case-scenario-msnbc-guest/,https://twitter.com/dhstn/status/1339032820451315712
2020-12-16 02:10:59+00:00,1339030229453598721,RochelleMiami,"🧐 Trump fires Cyber Security NSA director, days later Russia hacks Treasury Department and other government orgs in broad hack of classified government documents and data. 🤔 Absolutely no coincidence here in Impeachment anniversary",,https://twitter.com/RochelleMiami/status/1339030229453598721
2020-12-16 01:30:06+00:00,1339019939483533312,thepolishpen,"@NotThatType_Dr @AP In the context of cyber warfare, this breach already sounds level: nuclear. 
The hackers have had full access to all those networks for months. 
- office of POTUS
- DoD
- Treasury
- Military
The list goes on...
My first inclination is ineptitude, not malice.",,https://twitter.com/thepolishpen/status/1339019939483533312
2020-12-16 01:17:06+00:00,1339016668174049280,margari_r,"@tedcruz Yesterday we learned the U.S. Treasury, the Department of Commerce, and the Department of Homeland Security were all hacked by Russia.
Trump is quiet. Ted is quiet. We are facing more cyber attacks and these fools got time to chill, n gossip",,https://twitter.com/margari_r/status/1339016668174049280
2020-12-16 01:15:09+00:00,1339016180015767555,RightWingBS,"Russian cyber agents hacked into the State Department, Department of Homeland Security, the Pentagon, &amp; the Treasury and Commerce Departments. 

In any other time in our lives, this alone would set off a huge government retaliation. Trumps response?

Zero! https://t.co/tlI1dLWI7p",https://www.nytimes.com/2020/12/14/us/politics/russia-hack-nsa-homeland-security-pentagon.html,https://twitter.com/RightWingBS/status/1339016180015767555
2020-12-16 01:10:08+00:00,1339014917983248384,BranBTC,"Update: the password used to hack into SolarWinds was....

solarwinds123

SolarWinds is the highly sophisticated cyber security software that was used by (among others) the NSA, US Treasury Dept, State Dept, Homeland Security, etc. https://t.co/f6K5yPhhkf",https://twitter.com/BranBTC/status/1338553611178143759,https://twitter.com/BranBTC/status/1339014917983248384
2020-12-16 00:39:24+00:00,1339007183812325378,harrycanuck,I wonder if this massive cyber attack on the US gov has delayed (permanently?) the rumoured upcoming Treasury crypto regulations,,https://twitter.com/harrycanuck/status/1339007183812325378
2020-12-16 00:31:09+00:00,1339005104784076801,hermion94630376,"@KLoeffler @realDonaldTrump It’s been revealed trump has started to pay his huge debts,  just the day after the electoral college confirmed election results. 
Russian intelligence attacks have started: 
Defence, treasury, cyber intelligence, commerce, postal service, agriculture. Frightening times.",,https://twitter.com/hermion94630376/status/1339005104784076801
2020-12-16 00:16:58+00:00,1339001536865820677,tdill_rock,"@McFaul Putin places bounties on American troops. Trump says... crickets
Putin poisons Nevalny. Trump says... crickets
Putin hacks multiple US Govt Treasury, Commerce, Homeland Security and possibly more. Trump says... crickets

But trump wanted to share a cyber program with Putin.",,https://twitter.com/tdill_rock/status/1339001536865820677
2020-12-16 00:07:08+00:00,1338999061270171649,twosimpleideas_,"@KLoeffler @realDonaldTrump Except for when a foreign government hacked the Treasury after Donald removed the entire leadership at the Cyber &amp; Infrastructure Agency weeks ago, &amp; when he decided to downplay Covid-19/make fun of masks/hold superspreader rallies &amp; golf while 300,000+ are dying, etc etc...",,https://twitter.com/twosimpleideas_/status/1338999061270171649
2020-12-15 23:41:33+00:00,1338992624405921792,TheOnyxITGroup,US Treasury Cyber Attack https://t.co/V2QBoVjtmt https://t.co/PmNPb0DmQU,http://dlvr.it/RnjyGL,https://twitter.com/TheOnyxITGroup/status/1338992624405921792
2020-12-15 22:46:49+00:00,1338978848973709312,angiebu84074621,@StephenKing They are also mum on the cyber attacks to the Treasury Department and Solar Winds. Trump turned a blind eye to our enemies and they took  full advantage his negligence.,,https://twitter.com/angiebu84074621/status/1338978848973709312
2020-12-15 22:39:40+00:00,1338977048988041216,xnowledge,"@thehill I can’t watch her, but did she mention the cyber breach  at the treasury and commerce?  Or was it a half hour of personal grievances?",,https://twitter.com/xnowledge/status/1338977048988041216
2020-12-15 22:30:39+00:00,1338974783120302081,Robert4787,"What scares the #DHS #CyberSecurity unit is its potential scope and the manner in which the #Hackers pierced #cyber defenses and gained access to email and internal files at the #Treasury and #Commerce departments. 
https://t.co/RgpMWOGnpn",https://www.wsoctv.com/news/us-agencies-companies-secure-networks-after-huge-hack/YR7C7FNSKU4QNLBNLVWCTZYAGE/,https://twitter.com/Robert4787/status/1338974783120302081
2020-12-15 22:25:21+00:00,1338973447305629696,LionaEnterprise,"🚩Urgent – Cyber Security Alert: SolarWinds

If you were not aware, yesterday, SolarWinds Orion IT Management platform was identified as the conduit for an aggressive hack against the US Dept of Treasury.

What to do if you are using SolarWinds Orion: https://t.co/jxI7nlax9v https://t.co/Y2Py5qEoTe",https://zcu.io/UI7c,https://twitter.com/LionaEnterprise/status/1338973447305629696
2020-12-15 22:23:53+00:00,1338973077800169472,KebbalS,"what if the us treasury cyber atacked found its entry gate via Boston with insiders backdoor
 the reasonable question would not be the russian hacker but the support and what is the purpose of this support.
...Architecture, Ms Neumann on msnbc...",,https://twitter.com/KebbalS/status/1338973077800169472
2020-12-15 22:18:23+00:00,1338971695781036032,Chris7Villa,"@CBPMarkMorgan @CBP Russia is suspected to have hacked into the Pentagon, Deptartments of Homeland Security, the Treasury, Commerce, and yes, even Agriculture!   Such cyber bugs have far more potential, in my humble opinion.",,https://twitter.com/Chris7Villa/status/1338971695781036032
2020-12-15 21:15:25+00:00,1338955849511931905,CryptoCSinc,White House Acknowledges Reports of Cyber Hack on US Treasury by Foreign @adanielhill @darkwebtoday https://t.co/Iy8CSZ2yOn #uncategorized,https://xplosiveweb.com/xplosive/?p=80&utm_source=ReviveOldPost&utm_medium=social&utm_campaign=ReviveOldPost,https://twitter.com/CryptoCSinc/status/1338955849511931905
2020-12-15 20:59:00+00:00,1338951716276998154,CChereseu,"I find it ironic that Trump's administration is on the way out the door and yet its a breach in the Treasury Dept, the present position of Mnuchin. Plus other nations have been getting cyber attacks. Looks like the leaving administration's last money grab. https://t.co/5EdRrJtB9j",https://twitter.com/andrewzimmern/status/1338949326597451778,https://twitter.com/CChereseu/status/1338951716276998154
2020-12-15 20:44:56+00:00,1338948175474913282,MxchaelShabazz,"So Russia hacked into the the Departments of State, Homeland Security, Commerce, and Treasury, and the National Institutes of Health, one of the biggest cyber security breaches and of course the dummy in chief is 🤐 #CyberAttack #TrumpIsALaughingStock",,https://twitter.com/MxchaelShabazz/status/1338948175474913282
2020-12-15 20:42:58+00:00,1338947680530120705,gowans_k,"@prayerfeathers @realDonaldTrump @BreitbartNews Didn’t We just find out Russian hacked our government, treasury and trump is working with them on cyber security?",,https://twitter.com/gowans_k/status/1338947680530120705
2020-12-15 20:00:58+00:00,1338937110359773185,DavidSawatzke,White House acknowledges reports of cyberattack on U.S. Treasury by foreign government. https://t.co/DZEP1b7bFl The elaborate cyber hack that was launched on NTIA involved the organization's Microsoft Office 365 platform #hackingnews #cyberdefense  #cyberwarfare #homelandsecurity,https://www.cnbc.com/amp/2020/12/13/cyber-hack-on-us-treasury-by-foreign-government-.html,https://twitter.com/DavidSawatzke/status/1338937110359773185
2020-12-15 19:40:42+00:00,1338932010711207941,EspionageNews,"“Multiple federal government agencies, including the Treasury and Commerce, were breached as part of a global cyber espionage campaign by Russia’s foreign-intelligence service, in which some internal communications are believed to have been stolen.” https://t.co/Po6gvc2AAY",https://www.wsj.com/articles/agencies-hacked-in-foreign-cyber-espionage-campaign-11607897866,https://twitter.com/EspionageNews/status/1338932010711207941
2020-12-15 19:00:29+00:00,1338921893315874816,tash81,"BBC News - US treasury and commerce departments targeted in cyber-attack
https://t.co/HXrXA1f6lm",https://www.bbc.co.uk/news/world-us-canada-55265442,https://twitter.com/tash81/status/1338921893315874816
2020-12-15 19:00:26+00:00,1338921878715555843,MusingMsAnthrop,"@TeamTrump @kayleighmcenany ⚡️Maybe The White House press sec should talk about Don Junior saying “We get all our funding from Russia” or ... and here’s a good one, how about covering the Russian cyber hacks into the US TREASURY ffs ⚡️

MAGAts have no idea about any of this I presume...🤨",,https://twitter.com/MusingMsAnthrop/status/1338921878715555843
