Datetime,Tweet ID,Username,Text,Links,URL
2020-12-14 17:39:55+00:00,1338539229954134017,EggmanOrWalrus,US treasury and commerce departments targeted in cyber attack #democracy https://t.co/xbl7MP6sM9,http://www.bbc.co.uk/news/world-us-canada-55265442,https://twitter.com/EggmanOrWalrus/status/1338539229954134017
2020-12-14 17:39:19+00:00,1338539076887203843,MagnaCa26189246,"@realDonaldTrump After the Treasury Department cyber breach, CISA Acting Director Brandon Walessaid stated “The compromise of SolarWinds’ Orion Network Management Products poses unacceptable risks to the security of federal networks,”. Used by Dominion 🤔",,https://twitter.com/MagnaCa26189246/status/1338539076887203843
2020-12-14 17:32:11+00:00,1338537283411128326,anteesheri,"BREAKING: Major Treasury Department CYBER ATTACK By 'Foreign Government'- This Could Kick Off WAR https://t.co/aynLRTjSm0 via @AFF_PATRIOTS 
TIME TO DECLARE MARTIAL LAW TO PROTECT COUNTRY!!",https://americasfreedomfighters.com/treasury-department-cyber-attack/,https://twitter.com/anteesheri/status/1338537283411128326
2020-12-14 17:30:52+00:00,1338536950920323074,RezaMAlavi,US treasury and commerce departments targeted in cyber-attack https://t.co/dZ5tCa9tRS,https://www.bbc.com/news/world-us-canada-55265442,https://twitter.com/RezaMAlavi/status/1338536950920323074
2020-12-14 17:25:17+00:00,1338535543525666817,DanielD17985181,@StateDept @SecPompeo Russia are the bad guys that just hacked our treasury and commerce departments. Was it planned? It seems so because of the recent firings of our cyber professionals. What say ye Mr. West Point graduate?,,https://twitter.com/DanielD17985181/status/1338535543525666817
2020-12-14 17:24:28+00:00,1338535341620387840,TwitRinger,US treasury and commerce departments targeted in cyber-attack https://t.co/FgNUdSDE4p,https://www.bbc.co.uk/news/world-us-canada-55265442,https://twitter.com/TwitRinger/status/1338535341620387840
2020-12-14 17:19:16+00:00,1338534030833311746,NYDailyNews,"U.S. government agencies were ordered to scour their networks for malware and disconnect potentially compromised servers.

Authorities learned that the Treasury and Commerce departments were hacked in a global cyber-espionage campaign.
https://t.co/QeMaFVxInu",https://trib.al/jN0p1nh,https://twitter.com/NYDailyNews/status/1338534030833311746
2020-12-14 17:07:56+00:00,1338531177205014530,EndRaceHating,"Suspected Russian hackers spied on US federal agencies in biggest cyber-raid in years. Key targets include Treasury &amp; Commerce Depts. The hackers were able to monitor internal email traffic &amp; other gov't  bodies may be compromised.

#CyberAttack #FireEye https://t.co/pP9Ray48zh",https://www.theguardian.com/world/2020/dec/14/suspected-russian-hackers-spied-on-us-federal-agencies,https://twitter.com/EndRaceHating/status/1338531177205014530
2020-12-14 17:02:54+00:00,1338529910529413125,Panchbelly,"The US Treasury just had a cyber security attack and Russia was suspected and denies it.
Now this?
Something fishy is afoot",,https://twitter.com/Panchbelly/status/1338529910529413125
2020-12-14 17:02:02+00:00,1338529693402742786,LoriAndJava,Is the feel good story of the vaccine rollout going to overshadow this important story?? Trump fired all the cyber security people and then we find out Russia hacked the *Treasury* and other govt entities. This is a BIG deal. https://t.co/nP9R9oCToA,https://twitter.com/donwinslow/status/1338266291862323200,https://twitter.com/LoriAndJava/status/1338529693402742786
2020-12-14 17:01:24+00:00,1338529536175063045,CCSF_Cyber_Club,"U.S. Treasury, Commerce Depts. Hacked Through SolarWinds Compromise — Krebs on Security https://t.co/obj62k0GBq",https://krebsonsecurity.com/2020/12/u-s-treasury-commerce-depts-hacked-through-solarwinds-compromise/,https://twitter.com/CCSF_Cyber_Club/status/1338529536175063045
2020-12-14 17:00:50+00:00,1338529393203933190,FrankSowa1,"The global DDOS attacks &amp; Google outages all point back to FSB/GRU. As does the Ramstein Air Base nuclear scare. IMHO, as a data scientist, there’s no coincidence. They, &amp; today’s EC Vote/Russian Breakins at Treasury &amp; Commerce are all connected. Maybe cyber drill. @CISAgov https://t.co/3iJw7n8VM3",https://twitter.com/ultralite001/status/1338525250737336321,https://twitter.com/FrankSowa1/status/1338529393203933190
2020-12-14 16:58:04+00:00,1338528697981157390,VCNnews,"US treasury and commerce departments targeted in cyber-attack: All federal civilian agencies are told to switch off a network tool exploited by ""malicious actors"". https://t.co/tiKSVcDJwb https://t.co/ogCqBCaUpz",https://www.bbc.co.uk/news/world-us-canada-55265442?utm_source=dlvr.it&utm_medium=twitter&utm_campaign=vcnnews,https://twitter.com/VCNnews/status/1338528697981157390
2020-12-14 16:52:47+00:00,1338527367040561157,dani_mae55,Are we not gonna talk about US Agencies having a breach of security as part of a Global Cyber Espionage including the US Treasury. 😂😂😂,,https://twitter.com/dani_mae55/status/1338527367040561157
2020-12-14 16:52:47+00:00,1338527364909711366,ArunobhB,@Mave_Intel This comes in the backdrop of US Treasury hacking and counter cyber attack by US across the globe to reveal CCP guys spread across the industries.,,https://twitter.com/ArunobhB/status/1338527364909711366
2020-12-14 16:51:55+00:00,1338527149481869314,Abhijeet_Tilak,"@EconomicTimes After Bio War , 
Looks Like 
Cyber War Started ....

Chinese List Leaked
US Treasury
Google Outage ...",,https://twitter.com/Abhijeet_Tilak/status/1338527149481869314
2020-12-14 16:50:47+00:00,1338526862851547137,USA_democary,"Isn't it great that Trump fired the head of our cyber security for doing his job well &amp; now our treasury department has been hacked by a forgien country.
 Wow i wonder which one 🙄 I have faith that the people that worked under Chris Krebs are still doing their job.",,https://twitter.com/USA_democary/status/1338526862851547137
2020-12-14 16:49:03+00:00,1338526425968623617,stevedriz,US Treasury Cyber Attack https://t.co/8WOir6aUWC https://t.co/T7GT37szHI,http://dlvr.it/Rnd9mX,https://twitter.com/stevedriz/status/1338526425968623617
2020-12-14 16:48:09+00:00,1338526200944214036,tammy_stencil,@realDailyWire #SolarWinds cyber security used in US Treasury hacked.....wonder what they were really after? https://t.co/IymiugaVmK,,https://twitter.com/tammy_stencil/status/1338526200944214036
2020-12-14 16:47:21+00:00,1338526000188047366,RonStallworth6,The US Treasury Dept was hacked last night. What cyber security investment stocks are there? Other than CRWD,,https://twitter.com/RonStallworth6/status/1338526000188047366
2020-12-14 16:46:14+00:00,1338525719564005376,schulichcissp,US treasury and commerce departments targeted in cyber-attack | BBC https://t.co/OmyyY6MVgN,https://www.bbc.com/news/world-us-canada-55265442,https://twitter.com/schulichcissp/status/1338525719564005376
2020-12-14 16:44:56+00:00,1338525391095533574,ArthurBenta,"White House acknowledges reports of cyber attack on U.S. treasury by foreign government.
#politics #USA #investment #economy #CyberAttack https://t.co/DH9ouSHJWP",,https://twitter.com/ArthurBenta/status/1338525391095533574
2020-12-14 16:43:19+00:00,1338524984302514183,StephenGlahn,"Looking for @realDonaldTrump's tweets condemning Russia for hacking US Treasury &amp; other departments &amp; all that's there are twitter-flags re: Georgia water leaks.

Trump firing US head of cyber-security #ChrisKreb a month ago is NOT a good look.

If it looks like a duck, quacks...",,https://twitter.com/StephenGlahn/status/1338524984302514183
2020-12-14 16:40:37+00:00,1338524304191975425,moniesha0,"Hackers broke into the networks of the US Treasury and Commerce departments as part of a month's long global cyber espionage campaign.
https://t.co/vXM3dXIyuQ",https://apnews.com/article/us-agencies-hacked-global-cyberspying-e8a2e819f7cc6982f6a72f8c85209b72,https://twitter.com/moniesha0/status/1338524304191975425
2020-12-14 16:40:33+00:00,1338524288047968256,shah_sheikh,"US Treasury Cyber Attack: Following media reports that the US has issued an emergency order after revealing that its treasury and commerce departments had been hacked, please see the response below from cybersecurity expert The ISBuzz Post: This Post US… https://t.co/mkQUzeQuuh https://t.co/r4kuLL8YCA",https://www.informationsecuritybuzz.com/expert-comments/us-treasury-cyber-attack/?utm_source=dlvr.it&utm_medium=twitter,https://twitter.com/shah_sheikh/status/1338524288047968256
2020-12-14 16:36:39+00:00,1338523306824232963,SandraKathleen4,"@ByronYork 1/2 Chris Krebs was head of CISA-the organization that 'protects' the government from Cyber Security hacks. Agencies, including the US Treasury, were just hacked. Trump fired Krebs a couple weeks ago. Krebs claimed US elections were the most secure in history. Let that sink in.",,https://twitter.com/SandraKathleen4/status/1338523306824232963
2020-12-14 16:36:21+00:00,1338523230244491266,AllenLub1Allen,@Q13FOX Trump took off cyber security  now let Russia  attack the Pentagon's treasury  trump should go to FEDARAL  for treason,,https://twitter.com/AllenLub1Allen/status/1338523230244491266
2020-12-14 16:30:24+00:00,1338521735050776576,saltcontrol,"US treasury and commerce departments targeted in cyber-attack

https://t.co/SVwKaPcSQQ

#US #USTreasury #Hacker #CyberSecurity #Malware #Cyberattack #MobileSecurity #SecureComms #IoT #Cybercrime #Hacked #Securitythreat https://t.co/kvMu9MtmAm",https://buff.ly/37fD9KI,https://twitter.com/saltcontrol/status/1338521735050776576
2020-12-14 16:26:44+00:00,1338520811666288644,MosDef10,So we are in the middle of a nationwide pandemic where thousands of people are dying a day. There are mile long lines in food banks across the US and our good friend Putin and the G.R.U. Just hacked into the Departments of Treasury and Commerce committing cyber warfare against US,,https://twitter.com/MosDef10/status/1338520811666288644
2020-12-14 16:26:30+00:00,1338520751939448835,SandraKathleen4,"@IvanPentchoukov @raeganlady Chris Krebs was head of CISA-the organization that 'protects' the government from Cyber Security hacks. Agencies, including the US Treasury, were just hacked. Trump fired Krebs a couple weeks ago. Krebs claimed US elections were the most secure in history. Let that sink in.",,https://twitter.com/SandraKathleen4/status/1338520751939448835
2020-12-14 16:26:20+00:00,1338520711141453832,ThoughtOutlaw,"US Treasury was hacked last week just as digital currency adaptions/regulations are being made for Crypto over the next 6 weeks. Google hacked today. We are at W A R. Currency W, Cyber W, Bio W? Prevention of my T W E E T S being ❤️ is happening. What’s going on? Laugh or cry 🤣",,https://twitter.com/ThoughtOutlaw/status/1338520711141453832
2020-12-14 16:23:00+00:00,1338519870418210821,CNBC,The U.S. Treasury and the Commerce Department were among the federal agencies that were victim of a massive cyber attack. The breach is suspected to be the work of Russian hackers. https://t.co/L7YRjpvPlf https://t.co/XPmN1YsJoP,https://cnb.cx/3aatB5u,https://twitter.com/CNBC/status/1338519870418210821
2020-12-14 16:21:13+00:00,1338519421594128390,jjtweeter,"@SenRonJohnson @JoeBiden Face it, @realDonaldTrump has been lying nonstop to America. Trump &amp; republicans know of his financial entanglements w Russia. Trump fires top level US security officials..then Russia hacks our treasury, commerce depts &amp; cyber firms that work for the US. Coincidence? No.",,https://twitter.com/jjtweeter/status/1338519421594128390
2020-12-14 16:19:33+00:00,1338519005238231041,DeepFriedCyber,US Treasury Cyber Attack https://t.co/dTVUAzuNkg #news #cybersecurity #infosec https://t.co/1gPjywXJ6G,http://dlvr.it/Rnd5Gv,https://twitter.com/DeepFriedCyber/status/1338519005238231041
2020-12-14 16:15:14+00:00,1338517916212465667,885wfdd,"Russia Suspected In Major Cyber Attack On U.S. Treasury, Commerce Departments https://t.co/shy33Vws8s https://t.co/KJW6wiusPJ",https://www.wfdd.org/story/russia-suspected-major-cyber-attack-us-treasury-commerce-departments,https://twitter.com/885wfdd/status/1338517916212465667
2020-12-14 16:11:21+00:00,1338516941519073283,Kathlee28791159,"Is it coincidence Trump fired our cyber security chief last month, didn’t replace him, and yesterday Russia hacked our Treasury &amp; Commerce agencies? #PutinsGOP I don’t believe in coincidence.",,https://twitter.com/Kathlee28791159/status/1338516941519073283
2020-12-14 16:08:37+00:00,1338516249664483330,MonsterVetArt,"In the past few days Russians have cyber attacked the Treasury and Commerce Departments, private companies have also been hacked including tech supply chains, this morning Google has been malfunctioning and now Amazon tech is malfunctioning.

This is NOT normal.",,https://twitter.com/MonsterVetArt/status/1338516249664483330
2020-12-14 16:06:31+00:00,1338515722494828545,sarojhg,"Suspected Russian hackers spied on U.S. Treasury emails  https://t.co/FKL1iO1g67 

The cyber spies are believed to have gotten in by surreptitiously tampering with updates released by IT company SolarWinds, which serves government customers across the executive branch. OOPS!",https://reut.rs/37e3J6V,https://twitter.com/sarojhg/status/1338515722494828545
2020-12-14 16:03:16+00:00,1338514907202019330,IT_securitynews,US Treasury Cyber Attack https://t.co/5BamkDqzBl,https://www.itsecuritynews.info/us-treasury-cyber-attack/,https://twitter.com/IT_securitynews/status/1338514907202019330
2020-12-14 16:00:47+00:00,1338514278685548545,HutSixSecurity,"US treasury and commerce departments targeted in cyber-attack

https://t.co/7d8aQXWcei

#informationsecurity #cybersecurity #ustreasury #cyberattack #fireeye",https://www.bbc.co.uk/news/world-us-canada-55265442,https://twitter.com/HutSixSecurity/status/1338514278685548545
2020-12-14 16:00:22+00:00,1338514176000413698,k3_technology,"The US Treasury was recently a victim of a highly advanced cyber-attack believed to have originated via malware in a software update. With Cyberattacks on the rise, it is vital you take the time to look at where your organization is most vulnerable.

https://t.co/PdOBumPLU6 https://t.co/x4cY9gsQN9",https://www.theguardian.com/technology/2020/dec/13/us-treasury-hacked-group-backed-by-foreign-government-report,https://twitter.com/k3_technology/status/1338514176000413698
2020-12-14 16:00:20+00:00,1338514165686706179,kdcnett,"@Trump @WollmanRink U.S. Agencies Hacked in Foreign Cyber Espionage Campaign
Multiple federal agencies, including the Treasury and Commerce departments, have had some of their computer systems breached as part of a widespread campaign believed to be the work of the Russian government",,https://twitter.com/kdcnett/status/1338514165686706179
2020-12-14 15:59:53+00:00,1338514052063129605,SandraKathleen4,"@StewardshipAmer Chris Krebs was head of CISA-the organization that 'protects' the government from Cyber Security hacks. Agencies, including the US Treasury, were just hacked. Trump fired Krebs a couple weeks ago. Krebs claimed US elections were the most secure in history. Let that sink in.",,https://twitter.com/SandraKathleen4/status/1338514052063129605
2020-12-14 15:59:35+00:00,1338513978113355786,SandraKathleen4,"@charliekirk11 @jjauthor Chris Krebs was head of CISA-the organization that 'protects' the government from Cyber Security hacks. Agencies, including the US Treasury, were just hacked. Trump fired Krebs a couple weeks ago. Krebs claimed US elections were the most secure in history. Let that sink in.",,https://twitter.com/SandraKathleen4/status/1338513978113355786
2020-12-14 15:58:54+00:00,1338513805479960577,SandraKathleen4,"@thehill Chris Krebs was head of CISA-the organization that 'protects' the government from Cyber Security hacks. Agencies, including the US Treasury, were just hacked. Trump fired Krebs a couple weeks ago. Krebs claimed US elections were the most secure in history. Let that sink in.",,https://twitter.com/SandraKathleen4/status/1338513805479960577
2020-12-14 15:58:32+00:00,1338513713351954434,richpavey,US treasury and commerce departments targeted in cyber attack https://t.co/9XklDYGKcW https://t.co/oC2YxfSUH2,http://dlvr.it/Rnd1Zx,https://twitter.com/richpavey/status/1338513713351954434
2020-12-14 15:57:53+00:00,1338513549392371712,kdcnett,"@OANN U.S. Agencies Hacked in Foreign Cyber Espionage Campaign
Multiple federal agencies, including the Treasury and Commerce departments, have had some of their computer systems breached as part of a widespread campaign believed to be the work of the Russian government",,https://twitter.com/kdcnett/status/1338513549392371712
2020-12-14 15:57:10+00:00,1338513371998670849,BFBT_,"RT RT @LVNancy: Cyber Breaches by SolarWinds software that Serve: White House, Pentagon, NASA, Treasury &amp; Commerce.

Don't panic. O… https://t.co/VRod6ii5HA",https://twitter.com/i/web/status/1338498792845266946,https://twitter.com/BFBT_/status/1338513371998670849
2020-12-14 15:56:20+00:00,1338513159691317254,SandraKathleen4,"@LLinWood Chris Krebs was head of CISA-the organization that 'protects' the government from Cyber Security hacks. Agencies, including the US Treasury, were just hacked. Trump fired Krebs a couple weeks ago. Krebs claimed US elections were the most secure in history. Let that sink in.",,https://twitter.com/SandraKathleen4/status/1338513159691317254
2020-12-14 15:56:11+00:00,1338513120759713792,kdcnett,"@POTUSPress U.S. Agencies Hacked in Foreign Cyber Espionage Campaign
Multiple federal agencies, including the Treasury and Commerce departments, have had some of their computer systems breached as part of a widespread campaign believed to be the work of the Russian government",,https://twitter.com/kdcnett/status/1338513120759713792
2020-12-14 15:55:44+00:00,1338513011401584640,kdcnett,"@SecPompeo U.S. Agencies Hacked in Foreign Cyber Espionage Campaign
Multiple federal agencies, including the Treasury and Commerce departments, have had some of their computer systems breached as part of a widespread campaign believed to be the work of the Russian government",,https://twitter.com/kdcnett/status/1338513011401584640
2020-12-14 15:55:40+00:00,1338512994041524224,SandraKathleen4,"@RepMikeJohnson Chris Krebs was head of CISA-the organization that 'protects' the government from Cyber Security hacks. Agencies, including the US Treasury, were just hacked. Trump fired Krebs a couple weeks ago. Krebs claimed US elections were the most secure in history. Let that sink in.",,https://twitter.com/SandraKathleen4/status/1338512994041524224
2020-12-14 15:54:58+00:00,1338512815963848704,kdcnett,"@SidneyPowell1 U.S. Agencies Hacked in Foreign Cyber Espionage Campaign
Multiple federal agencies, including the Treasury and Commerce departments, have had some of their computer systems breached as part of a widespread campaign believed to be the work of the Russian government",,https://twitter.com/kdcnett/status/1338512815963848704
2020-12-14 15:54:47+00:00,1338512769457373186,kdcnett,"@GenFlynn @lofly727 @BarbaraRedgate @GoJackFlynn @flynn_neill @JosephJFlynn1 @RealMFlynnJr @abigailcfrye @tracybeanz U.S. Agencies Hacked in Foreign Cyber Espionage Campaign
Multiple federal agencies, including the Treasury and Commerce departments, have had some of their computer systems breached as part of a widespread campaign believed to be the work of the Russian government",,https://twitter.com/kdcnett/status/1338512769457373186
2020-12-14 15:54:35+00:00,1338512718400081922,kdcnett,"@JohnWHuber U.S. Agencies Hacked in Foreign Cyber Espionage Campaign
Multiple federal agencies, including the Treasury and Commerce departments, have had some of their computer systems breached as part of a widespread campaign believed to be the work of the Russian government",,https://twitter.com/kdcnett/status/1338512718400081922
2020-12-14 15:54:21+00:00,1338512661315690502,cdeprivacy,"Russia Suspected In Major Cyber Attack On U.S. Treasury, Commerce Departments https://t.co/UXWhUxrrru",https://www.npr.org/2020/12/14/946163194/russia-suspected-in-months-long-cyber-attack-on-federal-agencies?utm_campaign=storyshare&utm_source=twitter.com&utm_medium=social,https://twitter.com/cdeprivacy/status/1338512661315690502
2020-12-14 15:53:49+00:00,1338512528771604482,SandraKathleen4,"@mogul518315 @Kintu3 Chris Krebs was head of CISA-the organization that 'protects' the government from Cyber Security hacks. Agencies, including the US Treasury. were hacked this weekend. rump fired Krebs a couple weeks ago. Krebs claimed US elections were the most secure in history. Let that sink in",,https://twitter.com/SandraKathleen4/status/1338512528771604482
2020-12-14 15:53:36+00:00,1338512473184342016,kdcnett,"@GOPLeader U.S. Agencies Hacked in Foreign Cyber Espionage Campaign
Multiple federal agencies, including the Treasury and Commerce departments, have had some of their computer systems breached as part of a widespread campaign believed to be the work of the Russian government",,https://twitter.com/kdcnett/status/1338512473184342016
2020-12-14 15:52:46+00:00,1338512264547106816,kdcnett,"@SenJohnKennedy U.S. Agencies Hacked in Foreign Cyber Espionage Campaign
Multiple federal agencies, including the Treasury and Commerce departments, have had some of their computer systems breached as part of a widespread campaign believed to be the work of the Russian government",,https://twitter.com/kdcnett/status/1338512264547106816
2020-12-14 15:52:15+00:00,1338512134494294016,kdcnett,"@TheJusticeDept @SenTomCotton U.S. Agencies Hacked in Foreign Cyber Espionage Campaign
Multiple federal agencies, including the Treasury and Commerce departments, have had some of their computer systems breached as part of a widespread campaign believed to be the work of the Russian government",,https://twitter.com/kdcnett/status/1338512134494294016
2020-12-14 15:51:59+00:00,1338512066315874305,kdcnett,"@kimguilfoyle @Perduesenate @KLoeffler U.S. Agencies Hacked in Foreign Cyber Espionage Campaign
Multiple federal agencies, including the Treasury and Commerce departments, have had some of their computer systems breached as part of a widespread campaign believed to be the work of the Russian government",,https://twitter.com/kdcnett/status/1338512066315874305
2020-12-14 15:51:48+00:00,1338512018626637824,PP57129657,"@realDonaldTrump 

Russia Suspected In Major Cyber Attack On U.S. Treasury, Commerce Departments

""Rusher Rusher Rusher I hope your listening."" donny j trump asking for Russian help on US national television. https://t.co/OfkHhrIrDw",,https://twitter.com/PP57129657/status/1338512018626637824
2020-12-14 15:51:35+00:00,1338511964612435969,kdcnett,"@GOPChairwoman @realDonaldTrump U.S. Agencies Hacked in Foreign Cyber Espionage Campaign
Multiple federal agencies, including the Treasury and Commerce departments, have had some of their computer systems breached as part of a widespread campaign believed to be the work of the Russian government",,https://twitter.com/kdcnett/status/1338511964612435969
2020-12-14 15:51:27+00:00,1338511932383404032,kdcnett,"@realDonaldTrump @Scavino45 U.S. Agencies Hacked in Foreign Cyber Espionage Campaign
Multiple federal agencies, including the Treasury and Commerce departments, have had some of their computer systems breached as part of a widespread campaign believed to be the work of the Russian government",,https://twitter.com/kdcnett/status/1338511932383404032
2020-12-14 15:51:22+00:00,1338511909948071936,kdcnett,"@realDonaldTrump @Scavino45 U.S. Agencies Hacked in Foreign Cyber Espionage Campaign
Multiple federal agencies, including the Treasury and Commerce departments, have had some of their computer systems breached as part of a widespread campaign believed to be the work of the Russian government",,https://twitter.com/kdcnett/status/1338511909948071936
2020-12-14 15:51:17+00:00,1338511889857298433,kdcnett,"@realDonaldTrump @Scavino45 U.S. Agencies Hacked in Foreign Cyber Espionage Campaign
Multiple federal agencies, including the Treasury and Commerce departments, have had some of their computer systems breached as part of a widespread campaign believed to be the work of the Russian government",,https://twitter.com/kdcnett/status/1338511889857298433
2020-12-14 15:51:03+00:00,1338511832781295618,MonikSchiller,"Russia Suspected In Major Cyber Attack On U.S. Treasury, Commerce Departments https://t.co/BT94QEiIkB",https://www.npr.org/2020/12/14/946163194/russia-suspected-in-months-long-cyber-attack-on-federal-agencies?utm_campaign=storyshare&utm_source=twitter.com&utm_medium=social,https://twitter.com/MonikSchiller/status/1338511832781295618
2020-12-14 15:51:01+00:00,1338511821242736640,kdcnett,"@CLewandowski_ @realDonaldTrump U.S. Agencies Hacked in Foreign Cyber Espionage Campaign
Multiple federal agencies, including the Treasury and Commerce departments, have had some of their computer systems breached as part of a widespread campaign believed to be the work of the Russian government",,https://twitter.com/kdcnett/status/1338511821242736640
2020-12-14 15:50:45+00:00,1338511753831845888,kdcnett,"@GeraldoRivera U.S. Agencies Hacked in Foreign Cyber Espionage Campaign
Multiple federal agencies, including the Treasury and Commerce departments, have had some of their computer systems breached as part of a widespread campaign believed to be the work of the Russian government",,https://twitter.com/kdcnett/status/1338511753831845888
2020-12-14 15:50:36+00:00,1338511719140786177,kdcnett,"@ericbolling @realDonaldTrump U.S. Agencies Hacked in Foreign Cyber Espionage Campaign
Multiple federal agencies, including the Treasury and Commerce departments, have had some of their computer systems breached as part of a widespread campaign believed to be the work of the Russian government",,https://twitter.com/kdcnett/status/1338511719140786177
