Datetime,Tweet ID,Username,Text,Links,URL
2021-01-11 21:16:16+00:00,1348740534244933634,USforFreedom,"@thedailybeast The Russian hacks are ongoing. State Dept was one target (also Pentagon, Military, Depts of Justice, Treasury, Health, Commerce, Energy). We don't know how much Putin has infiltrated our cyber infrastructure &amp; people working in all departments. #StopTrump https://t.co/iWKIDWKqHc",https://www.vox.com/recode/2020/12/14/22174314/government-hack-solarwinds-cozybear-russia,https://twitter.com/USforFreedom/status/1348740534244933634
2021-01-11 16:47:23+00:00,1348672869555965952,1COOLARROW,"Foreign Terrorists Cyber Attacked our Treasury Dept Etc. Less than a month ago, a Domestic Terrorist blew himself up on Christmas Day, &amp; The President of the United States Attacked Our Nation's Capital &amp; Democracy on Jan.6!
Wake the F••k Up America, Seriously!!!!",,https://twitter.com/1COOLARROW/status/1348672869555965952
2021-01-11 11:04:52+00:00,1348586669771952129,incrediblesks,"I contact Merchant UP CYBER TREASURY sbimops@sbi,
they replied that,
""Bank has not received the funds for this transaction, funds will be reversed by the APP Handler, which is NPCI in your case.""
I tried to NPCI at their official website, but didn't receive any response yet. https://t.co/xERc1qxDFo",,https://twitter.com/incrediblesks/status/1348586669771952129
2021-01-11 05:11:08+00:00,1348497649402433537,a_blockchainist,"#Bitcoin Theory, Medium of Exchange, Transactions &amp; Treasury, Tax, Optionality, Crypto Theory, Market Segments, SoV vs MoE vs UoM, Immortal Sovereignty, Morality, Endowments, Magic Power, Digital &amp; Crypto Integration, Rockefeller, Cyber Immortality",,https://twitter.com/a_blockchainist/status/1348497649402433537
2021-01-10 19:56:49+00:00,1348358154019602444,twotoughtwins,@Scaramucci There still a Russian cyber attack with access to our energy and treasury dep right ?,,https://twitter.com/twotoughtwins/status/1348358154019602444
2021-01-10 10:40:02+00:00,1348218032406069254,CrendonIns,US treasury and commerce departments targeted in cyber-attack https://t.co/UFvD6Pw5Vj,https://www.bbc.co.uk/news/world-us-canada-55265442,https://twitter.com/CrendonIns/status/1348218032406069254
2021-01-10 00:12:06+00:00,1348060008014110721,cubasemoi,"President-Elect @JoeBiden needs to make a priority clearing out #DonaldTrump appointees in DOD, HHS, DOJ, Cyber-Defense, Treasury and Intel Agencies as a matter of national security. https://t.co/OZQNjKA07W",https://twitter.com/navybook/status/1347908922292768771,https://twitter.com/cubasemoi/status/1348060008014110721
2021-01-09 20:24:45+00:00,1348002792569499653,PamalaKellerman,"@wesvanbramer @LepapillonBlu They already have all the info they need. He removed the person in charge of cyber security right before they hacked the Treasury dept, as well as other agencies. They may have the nuclear codes. Who knows? No one is telling, just saying it's very bad! That was his gift to Putin!",,https://twitter.com/PamalaKellerman/status/1348002792569499653
2021-01-09 12:12:43+00:00,1347878971950718976,IanPatrick50,@KonstantinKisin Well with any luck the insurrection act will be invoked and put an end to fuckerberg and facebook with all assets going to treasury and him among lots of other traitors in FBI and CIA locked up behind bars for treason and cyber warfare. I haven't given up on that dream just yet.,,https://twitter.com/IanPatrick50/status/1347878971950718976
2021-01-09 08:40:09+00:00,1347825473963716610,bitcoin_halving,"#Bitcoin #Theory, #Medium of Exchange, Transactions &amp; #Treasury, Tax, #Optionality, #Crypto Theory, Market Segments, SoV vs MoE vs UoM, Immortal Sovereignty, Morality, Endowments, Magic Power, Digital &amp; Crypto Integration, Rockefeller, Cyber Immortality",,https://twitter.com/bitcoin_halving/status/1347825473963716610
2021-01-09 04:01:28+00:00,1347755342491430914,AJBlackston,HM Treasury consults on UK regulatory approach to cryptoassets and stablecoins https://t.co/IBn5fShmIL  #CyberSecurityNews #Cyber #CyberSecurity #CyberAttacks #CyberWar #APT #SecurityBreach #Malware #ZeroDay #Hacker #Breach Please Retweet,https://www.jdsupra.com/legalnews/hm-treasury-consults-on-uk-regulatory-4179021/,https://twitter.com/AJBlackston/status/1347755342491430914
2021-01-08 15:37:07+00:00,1347568019136983040,Felicidad281,"@ElsaInCa @a_standal @lian_yamouer @2Prettie2Work @MuellerSheWrote And Trump and his sycophants didn’t stop it, meaning he allowed it to happen. IMO Thus soon after the firing of Cyber security tech Chris Krebs, treasury hack attack.",,https://twitter.com/Felicidad281/status/1347568019136983040
2021-01-08 03:44:18+00:00,1347388634517921797,Manny6Manny,@GunTrahan @bgarlinghouse Just the start of it is tripping me out. Reseting the massive debt with a cyber attack by taking down all the main servers. Like wtf. The treasury was just hacked not long ago. Could they be feeding us the illusion of this soon?,,https://twitter.com/Manny6Manny/status/1347388634517921797
2021-01-08 00:06:08+00:00,1347333732676599809,BowmanNancy,"@RadioFreeTom @AudreyGarden Meanwhile, Pentagon was refusing to brief President-Elect Biden.

And the Russians have been cyber snooping - un-detected for 9 months - Nuclear, Pentagon, Treasury, Commerce.....what damage can/will they do?

Are our most-qualified in charge right now?",,https://twitter.com/BowmanNancy/status/1347333732676599809
2021-01-07 18:34:42+00:00,1347250322247282689,Debdew5,"@TheOldOlaf @tonyschwartz @lrudmilliken .........and this while he continues to extract top secret sensitive intel from our DOD, CIA, DHS, and Treasury depts. from our  breached cyber systems AS WE SPEAK.
STAND UP TO PUTIN!",,https://twitter.com/Debdew5/status/1347250322247282689
2021-01-07 17:20:36+00:00,1347231677475663874,AJBlackston,Cyber Beacon Provides Venue for Sharing Innovative Approaches to Top Strategic Challenges https://t.co/OSIuDsSiFV #USGovernment #News #FEMA #DoED #DOL #BLS #OCC #State #DOI #DOC #DOJ #USDA #FBI #Treasury #DHS #VA #HHS Please Retweet,https://media.defense.gov/2021/Jan/06/2002560857/825/780/0/200630-F-UE756-1025C.JPG,https://twitter.com/AJBlackston/status/1347231677475663874
2021-01-07 14:28:39+00:00,1347188402756743170,BowmanNancy,"@john_sipher A vulnerable time after Russia spent 9 months cyber snooping across nuclear, Pentagon, Treasury, Commerce... Who knows what they will do with all that intel as Biden is not being briefed &amp; Trump's sycophants are in charge v. qualified, patriotic people?",,https://twitter.com/BowmanNancy/status/1347188402756743170
2021-01-07 13:37:15+00:00,1347175466852085760,QueenOfJewelz,November 4th I've never seen the electorial votes held like that and everybody was in the system and I said they were being cyber attacked I was called a conspiracy theorist and then they were cyber breached December 14th and the whole power cloud info grid the treasury the UPS,,https://twitter.com/QueenOfJewelz/status/1347175466852085760
2021-01-07 00:50:40+00:00,1346982549487312902,sidsaucer,"The US Justice Department joins the departments of Treasury, Commerce, State, Homeland Security &amp; Energy in suffering cyber breaches, which were carried out by the Russian foreign intelligence service, the SVR, according to U.S. officials. https://t.co/pWvdIBmc1J #dataprotection",http://shorturl.at/qvDMZ,https://twitter.com/sidsaucer/status/1346982549487312902
2021-01-06 23:19:06+00:00,1346959505326710784,edryan1955,@ShaneGoldmacher @MalcolmNance Today’s insurrection put the Russian cyber attack in the shade.  They broke in to the electronic court system and may have access to sealed cases - That could jeopardize active investigations 🤬🤬 so that plus Treasury &amp; Commerce,,https://twitter.com/edryan1955/status/1346959505326710784
2021-01-06 13:01:35+00:00,1346804102542589952,ayokasystems,"The FBI and NSA stated that the current hacks at US federal agencies are likely from Russians. Some agencies hacked include the Treasury, State and Energy departments. #Energy #Treasury #State #hacked #hack #cybersecurity #cyber #US #FBI #NSA #USA #Russia
https://t.co/6y08X7SHO9",https://techcrunch.com/2021/01/05/fbi-nsa-says-hacks-on-us-federal-agencies-likely-russian-in-origin/,https://twitter.com/ayokasystems/status/1346804102542589952
2021-01-06 01:17:40+00:00,1346626959313428480,rapplerdotcom,"The penetration of departments including Defense, State, Homeland Security, Treasury, and Commerce is already considered the worst known cyber-compromise. https://t.co/24W49Dr34T",https://www.rappler.com/world/us-canada/us-intelligence-agencies-russia-likely-behind-hacking-government-agencies?utm_medium=Social&utm_source=Twitter#Echobox=1609894218,https://twitter.com/rapplerdotcom/status/1346626959313428480
2021-01-06 01:16:02+00:00,1346626545868099584,crypto_returns,"#Bitcoin Theory, Medium of Exchange, Transactions &amp; #Treasury, Tax, Optionality, Crypto Theory, #Market Segments, SoV vs MoE vs UoM, #Immortal Sovereignty, #Morality, Endowments, #Magic Power, Digital &amp; Crypto Integration, Rockefeller, Cyber Immortality

 https://t.co/c6jvuos69c",https://bit.ly/2XaWzum,https://twitter.com/crypto_returns/status/1346626545868099584
2021-01-05 23:32:25+00:00,1346600471801319425,strickland_dane,"tRump has made America weak with his bullshit.. he may as well be a GRU operative...
""Departments penetrated in the hack include Defense, State, Homeland Security, Treasury, and Commerce and is considered the worst known cyber-compromise in recent history"" https://t.co/XNDH2dzaOn",https://twitter.com/AJENews/status/1346597944187891714,https://twitter.com/strickland_dane/status/1346600471801319425
2021-01-05 18:25:33+00:00,1346523244124229633,SrCsasba,@DeptofDefense More useful and relevant would be a Cyber Force rather than a Space Force. Space Force will deplete our treasury like the Star Wars program in the 80s. A Cyber Force could actually defend against and/or destroy enemies.  The internet is a battle space.,,https://twitter.com/SrCsasba/status/1346523244124229633
2021-01-05 16:40:32+00:00,1346496818646032384,RandyUlysse,"#Bitcoin Theory, Medium of Exchange, Transactions &amp; Treasury, Tax, Optionality, Crypto Theory, Market Segments, SoV vs MoE vs UoM, Immortal Sovereignty, Morality, Endowments, Magic Power, Digital &amp; Crypto Integration, Rockefeller, Cyber Immortality",,https://twitter.com/RandyUlysse/status/1346496818646032384
2021-01-05 15:17:32+00:00,1346475931259396098,JustcallmeB12,"@jimmy_viz @krishgm The coffers being empty refers to the fact the treasury has no wiggle room left, defence projects are being stalled (spending for cyber is hype) because there is a huge funding gap, printing more £ doesn't help when you can't guarantee payment abroad, outside of the closed loop",,https://twitter.com/JustcallmeB12/status/1346475931259396098
2021-01-05 15:16:47+00:00,1346475738531131395,saylor,"#Bitcoin Theory, Medium of Exchange, Transactions &amp; Treasury, Tax, Optionality, Crypto Theory, Market Segments, SoV vs MoE vs UoM, Immortal Sovereignty, Morality, Endowments, Magic Power, Digital &amp; Crypto Integration, Rockefeller, Cyber Immortality

https://t.co/gCfKdIo63c",https://youtu.be/FXXx4DBi0SM,https://twitter.com/saylor/status/1346475738531131395
2021-01-04 15:21:57+00:00,1346114652804161536,pamelakilpadi,"@kiantajbakhsh1 Sullivan helped impose the most comprehensive global sanctions regime ever. Military action (bombings, cyber attack that shut down centrifuges) were not as effective as Treasury. Trump weakened containment. Repubs were not better at deterrence, but worse.. https://t.co/9KextWdraF",https://obamawhitehouse.archives.gov/the-press-office/2012/07/31/fact-sheet-sanctions-related-iran,https://twitter.com/pamelakilpadi/status/1346114652804161536
2021-01-03 20:20:57+00:00,1345827511742021632,tccorb,"@realDonaldTrump @SenTedCruz @HawleyMO @Jim_Jordan @senatemajldr @GOPLeader Why have you not addressed or reacted to the Russian cyber hack of US Treasury, DoD and others? Some Commander On Chief...
I can't wait to learn what Putin has on you, and it will come out.",,https://twitter.com/tccorb/status/1345827511742021632
2021-01-03 19:03:27+00:00,1345808008610275329,Marnknowsbest,"@klcmurphy @FrankLuntz Sounds like that’s what this current Administration is doing at the Pentagon and Treasury. Shredding documents and replacing computer drives? We’ve been hacked, since Spring, by Russia. Many people say Russia was given Access. They say our 45 boasted about a cyber net w Russia?!",,https://twitter.com/Marnknowsbest/status/1345808008610275329
2021-01-03 16:30:06+00:00,1345769413472088072,saltcontrol,"US treasury and commerce departments targeted in cyber-attack

https://t.co/SVwKaPcSQQ

#US #USTreasury #Hacker #CyberSecurity #Malware #Cyberattack #MobileSecurity #SecureComms #IoT #Cybercrime #Hacked #Securitythreat https://t.co/gAtBVJsFVc",https://buff.ly/37fD9KI,https://twitter.com/saltcontrol/status/1345769413472088072
2021-01-03 02:39:44+00:00,1345560448859422722,ChrisKaneNY,"@samanthamarika1 @realDonaldTrump Russian hacking group APT29 behind broad espionage campaign that breached Treasury, Commerce, FireEye. tRump removed the entire leadership at the Cyber and Infrastructure Agency. https://t.co/oYuoN0rhEp",,https://twitter.com/ChrisKaneNY/status/1345560448859422722
2021-01-02 23:40:07+00:00,1345515245503008768,LJ_Opinions,@NunesDrag Not a peep and not a peep regarding election security after the Treasury and other government departments and private sector businesses were targeted with cyber spying. Trump doesn't care.,,https://twitter.com/LJ_Opinions/status/1345515245503008768
2021-01-02 15:03:36+00:00,1345385258984722433,dabeezer,"Trump placed Mnuchin, Pompeo (or Tillerson, depending on Russian timing), Ross, and Perry atop Treasury, State, Commerce, and Energy, respectively. The Russian cyber attack penetrated those agencies. https://t.co/WhEBudHuAt",https://www.nytimes.com/2021/01/02/us/politics/russian-hacking-government.html,https://twitter.com/dabeezer/status/1345385258984722433
2021-01-02 14:42:12+00:00,1345379875142569984,FraserDColeman,"@SecPompeo Yet over five years, no response to Russia’s assault in our 2016 election, to bounties on our soldiers heads or to the most widespread (from the Treasury to the Pentagon) cyber attack on our government in history?

Forget swagger, show some balls.",,https://twitter.com/FraserDColeman/status/1345379875142569984
2021-01-02 04:06:44+00:00,1345219955109847041,Chrissylee510,"@realDonaldTrump Now do Russia..🙄
you know, the one that was PROVEN to have committed the LARGEST cyber attack in US HISTORY, of all our major federal agencies like the DOD, HUD, HHS, Treasury Dept, Pentagon, etc.😠

Oh yea, you CANT bc that’s your handler Putin’s country🤡🙄 https://t.co/1rnBxxe0Gs",,https://twitter.com/Chrissylee510/status/1345219955109847041
2021-01-01 21:13:39+00:00,1345115999478177793,cyber_hokie,@ateenymanatee @ahcastor @LizardRumsfeld They laid off nearly 10% of their workforce this year due to “COVID 19’s financial impact” yet they put what $600mn in corporate treasury funds into Bitcoin. Why would anyone want to work there? Saylor tried to force their people back into the office early in the pandemic also,,https://twitter.com/cyber_hokie/status/1345115999478177793
2021-01-01 16:02:58+00:00,1345037810760355842,n_ymiller,"@SecPompeo Ah yes. A cyber hack of the departments of Homeland Security, Commerce, Treasury, NIH &amp; State-undetected for 9 months. A raging pandemic with a botched vaccine rollout. Domestic terrorists blowing up city blocks on Christmas Day. So safe 🙄 https://t.co/cAcJSn3L06",,https://twitter.com/n_ymiller/status/1345037810760355842
2021-01-01 03:03:40+00:00,1344841695637082112,DodiusC,"All cyber military being replaced if your lucky...
Your vadboyx make that bad boys bail bonds
Bye treasury jewkikidee https://t.co/k4UfJN6fwk https://t.co/FvBWofC6tR",https://twitter.com/usairforce/status/1344804786315649025,https://twitter.com/DodiusC/status/1344841695637082112
2021-01-01 03:01:07+00:00,1344841054193811458,DodiusC,"Code us air force fantasy cyber operations kicked out treason group

A pateurized rye of silk heads...

Code seinfeld marble rye treasury jew codes silk for asian silk worm virus code and codes for chrysalis records. Entertainme t treasury bum code being arrested https://t.co/4UhM2SKu8G",https://twitter.com/DodiusC/status/1344840453921751040,https://twitter.com/DodiusC/status/1344841054193811458
2020-12-31 22:26:27+00:00,1344771930080030722,KevOC1916,@joelbayan @DoomlordVek @nibnub47 @Noel_zeek @TapanChaudhary_ @eagledwillies @IsraeliPM @Russia @Israel @StateOIG Once upon a time US intel agencies were off limits from political interference higher ranks But Obama put David Cohen from Dept of Treasury to number 2 job at CIA Followed by Anne Neuberger(family big time aipac)being named Deputy Director head of cyber security at NSA this yr!,,https://twitter.com/KevOC1916/status/1344771930080030722
2020-12-31 18:35:08+00:00,1344713717825630214,Peaceon09879060,"@IAMISjp @BW Nothing. He has no empathy for anyone. Americans are suffering on so many levels, a bomb  on Christmas morning. Cyber attacks on our homeland security, TREASURY by Russia and he plays golf.
Do you have any idea what we have spent on his outings as we the people are on food lines https://t.co/60ppyltMoq",,https://twitter.com/Peaceon09879060/status/1344713717825630214
2020-12-31 16:17:33+00:00,1344679094873698304,JuliaDavisNews,"Russia's cyber attack on U.S. government may have started earlier than initially thought: U.S. investigators originally thought that the attack began in March or April, including breaches of Treasury, State, Commerce and Energy Departments.

https://t.co/BgRY8tv0rq",https://www.reuters.com/article/us-global-cyber-usa-senator/cyber-attack-on-u-s-government-may-have-started-earlier-than-initially-thought-u-s-senator-idUSKBN29501K,https://twitter.com/JuliaDavisNews/status/1344679094873698304
2020-12-31 03:23:05+00:00,1344484191895838723,ClintEhrlich,"@cyber_hokie @RyanSAdams The National Science Foundation has funded us, but we aren't run by the government.

The Federal Reserve + the U.S. Treasury have zero involvement in the protocol.",,https://twitter.com/ClintEhrlich/status/1344484191895838723
2020-12-30 18:32:55+00:00,1344350772922781696,Robin51450754,"@LincolnsBible Putin is in our White House, our Treasury, Our Senate, Our DOD, Our DOJ, Our Homeland Security, Our Cyber Space and he didn't need to scale a wall, apply for a visa or even get a green card. He just needed to buy and pay for it.",,https://twitter.com/Robin51450754/status/1344350772922781696
2020-12-30 14:12:23+00:00,1344285205062795264,CalSAIG,"UPDATE: CYBER-SECURITY
US Treasury warns of ransomware targeting COVID-19 vaccine research
#calgroups #calsaig #knowledgeark #cybersecurity #UStreasury #FinCENFiles #COVID19 #ransomware #COVID19Vaccine #DataSecurity #healthcare #FDA #dataprotection 

https://t.co/7sbt8n3XbT",http://t.ly/VBYp,https://twitter.com/CalSAIG/status/1344285205062795264
2020-12-30 12:22:47+00:00,1344257624280207360,TejasPa64575383,Applicant shall apply to Sub-Registrar. The Sub-Reg. will verify all docs and send to I.R.O. The I.R.O. will verify docs. twice and will send it to Head Office. Head Office will verify docs again and will sent to Cyber Treasury😂😂😇,,https://twitter.com/TejasPa64575383/status/1344257624280207360
2020-12-30 08:50:48+00:00,1344204275501547520,idpthinker,"@JennaEllisEsq Never ever! Make them pay for this  Covid, cyber attacks, stealing our election atrocities. Nullify their holdings in US and the treasury notes  they hold. All debts are canceled.",,https://twitter.com/idpthinker/status/1344204275501547520
2020-12-30 08:30:02+00:00,1344199051856793600,Atos_Security,📰 Cyber Attack on US Treasury and Commerce Departments https://t.co/EHdXzZWWLK via @Cybersecinsider #CyberSecurity,https://okt.to/Ilv3X4,https://twitter.com/Atos_Security/status/1344199051856793600
2020-12-30 03:26:41+00:00,1344122712029941760,tleddon,@michael_saylor Cyber Hornets working behind the scenes to save your Treasury Assets. https://t.co/9CKep7Zxlo,,https://twitter.com/tleddon/status/1344122712029941760
2020-12-29 17:27:00+00:00,1343971796119379976,COGITANDA,"Cyber Crime - US Treasury warns of ransomware targeting COVID-19 vaccine research.

COGITANDA always at your side:

- Cyber Insurance

- Cyber Risk Protection

- Cyber Claims Handling

https://t.co/TZZJ2gME6a

https://t.co/f22ArgHTnN",http://www.cogitanda.com/en/ https://www.bleepingcomputer.com/news/security/us-treasury-warns-of-ransomware-targeting-covid-19-vaccine-research/,https://twitter.com/COGITANDA/status/1343971796119379976
2020-12-29 15:34:12+00:00,1343943408809881602,hornet_cyber,NexTech To Buy $2million in Bitcoin with Treasury Other OTC:NEXCF https://t.co/3S8IltVsQj,https://www.globenewswire.com/news-release/2020/12/29/2151221/0/en/NexTech-To-Buy-2million-in-Bitcoin-with-Treasury.html,https://twitter.com/hornet_cyber/status/1343943408809881602
2020-12-29 14:46:34+00:00,1343931419807023106,CancelliereMark,@Jim_Jordan @NCSCgov Biggest cyber attack in US history @ericgarland . CIACCP KGB TRIPLE AGENT KISSINGER SLAVE BARR HAS HIS DAUGHTER WORKING AT TREASURY. ??!?!?!!!!!!!! https://t.co/9wP9nM74XA,,https://twitter.com/CancelliereMark/status/1343931419807023106
2020-12-28 20:50:05+00:00,1343660515311185921,Foresite_Cyber,US Treasury Suffered 'Significant' SolarWinds Breach: https://t.co/KCp0fOcTju https://t.co/z2F6gQKKAt,http://ow.ly/uP2m50CTrpQ,https://twitter.com/Foresite_Cyber/status/1343660515311185921
2020-12-28 04:03:10+00:00,1343407117185798146,sadifusee,"Media reports have suggested the SVR-linked hacking group known as Cozy Bear, or APT29, was responsible for the cyber spying and infiltration into the computer networks of federal agencies including the treasury, energy and commerce departments.",,https://twitter.com/sadifusee/status/1343407117185798146
2020-12-27 23:09:46+00:00,1343333280620236801,AnTootill,@realDonaldTrump A car bomb went off in Nashville. Hospitals are pushed past capacity. There’s been a serious cyber attack on the pentagon and the treasury and this stupidity is what trump cares about,,https://twitter.com/AnTootill/status/1343333280620236801
2020-12-27 21:33:42+00:00,1343309102097657858,DevinDevo1060,"So much to look at in regards to @realDonaldTrump money moves, with Russian ties. Is this why he’s silent on ANY Russian moves? Bounties on American soldiers, poisoning of Kremlin foe Navalny, cyber attack within our own treasury dept. #TrumpRussianSilence https://t.co/u3Dztf6v28",https://twitter.com/BobPersis/status/1343255406362189830,https://twitter.com/DevinDevo1060/status/1343309102097657858
2020-12-27 15:04:48+00:00,1343211233764384768,A_HolePatrol,"@BigTinyBird Russia HAS invaded the United  States. They are in our Treasury, our Energy Dept, the Pentagon, our Strategic Defense Dept, the State Department. For 9 months they’ve been here and they’re still here. Cyber invasion is an act of war.",,https://twitter.com/A_HolePatrol/status/1343211233764384768
2020-12-27 03:28:51+00:00,1343036090505052160,DanielD17985181,"@realDonaldTrump Hacked gas and electricity grids. Hacked Commerce, Treasury, Nuclear regulatory, and Pentagon. Spy planes taken off line. Cyber security fired. Intelligence leaders fired. Magnified pandemic with ICUs filled. Weeks before leadership change. Holiday break and Government shut down?",,https://twitter.com/DanielD17985181/status/1343036090505052160
2020-12-26 18:57:49+00:00,1342907487238946817,nothingsmonstrd,"@noonanjo @NunanCBA I've seen argument about whether the recent incursion into Treasury and other systems should be described as a ""cyber attack"" or ""cyber espionage,"" but the only difference between the two may be whether the intruding party decides to throw a switch.",,https://twitter.com/nothingsmonstrd/status/1342907487238946817
2020-12-26 16:22:05+00:00,1342868294265688067,JasonBr46669009,"@Bearocalypse @brithume Russian hackers working for the Kremlin are believed to be behind breaches of U.S. government computer systems at the departments of Treasury, Commerce and Homeland Security and more that may have lasted months before they were discovered. We are in a Cyber War.",,https://twitter.com/JasonBr46669009/status/1342868294265688067
2020-12-25 21:47:11+00:00,1342587720317640704,JenniePsyd,"@realDonaldTrump Btw... you’ve said nothing about the Russian Hack of our entire Cyber Government Infrastructure, that compromised DOD, NASA, Homeland, our Treasury &amp; Nuclear Arsenal Admin? You’ve said nothing about Nashville’s Bombing today? Did you set it up with Proud Boyz? Or your Blackwaters https://t.co/Sc0sG1vfiQ",,https://twitter.com/JenniePsyd/status/1342587720317640704
2020-12-25 21:24:32+00:00,1342582019436412929,Exetlos_GDA,"Purpose of cyber attack on US government remains unclear: The revealed cyber attack by still unknown agents who hacked into the American government's computer networks, including its Treasury and ... https://t.co/V5d0dHigIM EXETLOS",http://dlvr.it/RpLn82,https://twitter.com/Exetlos_GDA/status/1342582019436412929
2020-12-25 15:47:03+00:00,1342497088735760385,CAPTRick74,"National (In) Security: Information Infrastructure and Cyber Warfare Edition - Treasury Inspector General: No Taxpayer Info Exposed in SolarWinds Hack ‘At This Time’ (The Epoch Times)

https://t.co/5TDlZsMQil",https://www.theepochtimes.com/treasury-inspector-general-no-taxpayer-info-exposed-in-solarwinds-hack-at-this-time_3632352.html,https://twitter.com/CAPTRick74/status/1342497088735760385
