Datetime,Tweet ID,Username,Text,Links,URL
2014-11-10 19:03:42+00:00,531884926027968512,paktiksoo,Google News USPS Hacked: Postal Service Hit By Cyber Attack - ABC News http://t.co/gMvZ3wZWLe,http://ow.ly/2QsWba,https://twitter.com/paktiksoo/status/531884926027968512
2014-11-10 19:03:39+00:00,531884909619871745,tikinu,USPS Hacked: Postal Service Hit By Cyber Attack - ABC News - ABC News USPS Hacked: Postal Service Hit By Cyber Att... http://t.co/vCmnaWoVxo,http://ow.ly/2QsW7j,https://twitter.com/tikinu/status/531884909619871745
2014-11-10 19:03:25+00:00,531884851864289280,AbahooCom,USPS Hacked: Postal Service Hit By Cyber Attack - ABC News - ABC News USPS Hacked: Postal Service Hit By Cyber Att... http://t.co/dnj87nyFZU,http://ow.ly/2QsVWI,https://twitter.com/AbahooCom/status/531884851864289280
2014-11-10 19:03:15+00:00,531884809392750592,web4co,USPS Hacked: Postal Service Hit By Cyber Attack - ABC News - http://t.co/EOam3UNevT,http://web4co.com/news/usps-hacked-postal-service-hit-by-cyber-attack-abc-news,https://twitter.com/web4co/status/531884809392750592
2014-11-10 19:01:56+00:00,531884481007734784,MinnesotaSiren,USPS Hacked: Postal Service Hit By Cyber Attack - ABC News http://t.co/4vmxKLHjhE,http://goo.gl/fb/X25bcG,https://twitter.com/MinnesotaSiren/status/531884481007734784
2014-11-10 19:00:04+00:00,531884008829755392,BillSolms,Who will be next? #WaveSystems #Don'tbenext USPS Hacked: Postal Service Hit By Cyber Attack - ABC News http://t.co/BlaVpBTLtB via @ABC,http://abcn.ws/1sswopV,https://twitter.com/BillSolms/status/531884008829755392
2014-11-10 18:50:32+00:00,531881610954543104,OxfordBioChron,"IT Security Stories to Watch: USPS, Home Depot Cyber Attack Updates: The United States Postal Service (USPS) t... http://t.co/rWEgPj5bjN",http://bit.ly/1xDCdVK,https://twitter.com/OxfordBioChron/status/531881610954543104
2014-11-10 18:50:15+00:00,531881538384711680,ManWithaHat,US Postal Service in cyber attack | Even the USPS gets hacked http://t.co/oLHqnGOnDc,http://www.bbc.co.uk/news/world-us-canada-29992319,https://twitter.com/ManWithaHat/status/531881538384711680
2014-11-10 18:49:10+00:00,531881267499782144,Rednekked_,US Postal Service in cybr attack #cyberattack #localpostoffices #personalinformation #USPostalService #USPS http://t.co/L82eWmNoDt,http://j.mp/1zfjL6Y,https://twitter.com/Rednekked_/status/531881267499782144
2014-11-10 18:47:05+00:00,531880741039116289,NGC_721,USPS Hacked: Postal Service Hit By Cyber Attack - ABC News http://t.co/R8bJLClQdN via @ABC,http://abcn.ws/1ssujdu,https://twitter.com/NGC_721/status/531880741039116289
2014-11-10 18:46:21+00:00,531880556204548097,valcmomand1,USPS Hacked: Postal Service Hit By Cyber Attack - ABC News http://t.co/Yuek10pUvT via @ABC,http://abcn.ws/1uTZCEL,https://twitter.com/valcmomand1/status/531880556204548097
2014-11-10 18:41:57+00:00,531879452402143232,knssradio,USPS Hacked: Postal Service Hit by Cyber Attack http://t.co/3Sb6U2EZdB #news,http://bit.ly/1oD3KXD,https://twitter.com/knssradio/status/531879452402143232
2014-11-10 18:41:41+00:00,531879385419087872,raymondsiller,USPS Hacked: Postal Service Hit By Cyber Attack - ABC News http://t.co/qHOdmfBI4o via @ABC No damage done. Info was lost in mail. #tcot,http://abcn.ws/1uTY5hY,https://twitter.com/raymondsiller/status/531879385419087872
2014-11-10 18:41:10+00:00,531879255160791040,khawajaNNInews,"#US Postal Service was victim of cyber attack that may have compromised employee's data, @USPS confirms http://t.co/UAxoCJwXns""",http://bbc.in/14566FC,https://twitter.com/khawajaNNInews/status/531879255160791040
2014-11-10 18:37:55+00:00,531878435065307136,NikacSherry,USPS Hacked: Postal Service Hit By Cyber Attack - ABC News http://t.co/JKK2XzVUSA via @ABC,http://abcn.ws/1uTX5dG,https://twitter.com/NikacSherry/status/531878435065307136
2014-11-10 18:34:25+00:00,531877553586597889,EA_Photo,USPS hit by cyber attack. Data of 800k employees and 7 customers able to contact its call center compromised. http://t.co/IAtvVR7pLT,http://ow.ly/3u817B,https://twitter.com/EA_Photo/status/531877553586597889
2014-11-10 18:30:00+00:00,531876443769565184,realtalk995,"USPS Hacked: Postal Service Hit by Cyber Attack
http://t.co/WyvBhPmhtE",http://www.1070wapi.com/common/more.php?section_id=1&m=58&ts=1415643123&article=E793E88768FF11E4B51EFEFDADE6840A&mode=2,https://twitter.com/realtalk995/status/531876443769565184
2014-11-10 18:25:13+00:00,531875241237413890,wlsam890,USPS Hacked: Postal Service Hit by Cyber Attack http://t.co/j72kBGS473,http://bit.ly/1xmz91e,https://twitter.com/wlsam890/status/531875241237413890
2014-11-10 18:18:14+00:00,531873483681050624,TimQNews,"#mspmentor IT Security Stories to Watch: USPS, Home Depot Cyber Attack Updates http://t.co/OmAp8OyH1s",http://dlvr.it/7TN7Wj,https://twitter.com/TimQNews/status/531873483681050624
2014-11-10 18:11:13+00:00,531871718105948160,jessicadavis,"MSP News: IT Security Stories to Watch: USPS, Home Depot Cyber Attack Updates  http://t.co/Q1XfmhOgId",http://ift.tt/1wLATBZ,https://twitter.com/jessicadavis/status/531871718105948160
2014-11-10 18:00:19+00:00,531868974255177728,netsecu,"USPS Hacked: Postal Service Hit By Cyber Attack - ABC News, http://t.co/zPxcvpnMon #security",http://www.netsecu.org/i/b9b3d6273,https://twitter.com/netsecu/status/531868974255177728
2014-11-10 17:56:10+00:00,531867927755358208,0ll2929l0,USPS Hacked: Postal Service Hit By Cyber Attack - ABC News http://t.co/kcSgsyRwhr,http://abcnews.go.com/US/usps-hacked-postal-service-hit-cyber-attack/story?id=26810621,https://twitter.com/0ll2929l0/status/531867927755358208
2014-11-10 17:55:36+00:00,531867787887910912,TheRealJFella,"""USPS Hacked: Postal Service Hit By Cyber Attack - ABC News"" good read http://t.co/6zqtxFgifZ",http://abcnews.go.com/US/usps-hacked-postal-service-hit-cyber-attack/story?id=26810621,https://twitter.com/TheRealJFella/status/531867787887910912
2014-11-10 17:54:16+00:00,531867451143630848,WFINradio,USPS Hacked: Postal Service Hit by Cyber Attack http://t.co/X1ylMVBr88,http://dlvr.it/7TMc6h,https://twitter.com/WFINradio/status/531867451143630848
2014-11-10 17:49:01+00:00,531866128411156481,BBBwmi,@USPS employees are latest victim of a #Cyberattack!  http://t.co/NJnJWj1Jx6,http://bit.ly/1xrKw8X,https://twitter.com/BBBwmi/status/531866128411156481
2014-11-10 17:47:08+00:00,531865654492532736,phxdailynews,USPS says it is victim of hacking attack: The U.S. Postal Service says it's the victim of a cyberattack and that… http://t.co/wMUHXLezU6,http://dlvr.it/7TMXt4,https://twitter.com/phxdailynews/status/531865654492532736
2014-11-10 17:31:50+00:00,531861803727204352,FrontierDaily,USPS Hacked: Postal Service Hit by Cyber Attack -  http://t.co/BTz4CKvIv6,http://frontierdaily.com/usps-hacked-postal-service-hit-by-cyber-attack/,https://twitter.com/FrontierDaily/status/531861803727204352
2014-11-10 17:29:50+00:00,531861302214279168,ABC1230News,USPS Hacked: Postal Service Hit by Cyber Attack -  http://t.co/m3yuxSmDXt http://t.co/X5BNCeiIh4,http://abc1230news.1230thefan.com/2014/11/10/usps-hacked-postal-service-hit-by-cyber-attack/,https://twitter.com/ABC1230News/status/531861302214279168
2014-11-10 17:28:34+00:00,531860981455273984,WTOL11Toledo,"The USPS says it's been the victim of a cyber attack. 
A spokesperson says customers were not affected.
http://t.co/SqqxiLfwSK",http://shout.lt/KwWB,https://twitter.com/WTOL11Toledo/status/531860981455273984
2014-11-10 17:21:37+00:00,531859234431197184,tapbryan,USPS has a website...? RT @WOODTV The U.S. Postal Service says it's the victim of a cyber attack http://t.co/ZABPgJkwi9,http://wp.me/p4yStY-fnW,https://twitter.com/tapbryan/status/531859234431197184
2014-11-10 17:20:53+00:00,531859048522448897,JayGildersleeve,"@theblaze: ""(@USPS) Says It’s the Victim of a Cyberattack"" http://t.co/PSu0dOfPar",http://fb.me/748OX5TGm,https://twitter.com/JayGildersleeve/status/531859048522448897
2014-11-10 17:13:07+00:00,531857096547905536,dudewtfnow,That explains the lost letter from Obama sent to Khameini #USPS MT Postal Service says it's the victim of cyberattack http://t.co/7XbOFO5I71,http://www.cbsnews.com/news/postal-service-says-it-is-victim-of-cyberattack/,https://twitter.com/dudewtfnow/status/531857096547905536
2014-11-10 17:12:57+00:00,531857054806200321,tozny,Cyber attack against USPS compromises private data of 800k employees. http://t.co/d0OwkRYEdL,http://www.reuters.com/article/2014/11/10/us-cybersecurity-usps-idUSKCN0IU1P420141110,https://twitter.com/tozny/status/531857054806200321
2014-11-10 17:02:06+00:00,531854322728853504,KRLD,".@USPS victim of cyberattack. Info about employees, including SSNs, may have been compromised http://t.co/LrgBou1pNq",http://cbsloc.al/1xdtAV4,https://twitter.com/KRLD/status/531854322728853504
2014-11-10 17:02:06+00:00,531854322707857408,CBSDFW,".@USPS victim of cyberattack. Info about employees, including SSNs, may have been compromised http://t.co/JxtSZSHMPq",http://cbsloc.al/1xdtAV4,https://twitter.com/CBSDFW/status/531854322707857408
2014-11-10 16:58:18+00:00,531853366184251392,ABCNewsRadio,USPS Hacked: Postal Service Hit By Cyber Attack http://t.co/RT2Cuas2yL,http://abcn.ws/1oCJp4K,https://twitter.com/ABCNewsRadio/status/531853366184251392
2014-11-10 16:55:34+00:00,531852678079320064,fox28Iowa,USPS latest victim of massive cyberattack affecting employees' personal information http://t.co/5EXqEatkZy http://t.co/1N56DvLpEM,http://www.cbs2iowa.com/news/features/top-stories/stories/usps-latest-victim-cyberattack-31665.shtml,https://twitter.com/fox28Iowa/status/531852678079320064
2014-11-10 16:55:34+00:00,531852678033190912,iowasnewsnow,USPS latest victim of massive cyberattack affecting employees' personal information http://t.co/uaUPkwIRnH http://t.co/aceBLLxH0U,http://www.cbs2iowa.com/news/features/top-stories/stories/usps-latest-victim-cyberattack-31665.shtml,https://twitter.com/iowasnewsnow/status/531852678033190912
2014-11-10 16:55:21+00:00,531852623503450112,alenormand,RT @ekoppWFED: @USPS #cyber attack leaves 800K current and former employees vulnerable to identity theft http://t.co/Ra1oM21VGr #csctechtalk,http://bit.ly/1AUA3qo,https://twitter.com/alenormand/status/531852623503450112
2014-11-10 16:50:41+00:00,531851449962352640,ekopp,".@USPS #cyber attack leaves 800,000 current and former employees possibly vulnerable to identity theft. http://t.co/PGYvDlbVsE",http://bit.ly/1AUA3qo,https://twitter.com/ekopp/status/531851449962352640
2014-11-10 16:50:07+00:00,531851308148744192,Yahoo,USPS claims cyberattack hit it; workers' social security numbers may have been compromised: http://t.co/rMi2yGuVdg http://t.co/HFQCQTC6J3,http://yhoo.it/1oCByEf,https://twitter.com/Yahoo/status/531851308148744192
2014-11-10 16:48:03+00:00,531850788255977474,SweetBianca,USPS Hacked: Postal Service Hit By Cyber Attack - ABC News http://t.co/D1ThGY1Yz9 via @ABC,http://abcn.ws/1ss49aA,https://twitter.com/SweetBianca/status/531850788255977474
2014-11-10 16:46:43+00:00,531850449541144576,KATUNews,The @USPS says it's the victim of a cyberattack on employee info including SocialSecurity #s http://t.co/ynSbkmHAZH http://t.co/lZg1ZphsU7,http://k2ne.ws/1uWuyVy,https://twitter.com/KATUNews/status/531850449541144576
2014-11-10 16:43:56+00:00,531849749851152384,marthajadams,USPS Cyberattack: Local post office customers or http://t.co/33YuAoCvlK users were not affected -- Toledo Blade http://t.co/oAR4jzOCSj,http://usps.com http://po.st/zmb1Tk,https://twitter.com/marthajadams/status/531849749851152384
2014-11-10 16:36:28+00:00,531847869800914945,MDCHHS,RT @ABCInvestigates: USPS Hacked: Postal Service Hit By Cyber Attack http://t.co/RTh8aOXA5A via @AaronKatersky http://t.co/fgW4a8rqBJ,http://abcn.ws/1wLiXYn,https://twitter.com/MDCHHS/status/531847869800914945
2014-11-10 16:34:34+00:00,531847393961340928,CBSEveningNews,.@USPS says it's a victim of a cyberattack; employee and call center customer information may have been compromised http://t.co/ZZyfTw8y8T,http://cbsn.ws/10M64Am,https://twitter.com/CBSEveningNews/status/531847393961340928
2014-11-10 16:34:30+00:00,531847378697854976,skimm,USPS Hacked: Postal Service Hit By Cyber Attack http://t.co/kLNYru7xWZ via @ABC @aaronkatesky,http://abcn.ws/1uTsbSW,https://twitter.com/skimm/status/531847378697854976
2014-11-10 16:34:19+00:00,531847331017412608,ABCInvestigates,DEVELOPING: USPS Hacked: Postal Service Hit By Cyber Attack http://t.co/kvStWQlxvz via @AaronKatersky http://t.co/1LjEk43Zik,http://abcn.ws/1wLiXYn,https://twitter.com/ABCInvestigates/status/531847331017412608
2014-11-10 16:26:39+00:00,531845400379269120,JayWBZ,"The FBI is investigating a cyberattack at the USPS that is believed to have compromised the names, addresses, and SSN#'s of employees",,https://twitter.com/JayWBZ/status/531845400379269120
2014-11-10 16:22:46+00:00,531844423940730880,abc7newsbayarea,JUST IN: The USPS says it's the victim of a cyberattack and that info about its employees may have been compromised. @AP,,https://twitter.com/abc7newsbayarea/status/531844423940730880
2014-11-10 16:22:06+00:00,531844257733042177,CyberSirens1,"@USPS says it is victim of cyber attack, employee information may have been compromised. http://t.co/P48kLX7kCH” http://t.co/lLs3ZkM1uR",http://bit.ly/1tUeu34,https://twitter.com/CyberSirens1/status/531844257733042177
2014-11-10 16:18:40+00:00,531843392230400000,CPrignano,"Before news of #USPS cyber attack, @AP had story on multi-billion $ effort to protect govt data struggling to keep up http://t.co/JnDN2BrMlc",http://ow.ly/E435h,https://twitter.com/CPrignano/status/531843392230400000
2014-11-10 16:16:09+00:00,531842758093205504,ChuckGoudieABC7,"Chinese cyberattack on US Postal Service: @USPS. Names, birth dates and social security numbers of 800-thousand employees exposed.",,https://twitter.com/ChuckGoudieABC7/status/531842758093205504
2014-11-10 16:12:58+00:00,531841958374031360,LD_RVA,Sigh “@Kerri8News: USPS victim of a cyber attack.  Social security numbers and personal info may have been stolen. More @8News at Noon #RVA”,,https://twitter.com/LD_RVA/status/531841958374031360
2014-11-10 16:12:43+00:00,531841893059919873,AnthemNews,USPS says it is victim of hacking attack: The U.S. Postal Service says it's the victim of a cyberattack and that… http://t.co/H0MZqm6m0B,http://dlvr.it/7TKYsd,https://twitter.com/AnthemNews/status/531841893059919873
2014-11-10 16:10:05+00:00,531841231957934081,Local12,.@USPS says it's the victim of a cyberattack. Who could be affected: http://t.co/WiDdc4cHiy http://t.co/DUkZtInItK,http://bit.ly/1yqiUzr,https://twitter.com/Local12/status/531841231957934081
2014-11-10 16:03:51+00:00,531839664383340544,KOBCommunicates,USPS victim of a cyber attack.  Social security numbers and personal info may have been stolen. More @8News at Noon #RVA,,https://twitter.com/KOBCommunicates/status/531839664383340544
2014-11-10 16:02:36+00:00,531839347427786752,columbiascbuzz,USPS becomes victim of cyberattack: The U.S. Postal Service says it's the victim of a cyberattack and that… http://t.co/tGKKpvxsQM,http://dlvr.it/7TKGhN,https://twitter.com/columbiascbuzz/status/531839347427786752
2014-11-10 15:59:22+00:00,531838533665685505,Phoenix_NC,USPS says it is victim of hacking attack: The U.S. Postal Service says it's the victim of a cyberattack and th... http://t.co/5DYDwd0Dir,http://bit.ly/1srS2dE,https://twitter.com/Phoenix_NC/status/531838533665685505
2014-11-10 15:56:46+00:00,531837879027122176,ChapinNewsSC,"Personal information of USPS employees may have been obtained in a cyberattack.    
 
(AP) -- WASHINGTON (AP) --... http://t.co/0A0bh5IyxV",http://fb.me/1UWlSYglo,https://twitter.com/ChapinNewsSC/status/531837879027122176
2014-11-10 15:53:11+00:00,531836979206320128,BCNRNews,USPS says it is victim of hacking attack: The U.S. Postal Service says it's the victim of a cyberattack and that… http://t.co/6OmDxPCRZ5,http://dlvr.it/7TK3Nk,https://twitter.com/BCNRNews/status/531836979206320128
2014-11-10 15:48:45+00:00,531835862859149312,ChrisAntoncich,"yay. MT @ChrisEgert: WASHINGTON (AP) - USPS says it's the victim of a cyberattack - information about employees, may have been compromised.",,https://twitter.com/ChrisAntoncich/status/531835862859149312
2014-11-10 15:45:35+00:00,531835066788630528,christinaTVNews,#CyberAttack The @USPS is now the latest victim of a security breach. More on @3onyourside at #Noon!,,https://twitter.com/christinaTVNews/status/531835066788630528
2014-11-10 15:44:17+00:00,531834739960070144,KFIAM640,"Postal Service says it is victim of cyberattack, employee data may have been compromised. @USPS http://t.co/19VZxk5S4g",http://ow.ly/E3UlL,https://twitter.com/KFIAM640/status/531834739960070144
2014-11-10 15:40:31+00:00,531833791464374272,EricaLynnThomas,U.S. Postal Service #cyberattack : Employee info compromised. #scam @USPS,,https://twitter.com/EricaLynnThomas/status/531833791464374272
2014-11-10 15:39:12+00:00,531833461468712960,LDENBERG,"#Breaking: .@USPS
says it's the victim of a cyberattack. Employees' info including social security numbers may have been compromised.",,https://twitter.com/LDENBERG/status/531833461468712960
2014-11-10 15:38:57+00:00,531833395144577024,ChaunteTurner,"@USPS says it's the victim of a cyberattack. Information about its employees, including Social Security numbers, may have been compromised.",,https://twitter.com/ChaunteTurner/status/531833395144577024
2014-11-10 15:37:13+00:00,531832962224881664,dennyc69,"ENOUGH #China Time for action against these attacks!
Believed #China is behind #cyber attack against @USPS that compromised employee data”",,https://twitter.com/dennyc69/status/531832962224881664
2014-11-10 15:20:48+00:00,531828828717330434,AaronKatersky,Believed #China is behind #cyber attack against @USPS that compromised employee data,,https://twitter.com/AaronKatersky/status/531828828717330434
