Datetime,Tweet ID,Username,Text,Links,URL
2020-12-16 16:36:50+00:00,1339248126843031553,MediaMavenBarb,"A cyberattack that penetrated systems at #DHS , #Commerce and #Treasury raises questions over visibility into systems. The unknowns around the attack, include scope and duration, as cyber policy veterans begin sorting through the damage. https://t.co/gcCVZMzHGM",https://insidecybersecurity.com/daily-news/attack-breached-federal-departments-front-lines-cyber-efforts-reviving-major-policy,https://twitter.com/MediaMavenBarb/status/1339248126843031553
2020-12-16 16:11:51+00:00,1339241841099743232,jeffreymlevy,"@JennaEllisEsq Well 59 judges say you don’t have any proof of widespread voter fraud. Same with SC, AG, DHS cyber security chief, and many others. This is just a way of allowing Trump to grift off of his supporters.",,https://twitter.com/jeffreymlevy/status/1339241841099743232
2020-12-16 15:45:38+00:00,1339235241798537216,Michael_Liam4,"@reesetheone1 If Russia had sent soldiers to break into the treasury, DOD, and DHS and rob us, we’d be calling it an attack or act of war. How is this any different? Cyber warfare is still warfare.",,https://twitter.com/Michael_Liam4/status/1339235241798537216
2020-12-16 15:03:57+00:00,1339224754994049030,RRalstonAgile,"Sen. Ron Wyden (D-Ore.), was more critical. “DHS spent billions of taxpayer dollars on cyber defenses and all it got in return as a lemon with a catchy name,” said Wyden, a member of the Senate Intelligence Committee.",,https://twitter.com/RRalstonAgile/status/1339224754994049030
2020-12-16 14:48:37+00:00,1339220893768310784,EllenAustinLi,"@AndrewO_Brien @andZrit @realDonaldTrump Why don’t YOU read through the court cases? Why don’t you listen to Trump’s DHS appointee, head of election cyber security, who said the election was secure? (Then Trump fired him). Why do believe a guy who said if you keep lying, people start to believe you (The Art of the Deal)",,https://twitter.com/EllenAustinLi/status/1339220893768310784
2020-12-16 14:48:15+00:00,1339220802541998086,rscook,"@RepTedLieu like, maybe don’t let a lying whiny sore losing bankrupt compromised grifter loser fire the DHS cyber security chief",,https://twitter.com/rscook/status/1339220802541998086
2020-12-16 14:43:05+00:00,1339219503020969984,EllenAustinLi,"@AndrewO_Brien @realDonaldTrump Dude, this has been litigated over 50 times. There IS NO EVIDENCE of voter fraud. Stop listening to the lies of a cornered conman. When HIS appointed election cyber security expert &amp; DHS told the public the election was secure, Trump fired him.",,https://twitter.com/EllenAustinLi/status/1339219503020969984
2020-12-16 13:37:03+00:00,1339202885872214017,hoffman_bruce,"“DHS spent billions of taxpayer dollars on cyber defenses and all it got in return was a lemon with a catchy name,” said Sen. Ron Wyden (D-Ore.) https://t.co/AIA2JEHe9s",https://wapo.st/38amiIr,https://twitter.com/hoffman_bruce/status/1339202885872214017
2020-12-16 12:33:12+00:00,1339186816700854272,leoncscott543,@marwilliamson This is what happens when we push red scares.... Now we can just shut down any oppositional organization amand claim they're russian spies or that theyve been hacked by russia. I'm a software dev and interned with DHS in cyber security... Hacking is ALWAYS happening,,https://twitter.com/leoncscott543/status/1339186816700854272
2020-12-16 12:01:26+00:00,1339178823829491712,CMA_Social,"On #cybersecurity - 
#Trump admin’s #chaos &amp; unwillingness to focus on hard problems’ brought us to this point. Former #DHS Assistant #Secretary 4 #Threat #Prevention &amp; Security #Policy, reflects on seriousness of #cyber #hack.
https://t.co/lx5ToBNmWH",https://flip.it/JePT8F,https://twitter.com/CMA_Social/status/1339178823829491712
2020-12-16 10:36:41+00:00,1339157492576755712,ghoul_uk,REPORT: DHS Officials Were Also Monitored In Suspected Russian Cyber Espionage Operation https://t.co/o9zet5KPUj,https://dailycaller.com/2020/12/14/cybersecurity-russian-hackers-dhs/,https://twitter.com/ghoul_uk/status/1339157492576755712
2020-12-16 09:04:52+00:00,1339134388144136194,Fyre_Horse,@Marfoogle https://t.co/pRhnEvRoDS NCSC alert on SolarWinds... https://t.co/fPV0iGpO9G DHS confirms Cyber breaches linked to SolarWinds... including:  https://t.co/gCeWFYEjeH  and DHS was warned in August about the election insecurities: https://t.co/p1WO6hfv4w,https://www.ncsc.govt.nz/newsroom/solarwinds-orion-cyber-security-alert/ https://www.theepochtimes.com/department-of-homeland-security-confirms-cyber-breaches-across-federal-government_3618168.html https://justthenews.com/government/security/pentagon-imposed-emergency-shutdown-computer-network-handling-classified?utm_medium=social_media&utm_source=facebook_social_icon&utm_campaign=social_icons&fbclid=IwAR1XgRLcyWCP4rT53L7pX-y6rk4gNdhvyDZWUr8hstTbNTX2XFOtlEQiW-k https://www.theepochtimes.com/dhs-was-warned-of-election-machine-vulnerabilities-before-election-expert_3598975.html,https://twitter.com/Fyre_Horse/status/1339134388144136194
2020-12-16 07:42:19+00:00,1339113612342857728,webjedi,"@hacks4pancakes @alexstamos Oh god yes. When you've had DHS and the *cyber* side evolve since its formation, and the exits of many folks both career and political - strategy has been very fractured - regardless of politics and infighting. Consistency is needed, as is followthrough.",,https://twitter.com/webjedi/status/1339113612342857728
2020-12-16 07:38:37+00:00,1339112681731715072,webjedi,"@hacks4pancakes @alexstamos Well, I could do a thread on this as well. Some of it's by design... splitting .mil and civilian responsibility and authority between Cyber Command and DHS. Structural, OPM has been slow to realize that the career path is unique &amp; highly specialized and don't recruit properly.",,https://twitter.com/webjedi/status/1339112681731715072
2020-12-16 04:08:17+00:00,1339059749539569665,RobertSubee,"same guys who said cleanest election ever yup that's them of course nbc didn't mention that DHS cyber security missed the problems with dominion voting machines completely an it took an independent investigation that showed us they could an had been hacked, DHS a name u can trust https://t.co/x3L0eiShav",https://twitter.com/MSNBC/status/1339058431794274305,https://twitter.com/RobertSubee/status/1339059749539569665
2020-12-16 04:06:00+00:00,1339059177096876032,ansells_cow,"“DHS spent billions of taxpayer dollars on cyber defenses and all it got in return was a lemon with a catchy name,” said Sen. Ron Wyden https://t.co/h2PKEOoIFG",https://www.washingtonpost.com/national-security/ruusian-hackers-outsmarted-us-defenses/2020/12/15/3deed840-3f11-11eb-9453-fc36ba051781_story.html,https://twitter.com/ansells_cow/status/1339059177096876032
2020-12-16 03:24:20+00:00,1339048690145763329,DHall20665248,@DHS_Wolf what are you doing about Russian cyber attacks?,,https://twitter.com/DHall20665248/status/1339048690145763329
2020-12-16 03:21:43+00:00,1339048031711186944,lewleib,@kaitlancollins And he fired the DHS Cyber chief in the middle of a Russian cyber attack on the US.,,https://twitter.com/lewleib/status/1339048031711186944
2020-12-16 03:19:47+00:00,1339047544941391879,RationalAdult,"@Amy_Siskind If the current cyber attack was a subtle path from DHS to Dominion and the buffoon was told not to worry about the results, ""It's in the bag my friend,"" we can get him for collusion with the SVR. He let it slip, ""Check Dominion!"" Fckn moron.",,https://twitter.com/RationalAdult/status/1339047544941391879
2020-12-16 03:18:55+00:00,1339047327407828993,Mollyunsink,"@MB85071112 @FarnsworthEddie That’s right buddy. All the SCOTUS judges he appointed, the stacked federal court judges he appointed, his DOJ, his FBI, his head of cyber security, his head of DHS all corrupt.  Sounds like he doesn’t know how to hire them.",,https://twitter.com/Mollyunsink/status/1339047327407828993
2020-12-16 03:13:23+00:00,1339045934466994176,NationB4Party,".@SenRonWyden: 
“DHS spent billions of taxpayer dollars on cyber defenses and all it got in return was a lemon with a catchy name.... this administration failed to promptly ... identify suspicious traffic and catch hackers using new tools and new servers.” https://t.co/Tm2EP2WUzp",https://twitter.com/nakashimae/status/1339000940574150656,https://twitter.com/NationB4Party/status/1339045934466994176
2020-12-16 02:21:17+00:00,1339032820451315712,dhstn,"Massive cyber attack on US institutions the list of affected U.S. government entities includes the Commerce Dept, DHS, the Pentagon, Treasury Dept,  USPS &amp; National Institutes of Health.

Worst attack ever in US history, &amp; Trump the LOSER is silent.

https://t.co/TmPkDV1KxD",https://www.rawstory.com/2020/12/russian-cyber-began-months-ago-and-its-a-worst-case-scenario-msnbc-guest/,https://twitter.com/dhstn/status/1339032820451315712
2020-12-16 02:13:35+00:00,1339030884356403269,BlueOfficialMu1,@larrywright @teachcivics @gatewaypundit Tune into the DHS Senate hearing tomorrow morning and then afterwards Iets talk cyber infrastructure threat theories genius 😎,,https://twitter.com/BlueOfficialMu1/status/1339030884356403269
2020-12-16 01:05:54+00:00,1339013849698144258,SecRecon,"DHS Cyber Warriors Issue Warning About Massive Hacking Campaign, Disclose They've Been Hacked A Day Later | Techdirt #SolarWindsHack  https://t.co/l35Vli1o9L",https://www.techdirt.com/articles/20201214/18523745881/dhs-cyber-warriors-issue-warning-about-massive-hacking-campaign-disclose-theyve-been-hacked-day-later.shtml,https://twitter.com/SecRecon/status/1339013849698144258
2020-12-16 00:46:56+00:00,1339009076714381313,aprilsunshine03,@McKaylaRoseJ @Acosta @PressSec Biden did not cheat and Barr and Giuliani admitted there's no fraud. The DHS head of cyber security also said there's no fraud.,,https://twitter.com/aprilsunshine03/status/1339009076714381313
2020-12-16 00:40:31+00:00,1339007462037319680,aprilsunshine03,@SidneyPowell1 @AmandaChaseVA @GovKemp @GaSecofState @realDonaldTrump @LLinWood @GenFlynn @RepDougCollins @CollinsforGA The head of DHS cyber security said there's no fraud. Bill Barr agreed there's been no fraud. Giuliani admitted in court that there's no evidence of fraud. Your actions are seditious and you need to be charged to the fullest extent of the law.,,https://twitter.com/aprilsunshine03/status/1339007462037319680
2020-12-16 00:37:06+00:00,1339006604377812993,brisco_0317,@McAdooGordon Didn't Trump essentially fire the DHS official responsible for cyber security who made an official statement saying there was no foreign interference in the election?  And didn't the press clutch their pearls when said official was criticized by Trump for failing to do his job?,,https://twitter.com/brisco_0317/status/1339006604377812993
2020-12-15 23:43:57+00:00,1338993228452859904,mvario1,"DHS Cyber Warriors Issue Warning About Massive Hacking Campaign, Disclose They've Been Hacked A Day Later https://t.co/02M7JilhmR via @Techdirt",https://tdrt.io/ids,https://twitter.com/mvario1/status/1338993228452859904
2020-12-15 23:42:59+00:00,1338992985908842506,EveryoneLies17,"@realDonaldTrump @BreitbartNews The FBI, DHS, Cyber Security Agencies, Attorney General, all courts including the Supreme Court saying trump lost means nothing to him. But Putin saying Donny is fired? Oh yea. That is a game changer. https://t.co/l3ZSok2g9r",,https://twitter.com/EveryoneLies17/status/1338992985908842506
2020-12-15 23:32:21+00:00,1338990309880033280,LukeLBarr,A CISA (Cybersecurity and Infrastructure Security Agency) official confirms that they were among the agencies who briefed President-Elect Biden’s staff on the SolarWinds hack today. First reported by @snlyngaas. CISA is DHS’ cyber arm. They’re tasked w/ the civilian fed response,,https://twitter.com/LukeLBarr/status/1338990309880033280
2020-12-15 22:30:39+00:00,1338974783120302081,Robert4787,"What scares the #DHS #CyberSecurity unit is its potential scope and the manner in which the #Hackers pierced #cyber defenses and gained access to email and internal files at the #Treasury and #Commerce departments. 
https://t.co/RgpMWOGnpn",https://www.wsoctv.com/news/us-agencies-companies-secure-networks-after-huge-hack/YR7C7FNSKU4QNLBNLVWCTZYAGE/,https://twitter.com/Robert4787/status/1338974783120302081
2020-12-15 22:14:02+00:00,1338970599197118466,garypalmerjr,"DHS, DOJ And DOD Are All Customers Of SolarWinds Orion, The Source Of The Huge US Government Hack https://t.co/7OwIO0ZbQB | #Cybersecurity #Technology #Encryption #Business #Cyber #Security #Privacy #Marketing",https://upload.news/39qn96,https://twitter.com/garypalmerjr/status/1338970599197118466
2020-12-15 21:00:30+00:00,1338952096431923201,TimCushing,"DHS Cyber Warriors Issue Warning About Massive Hacking Campaign, Disclose They've Been Hacked A Day Later https://t.co/O0IvmRUbc1",https://tdrt.io/ids,https://twitter.com/TimCushing/status/1338952096431923201
2020-12-15 20:43:48+00:00,1338947891855982592,Dr_Yield_Curve,"DHS Cyber Warriors Issue Warning About Massive Hacking Campaign, Disclose They've Been Hacked A Day Later
https://t.co/EKMVgQJwqk",https://www.techdirt.com/articles/20201214/18523745881/dhs-cyber-warriors-issue-warning-about-massive-hacking-campaign-disclose-theyve-been-hacked-day-later.shtml,https://twitter.com/Dr_Yield_Curve/status/1338947891855982592
2020-12-15 20:05:17+00:00,1338938198408486916,MarloeGroup,"DHS Cyber Warriors Issue Warning About Massive Hacking Campaign, Disclose They've Been Hacked A Day Later

from the holy-shit-this-is-bad dept

https://t.co/eJn5tN6746",https://www.techdirt.com/articles/20201214/18523745881/dhs-cyber-warriors-issue-warning-about-massive-hacking-campaign-disclose-theyve-been-hacked-day-later.shtml,https://twitter.com/MarloeGroup/status/1338938198408486916
2020-12-15 20:00:58+00:00,1338937114323525633,RayGilray,"""Through the CDM program we are focused on the continued deployment and enablement of cyber‑security tools to ensure that we have complete and continued visibility into software"" Hemant Baidwan, Deputy CISO, DHS  https://t.co/Fa03EvBPr0  #FedsAtTheEdge https://t.co/elXYDlB6Cz",https://bit.ly/FedsAtTheEdge016,https://twitter.com/RayGilray/status/1338937114323525633
2020-12-15 19:36:24+00:00,1338930929021186049,techdirt,"DHS Cyber Warriors Issue Warning About Massive Hacking Campaign, Disclose They've Been Hacked A Day Later https://t.co/mj0oAxuw99",https://tdrt.io/ids,https://twitter.com/techdirt/status/1338930929021186049
2020-12-15 17:54:20+00:00,1338905243061420037,DavidArtGar,"@marcorubio Waiting on you, maybe in between your China tweets, to mention anything about Russia cyber-espionage thst hit DHS and NIH",,https://twitter.com/DavidArtGar/status/1338905243061420037
2020-12-15 17:37:14+00:00,1338900941622403074,LLRX,"DHS, State and NIH join list of federal agencies — now five —including Treasury &amp; Commerce hacked in major Russian cyber espionage campaign https://t.co/DksgYBUlYV",https://www.washingtonpost.com/national-security/dhs-is-third-federal-agency-hacked-in-major-russian-cyberespionage-campaign/2020/12/14/41f8fc98-3e3c-11eb-8bc0-ae155bee4aff_story.html?tid=ss_tw,https://twitter.com/LLRX/status/1338900941622403074
2020-12-15 17:31:14+00:00,1338899432713179136,LadybugCounting,@AdamInHTownTX @thehill Search for the press conference held by DHS Administrator Krebs; head of the cyber security agency and AG Barr. Each has acknowledged there was no voting fraud found. Each investigated at the instigation of President Trump.,,https://twitter.com/LadybugCounting/status/1338899432713179136
2020-12-15 16:31:07+00:00,1338884300423352320,Spinoff55,"@Politics_PR The DHS cyber security dir said, ""safest election ever."" AG Barr said, ""No apparent election fraud."" 50 state election boards certified their votes. Federal courts and SCOTUS said (in effect) NO evidence, NO case. 

It is tremendous - that this idiocy is coming to an end.",,https://twitter.com/Spinoff55/status/1338884300423352320
2020-12-15 16:29:00+00:00,1338883767952433159,J73Jim,"@nicoleperlroth @Lee_in_Iowa With Ron Johnson controlling DHS and Giuliani as Trump's cyber security advisor, this doesn't surprise me at all.
Those 2 clowns are a disaster waiting to create a disaster.
The Orange Cult administration is made up of the worst possible choice at every level.",,https://twitter.com/J73Jim/status/1338883767952433159
2020-12-15 16:27:19+00:00,1338883343572750343,tysonbarker,"U probably know that SolarWinds used to publish its sensitive clients online (NSA, DHS, Lockheed)... well, til this weekend. Euro clients incl the EU Parliament, Ericsson, the NHS &amp; NATO. Wonder if they're among 18K customers exposed in the SVR cyber hack  https://t.co/byhht0A6bP",https://www.bloomberg.com/news/articles/2020-12-14/u-k-government-nato-join-u-s-in-monitoring-risk-from-hack,https://twitter.com/tysonbarker/status/1338883343572750343
2020-12-15 16:11:38+00:00,1338879399677087745,JenGriffinFNC,"“On a scale of 1 to 10 this was an 11,” Morgan Wright cyber security expert at Sentinel One tells @FoxNews regarding suspected Russian govt hack that targeted DHS, Commerce, Treasury and more. https://t.co/DUyNQNsBkF",https://twitter.com/AmericaNewsroom/status/1338509662086434821,https://twitter.com/JenGriffinFNC/status/1338879399677087745
2020-12-15 15:50:08+00:00,1338873990136410120,SecuriconLLC,"Recently released: #DHS’s Homeland Threat Assessment. The report particularly calls out various cyber threats to the U.S. Find the details here. 
#Securicon #CyberSecurity #RiskManagement #SecurityExperts
https://t.co/wYuoyiMFuW https://t.co/V3WuuaGIUz",https://bit.ly/3n2oDLe,https://twitter.com/SecuriconLLC/status/1338873990136410120
2020-12-15 15:48:09+00:00,1338873487738482688,Churchofdontbea,"@Goodmoringmm @AndyOstroy @realDonaldTrump So all the judges, DOJ, US attorneys, DHS Cyber security, every election official, every sec of state and scotus?",,https://twitter.com/Churchofdontbea/status/1338873487738482688
2020-12-15 15:46:46+00:00,1338873139111940097,Mitch_Adkins,"@RadioFreeTom Interesting timing.  It was discovered yesterday that Russia breached several US databases, including DHS, exposing the largest and possibly the most dangerous cyber security attack on the US gov’t in history.",,https://twitter.com/Mitch_Adkins/status/1338873139111940097
2020-12-15 15:14:20+00:00,1338864977667530762,Annamar68161835,"@GR80701882 @davidmweissman @realDonaldTrump More like you claim you were cheated, so prove it. 59 courts found zero proof of any evidence. The AG said there was no evidence. The DHS cyber chief said the election was very secure &amp; was fired. Both Trump appointee's as were many of the Judges ruling. It's ridiculous.",,https://twitter.com/Annamar68161835/status/1338864977667530762
2020-12-15 15:00:58+00:00,1338861613563035648,DailyCaller,REPORT: DHS Officials Were Also Monitored In Suspected Russian Cyber Espionage Operation https://t.co/YeTScbIdOf,https://dailycaller.com/2020/12/14/cybersecurity-russian-hackers-dhs/,https://twitter.com/DailyCaller/status/1338861613563035648
2020-12-15 14:50:22+00:00,1338858946602229775,B52Malmet,"DHS, State and NIH join list of federal agencies — now five — hacked in major Russian cyber attack. So if this was an attack with missiles, tanks, weapons of war, would there be a response from the White House? Congress? We, the people? https://t.co/xVnCIRjqvq",https://www.washingtonpost.com/national-security/dhs-is-third-federal-agency-hacked-in-major-russian-cyberespionage-campaign/2020/12/14/41f8fc98-3e3c-11eb-8bc0-ae155bee4aff_story.html,https://twitter.com/B52Malmet/status/1338858946602229775
2020-12-15 14:41:22+00:00,1338856684442189830,RAICESTEXAS,"DHS is charged with “safeguarding the country from physical and cyber attacks” but seems to have its hands full, terrorizing &amp; persecuting immigrants...that it can’t protect itself. 🙃

https://t.co/4xMgJtLy75",https://www.washingtonpost.com/national-security/dhs-is-third-federal-agency-hacked-in-major-russian-cyberespionage-campaign/2020/12/14/41f8fc98-3e3c-11eb-8bc0-ae155bee4aff_story.html,https://twitter.com/RAICESTEXAS/status/1338856684442189830
2020-12-15 14:17:50+00:00,1338850760457654280,J73Jim,"@jimsciutto @docrocktex26 Ron Johnson is running DHS and Giuliani is Trump's Cyber security advisor.
Johnson and Giuliani couldn't find a cow in Texas. What would make you think they can catch Putin?
They make the keystone cops look like a precision drill team.",,https://twitter.com/J73Jim/status/1338850760457654280
2020-12-15 14:08:48+00:00,1338848486255702016,waspokey,@jimsciutto @gaslightingus2 Well he fired the head if DHS cyber security because his feelings were hurt. #TrumpTheFool,,https://twitter.com/waspokey/status/1338848486255702016
2020-12-15 14:02:09+00:00,1338846811457531906,JoshLadd15,"@DHS_Wolf You let corona virus into this country. And now the largest, most consequential cyber attack on the federal government on your watch too??!! Wow, Chad. JUST. WOW. 👏🤣",,https://twitter.com/JoshLadd15/status/1338846811457531906
2020-12-15 13:46:39+00:00,1338842911400714242,WicPagTimes,Doesn't sound like the DHS was very secure for a dept tasked with keeping the US secure. Maybe the GOP should have been fortifying our cyber security against russian attacks instead of kissing his a**. #GOPComplicitTraitors #trumprussia #russianron https://t.co/oMy55zTMNW,https://twitter.com/ZevShalev/status/1338563841253371915,https://twitter.com/WicPagTimes/status/1338842911400714242
2020-12-15 13:45:44+00:00,1338842683272531969,Marion_CIO,"Cyber must read... CISA issued an emergency directive late Sunday night after reported breaches at two cabinet agencies.  DHS, CISA's parent agency, also has reportedly been breached.  https://t.co/IxqlaR6wBx",https://fcw.com/articles/2020/12/14/solar-winds-hack-treasury-ntia.aspx,https://twitter.com/Marion_CIO/status/1338842683272531969
2020-12-15 13:19:11+00:00,1338836002161516546,J73Jim,"@ResistAllBigots Russia is operating their cyber operations in Venezuela and Cuba. 
Since Giuliani became Trump's cyber security advisor, Ron Johnson is  responsible for DHS security, Deripaska is working Moscow Mitch and Putin controls the WH. 
DO YOU FEEL SAFE?",,https://twitter.com/J73Jim/status/1338836002161516546
2020-12-15 13:15:03+00:00,1338834960992505856,CerberusCSC,"#DHS #hacked as part of massive #cyberattack on #federal agencies

https://t.co/D8OsZe3pcM
#Cyber #Cybersecurity #CyberAlert #Cyberwarning #FBI #Treasury #Gov #Hacker #Cybercrime #Cybergang #Cybercriminal #IT #ITsecurity #Tech #Techalert #CyberNews #IoT #CozyBear #Fraud #Cyberwar",https://thehill.com/policy/cybersecurity/530143-dhs-hacked-as-part-of-massive-nation-state-cyberattack-on-federal,https://twitter.com/CerberusCSC/status/1338834960992505856
2020-12-15 13:09:13+00:00,1338833494013702150,semipro,"If you are using any SolarWinds product, you might want to follow the cyber guidelines DHS put out regarding them -- https://t.co/XvjVESP5Jb",https://cyber.dhs.gov/ed/21-01/,https://twitter.com/semipro/status/1338833494013702150
2020-12-15 12:39:06+00:00,1338825913375526913,BravePatriot10,@adamhousley And where was the DHS during this cyber attack? When Solar Winds was being purchased by Silver Lake and Dominion funded by State Street &amp; Carlyle?,,https://twitter.com/BravePatriot10/status/1338825913375526913
2020-12-15 11:49:44+00:00,1338813490983682049,asthana_shashi,"#Cyber #Espionage #hacking new normal with new targets like  #COVID19vaccine, economic &amp; strat tgts. Many countries alleged @asthana_shashi 
DHS, State and NIH join list of federal agencies — now five — hacked in major Russian cyberespionage campaign https://t.co/eXLiNiXSnf",https://www.washingtonpost.com/national-security/dhs-is-third-federal-agency-hacked-in-major-russian-cyberespionage-campaign/2020/12/14/41f8fc98-3e3c-11eb-8bc0-ae155bee4aff_story.html?tid=ss_tw,https://twitter.com/asthana_shashi/status/1338813490983682049
2020-12-15 11:20:17+00:00,1338806078428106757,ZevShalev,"TONIGHT 7P ET / 4 PT: Special Report: ""Hack of the Century"".  Russia accessed crucial national security blueprints during a cyber attack which went unnoticed for months and penetrated the Pentagon, DHS and DOJ. w/ Alan Silberberg (@IdeaGov) Chris @VickerySec.  @narativ_live https://t.co/psKpV7ppX1",,https://twitter.com/ZevShalev/status/1338806078428106757
2020-12-15 11:15:51+00:00,1338804960406986753,LanceKern,There is no Head of Cyber Security at DHS.  Trump fired him for not supporting his claim that the election was rigged against him. https://t.co/9Q4cgmIQVt,https://twitter.com/NathanLerner/status/1338668557383692288,https://twitter.com/LanceKern/status/1338804960406986753
2020-12-15 11:15:02+00:00,1338804757348151298,LanceKern,@NathanLerner There is no Head of Cyber Security at DHS.  Trump fired him for not supporting his claim that the election was rigged against him.,,https://twitter.com/LanceKern/status/1338804757348151298
2020-12-15 10:51:21+00:00,1338798794801082368,FelixGa23300352,Your father is a rebellious coward who lost and is making jackass of his name. Your going to have to walk in shame the rest of your life for his childish game. He trying to overthrow democracy. Barr said he lost DHS said he lost cyber security says he lost electoral college same https://t.co/ZrH7rlPQ2w,https://twitter.com/newsbusters/status/1338572970269286402,https://twitter.com/FelixGa23300352/status/1338798794801082368
2020-12-15 10:45:43+00:00,1338797377168297985,e_maescott,"He’s already made several “contacts” , DHS, Pentagon, WH , Google, cyber networks all laid open by *45 https://t.co/E5Qi3flEDc",https://twitter.com/CBSNews/status/1338790779968495618,https://twitter.com/e_maescott/status/1338797377168297985
