Datetime,Tweet ID,Username,Text,Links,URL
2020-12-29 10:09:40+00:00,1343861735732736000,petfad69,House panel to consider bill to revamp DHS cyber team https://t.co/zqMwuDpaF3,https://gistsbaze.com/house-panel-to-consider-bill-to-revamp-dhs-cyber-team/,https://twitter.com/petfad69/status/1343861735732736000
2020-12-29 05:11:36+00:00,1343786725320044544,jeffreymlevy,"@TacticalLiberty @SidneyPowell1 @bmarcois You people are in a cult. The biggest liar in our history claims voter fraud when he loses the election and you believe him over 60+ judges, the AG, DHS cyber security chief, Mitch McConnell, GA Governor, GA SOS. Critical thinking is dead in the Republican Party.",,https://twitter.com/jeffreymlevy/status/1343786725320044544
2020-12-29 02:00:13+00:00,1343738561556848641,ChinaBIGIdea1,"DHS' Acting Secretary Chad Wolf disclosed that a review of Chinese entities such as TCL on basis of cyber breaches and data exfiltration, is ongoing. This was made known at a virtual event where he identified threats from China in various sectors. Details: https://t.co/QP60ffgBEw https://t.co/RfeIH77LVv",http://bit.ly/3hmT4dB,https://twitter.com/ChinaBIGIdea1/status/1343738561556848641
2020-12-29 01:22:56+00:00,1343729182304432129,postmodern_mod3,So does this mean we'll finally address Supply Chain Security? Vendors will embrace Verifiable Builds? Literally anything that addresses the weaknesses that were exploited? Or more funding for NSA/DHS/Cyber Command? https://t.co/QDwy1scqHL,https://twitter.com/ericgeller/status/1343660896296566785,https://twitter.com/postmodern_mod3/status/1343729182304432129
2020-12-29 00:26:23+00:00,1343714950984867841,Eric_Holdeman,What You Need to Know About the SolarWinds Based Cyber-Attack:  https://t.co/BUwCIL6zP3  #fema #iaem #nema #dhs #disasters #cybersecurity #cisa #solarwinds #hacked #emergencymanagement https://t.co/mtLB6aBznB,https://lnkd.in/guEtztR https://lnkd.in/gVwjAN9,https://twitter.com/Eric_Holdeman/status/1343714950984867841
2020-12-28 20:18:10+00:00,1343652481524523010,RadioCarigso20,House panel to consider bill to revamp DHS cyber team https://t.co/JnPnYtFigy,https://carigso.com/house-panel-to-consider-bill-to-revamp-dhs-cyber-team/,https://twitter.com/RadioCarigso20/status/1343652481524523010
2020-12-28 17:55:52+00:00,1343616671303536642,Bill_lorenz56,@sallyeastman1 @laurenboebert @Jali_Cat “Most secure election in US History”. Trumps appointee for cyber security at DHS,,https://twitter.com/Bill_lorenz56/status/1343616671303536642
2020-12-28 17:25:13+00:00,1343608957621981187,ignWiddy,"Domestic Terrorism statistically just “whites” are not the #1 threat to the homeland!

It’s cybersecurity threats

CHI &amp; RUS hold some of the most cultivated cyber abilities on the planet and can severely cause trillions of dollars in damages to our infrastructure

Says DHS https://t.co/r1VJUM3xx6",https://twitter.com/Stagecoach_Mary/status/1343587545070923777,https://twitter.com/ignWiddy/status/1343608957621981187
2020-12-28 15:59:03+00:00,1343587274974507008,raybobos,@laurenboebert When @POTUS's DHS cyber unit calls it the most secure election ever and numerous Trump-appointed judges including 3 SC judges rule against him you are very definitely trying to overturn the results of legit election. You are fighting against the US and for a wannabe king.,,https://twitter.com/raybobos/status/1343587274974507008
2020-12-28 15:29:35+00:00,1343579858551640065,Infosec_Tourist,@jack_daniel @hacks4pancakes I believe the term really became common usage after some DHS cyber Czar who was ex-military pushed it after some major hack(s) -pre OPM. Even at the time he emphasized that it was to address the 80% of attacks caused by low hanging fruit and was insufficient for targeted attacks.,,https://twitter.com/Infosec_Tourist/status/1343579858551640065
2020-12-28 14:18:58+00:00,1343562089466634240,WeAreNUARI,"ICYMI - @DHS awarded a total of $5.9M to NUARI to expand the DECIDE cyber-training platform offering simulation-based scenarios and exercises specific to the energy sector.

https://t.co/YAvXtcsZBO

#CyberAttack #SolarWinds #energy 

https://t.co/S4cixXHK80",https://nuari.net/decide/ https://www.dhs.gov/science-and-technology/news/2019/03/21/news-release-st-awards-59m-expand-critical-infrastructure,https://twitter.com/WeAreNUARI/status/1343562089466634240
2020-12-28 13:46:27+00:00,1343553906505379840,DumpTru79066378,"@realDonaldTrump So this dbag believes a ""young military man working in Afghanistan"" over our won DHS cyber chief who says it was the most secure election in our history?",,https://twitter.com/DumpTru79066378/status/1343553906505379840
2020-12-28 11:12:47+00:00,1343515232107433984,JA_Defence,"“Today, August 24th 2017, WikiLeaks publishes secret documents from the ExpressLane project of the CIA. These documents show one of the cyber operations the #CIA conducts against liaison services -- which includes among many others the #NSA, #DHS and the #FBI.”",,https://twitter.com/JA_Defence/status/1343515232107433984
2020-12-28 06:38:22+00:00,1343446175622586369,jmorrash1,"@MichaelBLamoth1 @HerschelWalker @SidneyPowell1 Is that the same DHS CISA director who was in charge while the greatest computer systems hack and act of cyber espionage occurred against the U.S. Govt. right undr his very nose? He's the same guy, Krebs, that declared it to be the most secure election in history, that guy? Ok..",,https://twitter.com/jmorrash1/status/1343446175622586369
2020-12-28 00:45:00+00:00,1343357247301308416,PatrickCMiller,Update: DHS Looking Into Cyber Risk from TCL Smart TVs https://t.co/ogQowLDVoI,https://j.mp/37RIkRr,https://twitter.com/PatrickCMiller/status/1343357247301308416
2020-12-28 00:18:57+00:00,1343350689431478276,Churchofdontbea,"@CalebVel88 @JumpingBoson @NowWeStandUp @PriestlyJohn @realDonaldTrump You mean except for the recounts, US Attorneys, DOJ, election officials and the DHS Cyber Security Chief.
What evidence of fraud do you have that would necessitate further investigation?",,https://twitter.com/Churchofdontbea/status/1343350689431478276
2020-12-27 23:22:04+00:00,1343336375999852545,brightooth,@bworkman2002 @KalzangP @PatrickByrne It's not inconceivable that DHS is implicated in this as well. Remember the head of the cyber security department said this was the most secure election ever?,,https://twitter.com/brightooth/status/1343336375999852545
2020-12-27 23:14:03+00:00,1343334357763821574,TheOvalPawffice,"💻 Given the severe and repeated #cyber pawttacks by traditionally hostile nation states against our #democracy in the last 4 years and during the 2016 election, we have picked brilliant #Saro as our DHS #DirectorOfInpawstructureSecurity. We already feel safer. #DOTUS #COTUS https://t.co/2ZoB3HKBPY",,https://twitter.com/TheOvalPawffice/status/1343334357763821574
2020-12-27 22:46:57+00:00,1343327537750040578,Audria_2AC_T444,"@RepKinzinger @realDonaldTrump You get paid a 6 figure salary, Kinzinger? Potential threats were thoroughly addressed &amp; EO’s put in place 2019/2020. Assigned agencies(DHS/DoD/Cyber/Energy/Intel, etc..) prevented serious harm. How did you not know this? You needed a twt? A daddy? What?",,https://twitter.com/Audria_2AC_T444/status/1343327537750040578
2020-12-27 21:34:38+00:00,1343309338329411585,GuardianJunebug,DHS Cyber Director Chris Krebs And Deputy Director Matt Travis Tied To Clapper Who Commandeered HAMMER / SCORECARD - https://t.co/M877NMaIpe via @Shareaholic,https://go.shr.lc/3kxVCWa,https://twitter.com/GuardianJunebug/status/1343309338329411585
2020-12-27 21:21:01+00:00,1343305913474625536,JA_Defence,"“Today, August 24th 2017, WikiLeaks publishes secret documents from the ExpressLane project of the #CIA. These documents show one of the cyber operations the CIA conducts against liaison services -- which includes among many others the #NSA, #DHS and the #FBI.”",,https://twitter.com/JA_Defence/status/1343305913474625536
2020-12-27 20:50:58+00:00,1343298350389477377,aprilsunshine03,"@RudyGiuliani Only you and Sydney Powell think there was any problem. Bipartisan and international observers say there was no fraud. DHS cyber security, Bill Barr, republican state governors and representatives also say there was no fraud. What you're doing is seditious.",,https://twitter.com/aprilsunshine03/status/1343298350389477377
2020-12-27 20:29:51+00:00,1343293037280161796,FredKiesche,"@Technovelgy More interesting, a “data intelligence agency”. DHS or “Homes” appears in Vinge, Gibson and Robinson in a cyber security role. First appearance of such an agency?",,https://twitter.com/FredKiesche/status/1343293037280161796
2020-12-27 14:26:20+00:00,1343201554963304454,ScrubShine,Update: DHS Looking Into Cyber Risk from TCL Smart TVs https://t.co/OkchzGQd3n via @securityledger,https://securityledger.com/2020/12/dhs-looking-into-cyber-risk-from-tcl-smart-tvs/,https://twitter.com/ScrubShine/status/1343201554963304454
2020-12-27 14:18:25+00:00,1343199561595179008,T42393252,"@AbramCurtis @jeffreymlevy @hiliks1 @JennaEllisEsq At what point should you believe there isn't fruad?Multiple judges including trump appointed judges  rule no fraud. DOJ no fraud, cyber security no fraud,DHS no fraud, AG bill barr no Fraud, GOP governor's &amp; state secretary no fraud.Trump &amp; allies lawyers in court admit no fraud",,https://twitter.com/T42393252/status/1343199561595179008
2020-12-27 14:04:41+00:00,1343196104364597249,KimmieMcIntyre,@BoSnerdley That’s exactly what former DHS senior cyber exec Keith Trippie says. And why do we let foreign companies develop/make the software for our elections. He has the answer if you want him on the show.,,https://twitter.com/KimmieMcIntyre/status/1343196104364597249
2020-12-26 23:54:07+00:00,1342982051922755585,RichieT2018,@realDonaldTrump There is no proof. All you have tweeted are hypotheticals and hearsay. Repub paid Int Org watching the election said it was fair. Head of DHS cyber security said it was fair. ONLY people said it was fraud are Trumpers. All courts said there was nothing to fraud claims. 59 cases.,,https://twitter.com/RichieT2018/status/1342982051922755585
2020-12-26 23:08:48+00:00,1342970647635484675,Audria_2AC_T444,"@ProjectLincoln This was false when you FIRST posted this BS. Your “Project” is doing a great disservice to masses of people. RE Waja post: potential threats were thoroughly addressed &amp; EO’s put in place 2019/2020. Assigned agencies(DHS/DoD/Cyber/Energy/Intel, etc..) prevented serious harm.",,https://twitter.com/Audria_2AC_T444/status/1342970647635484675
2020-12-26 21:15:27+00:00,1342942123428089856,cornichecorp,Update: DHS Looking Into Cyber Risk from TCL Smart TVs #Infosec #security via https://t.co/KDUhFaFE1M https://t.co/eoGrla14Ue,http://twinybots.ch https://securityledger.com/2020/12/dhs-looking-into-cyber-risk-from-tcl-smart-tvs/,https://twitter.com/cornichecorp/status/1342942123428089856
2020-12-26 20:43:17+00:00,1342934028576550913,TestingInWNC,Update: DHS Looking Into Cyber Risk from TCL Smart TVs | The Security Ledger https://t.co/eQOb3KCoQL,http://ow.ly/DTzC30rqc7e,https://twitter.com/TestingInWNC/status/1342934028576550913
2020-12-26 17:42:55+00:00,1342888637608972289,heretictrance,Update: DHS Looking Into Cyber Risk from TCL Smart TVs https://t.co/z2DMCJ8yNh via @securityledger,https://securityledger.com/2020/12/dhs-looking-into-cyber-risk-from-tcl-smart-tvs/,https://twitter.com/heretictrance/status/1342888637608972289
2020-12-26 17:28:34+00:00,1342885028238413827,cryptallergy,"@Mizzer17 @maliburoadlive @Jholtwareagle @robbystarbuck @realDonaldTrump The problem is the money count isn’t off. There are no fake ballots . There were no software switched votes . All the data has been looked at by judges , Trump appointed DOJ , DHS , Republican election officials , cyber security officials. Maybe the data you’re looking at is off",,https://twitter.com/cryptallergy/status/1342885028238413827
2020-12-26 14:39:37+00:00,1342842508200579072,cryptallergy,"@srinivasapram21 @Brian2277 @Aaron15284777 @Candour99 @realDonaldTrump The DOJ is , cyber security officials were , DHS was , several of the judges were. And Trump got many of those politicians elected by backing them , including the GA ones. So yeah , there’s that",,https://twitter.com/cryptallergy/status/1342842508200579072
2020-12-26 14:22:04+00:00,1342838092210851840,Churchofdontbea,"@james_hoosier @SusanPaRN321 @beavis617 @realDonaldTrump I’ve seen no evidence of this crime. Neither has any judge, FBI, DOJ, DHS, Cyber security, US Attorney, election official or Supreme Court justice.",,https://twitter.com/Churchofdontbea/status/1342838092210851840
2020-12-26 14:15:48+00:00,1342836512963125248,cryptallergy,"@srinivasapram21 @Aaron15284777 @Brian2277 @Candour99 @realDonaldTrump Recounts were already done. Officials on both sides say there was no wrong doing. You can choose to not believe the FBI , DOJ , TRUMP APPOINTED BTW. You can ignore the DHS Cyber security officials . Also Trump appointed . And you can choose to only believe Trump. But it’s over .",,https://twitter.com/cryptallergy/status/1342836512963125248
2020-12-26 14:09:09+00:00,1342834842707374081,cryptallergy,"@srinivasapram21 @Aaron15284777 @Brian2277 @Candour99 @realDonaldTrump Because the DOJ , DHS , Cyber security officials , Republican election officials ALL HAVE SAID NO EVIDENCE OF FRAUD. But I guess those don’t count ? Maybe Trump should be judge and jury ?",,https://twitter.com/cryptallergy/status/1342834842707374081
2020-12-25 23:42:57+00:00,1342616855236681728,adrian_quirarte,$OPRT DHS is reviewing entities such as the Chinese Television manufacturer TCL. The third-largest TV manufacturer in the world. Discovered was that backdoors were incorporated into all its TV sets exposing users to cyber breaches and data exfiltration.  https://t.co/ZsatF8vQmk,https://securityledger.com/2020/12/dhs-looking-into-cyber-risk-from-tcl-smart-tvs/,https://twitter.com/adrian_quirarte/status/1342616855236681728
2020-12-25 23:23:21+00:00,1342611923582390273,realCoyotay,"Everything going on right now with the cyber war, the emphasis on DoE hack, companies that make tech for DHS, etc-

I'm curious if this was an attack on critical infrastructure. Maybe a test. Look at the cell carriers. #Nashville #nashvillebombing #nashvilleexplosion https://t.co/JOihPUOcqE",,https://twitter.com/realCoyotay/status/1342611923582390273
2020-12-25 21:20:00+00:00,1342580880578117635,TheIOGuy,@Imladrisx @FPWellman Too little info to determine at the moment. BUT looking at the node and the other 6 data centers affected; DHS will need to step in fast. Observe other systems for immediate cyber attack that may not be as well defended.,,https://twitter.com/TheIOGuy/status/1342580880578117635
2020-12-25 18:24:27+00:00,1342536702867464195,LegalProud,"@sweetbillyv @BiscAnenome @Nostradonny @realDonaldTrump 0.1 or less percent of fraud, even if it’s any!!

that’s not my estimate, that’s proven #fact from DOJ, DHS’s cyber arm, your own Bill Barr, your own SCOTUS and many many more..

stop playing and start #AcceptFacts 🍻",,https://twitter.com/LegalProud/status/1342536702867464195
2020-12-25 11:31:58+00:00,1342432897270075392,dhowes3,"@HandlesLiberty @OANN DHS, Donald J Trumps own administration cyber security division said there was no fraud or irregularities and interference. Donald's the man and their his men.",,https://twitter.com/dhowes3/status/1342432897270075392
2020-12-25 11:15:46+00:00,1342428821220257792,dhowes3,"@HandlesLiberty @OANN The DHS did that. That's their job cyber security. That's why all this machine conspiracy theories fall apart.All these people,Foxnews as well, who accuse the machines makers and the machines are backing off.Because the makers are suing. The conspiracy theories have no evidence.",,https://twitter.com/dhowes3/status/1342428821220257792
2020-12-25 06:51:31+00:00,1342362317900668929,twitcontest,"@espyquearr @ClickSte @realDonaldTrump DHS cyber security chief declared it secure. Then Trump fired him. There was no evidence of fraud presented in Trump’s 59 failed lawsuits.
The more you learn about ballot protections, the more you see election fraud here is nearly impossible to pull off. 6 or 7 layers of checks.",,https://twitter.com/twitcontest/status/1342362317900668929
2020-12-25 01:23:30+00:00,1342279771489792006,Third_Witness,"@TBearclaw79 @EdwardSurett @rickrushton @realDonaldTrump All 59 cases that Trump lost were filed in favour of trying to overturn the election for Trump, and all have failed. Trump appointed Bill Barr (DoJ), Christopher Wray (FBI), Chad Wolf (DHS), and Chris Krebs (DHS Cyber). If they are corrupt, then it’s Trump’s fault for hiring them",,https://twitter.com/Third_Witness/status/1342279771489792006
2020-12-25 01:21:17+00:00,1342279212439199744,YollieGlatfelt6,"DHS Sec Chad Wolf &amp; FCC Chairrman James Trainer  ,Cyber Sec Chris Krebbs both admitted now that this election is illigetimat &amp; was hacked by foreign countries &amp; Powell will  seized those machines .",,https://twitter.com/YollieGlatfelt6/status/1342279212439199744
2020-12-25 00:00:56+00:00,1342258992438009856,Stormy22999687,"@YogaRoots @VerityPace @BenKTallmadge Wow you've had to much trump kool-aid,. It was trumps FBI, DHS, JUDGES, DOJ, CYBER SECURITY.   THERE WAS NO EVIDENCE.  EVEN GUILIANI SAID IN COURT IT WASNT A FRAUD CASE.  GROW THE HELLUP, USE YOUR DAMN BRAIN.",,https://twitter.com/Stormy22999687/status/1342258992438009856
2020-12-24 21:48:48+00:00,1342225740826177536,mikebaudy,"@realDonaldTrump Not according to over 60 courts incl the SCOTUS.
Not according to Bill Bar
Not according to your own cyber security team at DHS
Not according to 50 state election boards that certified their elections.

You are the Fraud.
You are the fake",,https://twitter.com/mikebaudy/status/1342225740826177536
2020-12-24 21:41:29+00:00,1342223896984965120,Open_Demo,"@DHS_Wolf @MITREcorp Any comment about the Russian cyber hack? Or being in your position illegally? Maybe the ongoing coup attempt? 

No.",,https://twitter.com/Open_Demo/status/1342223896984965120
2020-12-24 21:07:04+00:00,1342215237949394950,Dave64P,"@incomemadeeasy @news_ntd .@incomemadeeasy 
What? didn't you read the last two @ODNIgov &amp; DHS's  World Wide Threat Assessments? 
1) 2019 https://t.co/XFuyRhU58h 
2) 2020 https://t.co/wC8uYq14RW Both noted that both the RF &amp; Iran posses a threat to national security including cyber activity.",https://www.dni.gov/files/ODNI/documents/2019-ATA-SFR---SSCI.pdf https://www.dhs.gov/sites/default/files/publications/2020_10_06_homeland-threat-assessment.pdf,https://twitter.com/Dave64P/status/1342215237949394950
2020-12-24 19:25:02+00:00,1342189561083002880,Treadstone71LLC,NATIONAL INITIATIVE FOR CYBERSECURITY CAREERS AND STUDIES #NICCS #DHS #CISA #Cyber #Intelligence #Training #Courses fall sale - Fall Sale on online courses - Cyber Intel Maturity Assessment https://t.co/4fukyzZMKz,http://ow.ly/IpWu30rpxX6,https://twitter.com/Treadstone71LLC/status/1342189561083002880
2020-12-24 18:05:06+00:00,1342169442302763009,Treadstone71LLC,National Initiative for Cyber Security Careers and Studies - US-Cert #CISA #DHS #US #GOV #Cyber #Intelligence #CyberCounterIntelligence #Training https://t.co/TkLE2OGugi,http://ow.ly/sUeB30rpxX4,https://twitter.com/Treadstone71LLC/status/1342169442302763009
2020-12-24 16:13:10+00:00,1342141276712562688,GMUBillJohnson,"We don't have a confirmed Secretary of DOJ, DOD, or DHS, DOD funding is hanging on a veto override, vaccine distribution is behind schedule, a massive Russian cyber attack has still not been addressed....and POTUS is playing golf again... becasue one must have priorities. https://t.co/3bOcNoNnVX",https://twitter.com/hugolowell/status/1342132660764864513,https://twitter.com/GMUBillJohnson/status/1342141276712562688
2020-12-24 16:07:03+00:00,1342139734081097732,hkanji,Shit @robk. These are our TVs in the @hoxtonventures office. The acting head of the U.S. DHS said the agency was assessing the cyber risk of smart TVs sold by the Chinese electronics giant TCL https://t.co/eUs1OGr5qL,https://slashdot.org/?page=2,https://twitter.com/hkanji/status/1342139734081097732
2020-12-24 04:59:13+00:00,1341971669066207232,AliN03520580,"@dowchang @mike_wanaoni @realDonaldTrump Lies. In Georgia, they've verified the votes twice. The courts, Trump's appointed judges, Bill Barr's DOJ, Chris Krebs + the DHS' cyber security unit, Republican governors &amp; secretaries of state, and even Rudy G. admitted in court that there was NO fraud.",,https://twitter.com/AliN03520580/status/1341971669066207232
2020-12-24 03:11:08+00:00,1341944471324418054,zabe63,@realDonaldTrump You're living in a fool's paradise your own cyber security branch of DHS has already blown your own arguments,,https://twitter.com/zabe63/status/1341944471324418054
2020-12-24 03:07:15+00:00,1341943494496178183,LLRX,"The acting head of DHS said the agency was assessing the cyber risk of smart TVs sold by Chinese electronics giant TCL, following reports last month in The Security Ledger and elsewhere that the devices may give company “back door” access to deployed sets https://t.co/4Sd2paKoHq",https://securityledger.com/2020/12/dhs-looking-into-cyber-risk-from-tcl-smart-tvs/,https://twitter.com/LLRX/status/1341943494496178183
2020-12-24 01:24:39+00:00,1341917674817933312,HRRevels1,"Trump pardons murderers and other criminals - but vetoes the national defense bill.

To be clear: Trump &amp; GOP *defunded the Military &amp; DHS* 

Context: the largest cyberespionage attack against us is still ongoing.  Cyber Command is DoD.  CISA is DHS.",,https://twitter.com/HRRevels1/status/1341917674817933312
2020-12-23 23:24:03+00:00,1341887324225818625,jrimer2008,"Cyber scoop DHS warns US businesses of China’s data-collection practices: As Washington is absorbed with the fallout of a suspected Russian hacking operation against U.S. organizations, the Department of Homeland Security is warning… https://t.co/PF7Qw06TY5 Check it out! https://t.co/Qsw6gm8DGV",http://dlvr.it/RpFMZl,https://twitter.com/jrimer2008/status/1341887324225818625
2020-12-23 21:17:01+00:00,1341855352804044801,ChrisShort,Recommended Read: DHS Looking Into Cyber Risk from TCL Smart TVs https://t.co/9FF75MkHOf #devopsish,https://securityledger.com/2020/12/dhs-looking-into-cyber-risk-from-tcl-smart-tvs/,https://twitter.com/ChrisShort/status/1341855352804044801
2020-12-23 20:30:10+00:00,1341843565580840961,TheNewOil1,"DHS Looking Into Cyber Risk from #TCL Smart TVs

https://t.co/lcCJp0KvxV",https://securityledger.com/2020/12/dhs-looking-into-cyber-risk-from-tcl-smart-tvs/,https://twitter.com/TheNewOil1/status/1341843565580840961
2020-12-23 19:57:45+00:00,1341835406468374529,KateLizMcLaren,Cyber leaders back Biden’s DHS pick - POLITICO - https://t.co/PeD2DoefYC,https://www.politico.com/newsletters/weekly-cybersecurity/2020/12/21/cyber-leaders-back-bidens-dhs-pick-792428,https://twitter.com/KateLizMcLaren/status/1341835406468374529
2020-12-23 18:00:06+00:00,1341805796464742401,Cyber_DueDil,"DHS warns against using Chinese @
#hardware and digital services | ZDNet https://t.co/agFIDhcwV4
Via @campuscodi @ZDNet",https://www.zdnet.com/article/dhs-warns-against-using-chinese-hardware-and-digital-services/,https://twitter.com/Cyber_DueDil/status/1341805796464742401
2020-12-23 17:53:00+00:00,1341804010240544768,scott_templer,DHS Looking Into Cyber Risk from TCL Smart TVs https://t.co/212eMmMx9Z via @securityledger,https://securityledger.com/2020/12/dhs-looking-into-cyber-risk-from-tcl-smart-tvs/,https://twitter.com/scott_templer/status/1341804010240544768
2020-12-23 17:30:43+00:00,1341798402225520643,PrivacyDigest,"DHS Looking Into Cyber Risk from TCL Smart TVs-Security Ledger

“This year it was discovered that TCL incorporated backdoors into all of its TV sets exposing users to cyber breaches and data exfiltration. TCL also receives CCP state support to compete...” https://t.co/WGe4aghSt5",https://securityledger.com/2020/12/dhs-looking-into-cyber-risk-from-tcl-smart-tvs/,https://twitter.com/PrivacyDigest/status/1341798402225520643
2020-12-23 16:32:43+00:00,1341783806035062785,BrvHrt09,@selectedwisdom Is ANYONE in Biden’s Admin realizing &amp; preparing for next required restructuring of FBI &amp; DHS? After 9/11 the focus of the US gov’t changed (to detriment of other threats) to Islamist &amp; foreign terrorism. In 2020 US must 🎯Extremist groups &amp; Cyber warfare (not mutually exclusive),,https://twitter.com/BrvHrt09/status/1341783806035062785
2020-12-23 16:24:00+00:00,1341781613953298437,RMCholewa,#DHS Looking Into #Cyber Risk from #TCL #SmartTVs https://t.co/dPtJnL3E83,https://buff.ly/3mKU8Je,https://twitter.com/RMCholewa/status/1341781613953298437
2020-12-23 16:08:13+00:00,1341777641561600000,bigmoof,"DHS Looking Into Cyber Risk from TCL Smart TVs | The Security Ledger

Even a TV from China State run company can be a security risk. https://t.co/6YXgwmOs77",https://securityledger.com/2020/12/dhs-looking-into-cyber-risk-from-tcl-smart-tvs/?fbclid=IwAR3Eahjyo60EQ0ly2ZwpuYN5Xidnb6viVSxYYK3qQ7PbJrzi_xLcbELQBX8,https://twitter.com/bigmoof/status/1341777641561600000
2020-12-23 16:05:07+00:00,1341776863815983106,Treadstone71LLC,National Initiative for Cyber #Security Careers and Studies - US-Cert #CISA #DHS #US #GOV #CyberIntelligence #CyberCounterIntelligence #Training https://t.co/usp80v16cl,http://ow.ly/nK0v30rpxX7,https://twitter.com/Treadstone71LLC/status/1341776863815983106
2020-12-23 15:48:47+00:00,1341772751615500289,dchambersDPM,"Sheesh, China.

""DHS Looking Into Cyber Risk from TCL Smart TVs | The Security Ledger"" https://t.co/DaKvrPYZuU",https://securityledger.com/2020/12/dhs-looking-into-cyber-risk-from-tcl-smart-tvs/amp/,https://twitter.com/dchambersDPM/status/1341772751615500289
